headline,date,doc_type,type_of_material,snippet,source,news_desk,section_name,keywords
Listening Closely to the Birds,2020-09-23,article,News,What comprises the soundscape where you are?,The New York Times,AtHome,At Home,['Quarantine (Life and Culture)']
TikTok Files for Injunction to Stop Ban of App,2020-09-23,article,News,"While President Trump has blessed a deal for TikTok, the video app filed to stop a ban of its service that is set to go into effect on Sunday.",The New York Times,Business,Technology,"['Mobile Applications', 'Mergers, Acquisitions and Divestitures', 'Social Media', 'Executive Orders and Memorandums', 'Computers and the Internet', 'United States Politics and Government']"
Biden Gives Cautious Answers on Breonna Taylor and the Supreme Court,2020-09-23,article,News,"Asked by reporters about two issues of deep importance to Democrats, the party’s nominee was circumspect. The Biden campaign later released a fuller statement about Ms. Taylor.",The New York Times,Politics,U.S.,"['Presidential Election of 2020', ""Women's Rights"", 'ABORTION', 'Appointments and Executive Changes', 'United States Politics and Government', 'Black People', 'Blacks']"
Trump says he wants a conservative majority on the Supreme Court in case of an Election Day dispute.,2020-09-23,article,News,,The New York Times,Politics,U.S.,['United States Politics and Government']
A Capital Engulfed by Sadness and Rage,2020-09-23,article,News,"While Justice Ruth Bader Ginsburg was alive, the prospect of an epic political and cultural battle was averted. But her death has brought a particular whiplash of sorrow and anger to Washington.",The New York Times,Washington,U.S.,"['United States Politics and Government', 'Presidential Election of 2020', 'Funerals and Memorials']"
Americans Have Lost $145 Million to Coronavirus Fraud,2020-09-23,article,News,"More than 200,000 complaints of scams and fraud have been filed so far this year, data from the Federal Trade Commission shows.",The New York Times,Express,U.S.,"['Coronavirus (2019-nCoV)', 'Frauds and Swindling', 'Identity Theft', 'Rumors and Misinformation', 'Elderly', 'Content Type: Service']"
Trump Turns Attack on MSNBC Journalist Into Rally Fodder,2020-09-23,article,News,"At multiple campaign stops, the president has gotten laughs by inaccurately recounting Ali Velshi’s being hit by a rubber bullet while covering a protest.",The New York Times,Business,Business Day,"['News and News Media', 'United States Politics and Government', 'George Floyd Protests (2020)']"
Arthur Sulzberger Jr. to Retire as New York Times Company Chairman,2020-09-23,article,News,A changing of the guard is complete as he steps back from the board of the news organization he led to 61 Pulitzer Prizes.,The New York Times,Business,Business Day,"['Appointments and Executive Changes', 'News and News Media', 'Newspapers', 'Boards of Directors']"
E.U. Offers Cash and More Deportations in New Plan for Migrants,2020-09-23,article,News,"The bloc wants to persuade its most anti-immigrant member countries to agree to a common policy. But the future of its new plan, like many of its details, remains uncertain.",The New York Times,Foreign,World,"['Middle East and Africa Migrant Crisis', 'Immigration and Emigration', 'Refugees and Displaced Persons', 'Asylum, Right of']"
"Argentina Spied on Families of Lost Submarine Crew, Officials Say",2020-09-23,article,News,"The families had grown angry at the former government for delaying the search operation and giving them what turned out to be false hope. Now, the new government says spies tracked the families.",The New York Times,Foreign,World,"['Submarines and Submersibles', 'Maritime Accidents and Safety']"
Beaked Whale Shatters Record With 3 Hour 42 Minute Dive,2020-09-23,article,News,Scientists still don’t know how the marine mammals go so long without air.,The New York Times,Science,Science,"['Whales and Whaling', 'Diving and Divers', 'Animal Behavior', 'Mammals', 'Fish and Other Marine Life', 'Biology and Biochemistry', 'Oceans and Seas', 'ANATOMY AND PHYSIOLOGY', 'Marine Biology', 'Research', 'your-feed-science', 'your-feed-animals']"
Homeland Security Chief Denies Downplaying White Supremacist Threat,2020-09-23,article,News,"Chad Wolf, the acting secretary of homeland security, defended his record at a Senate confirmation hearing and flatly denied he suppressed intelligence that could have embarrassed President Trump.",The New York Times,Washington,U.S.,"['United States Politics and Government', 'Cyberwarfare and Defense', 'Fringe Groups and Movements', 'Right-Wing Extremism and Alt-Right']"
"What Is ‘Wanton Endangerment,’ the Charge in the Breonna Taylor Case?",2020-09-23,article,News,Here’s what is behind the charge leveled by a Kentucky grand jury against one of the officers involved in the fatal raid on Ms. Taylor’s apartment in March.,The New York Times,National,U.S.,"['Murders, Attempted Murders and Homicides', 'Police Brutality, Misconduct and Shootings', 'Crime and Criminals']"
Can You Advise if You’ve Already Consented?,2020-09-23,article,News,"Sure, most Senate Republicans will approve President Trump’s Supreme Court nominee. But they seem to have already done so, without a name.",The New York Times,Politics,U.S.,"['Appointments and Executive Changes', 'United States Politics and Government', 'Presidential Election of 2020']"
100 N.Y.C. School Buildings Have Already Reported a Positive Case,2020-09-23,article,News,"Nearly all the buildings remained open, following city guidelines that say only those schools with two cases in different classrooms will shut.",The New York Times,Metro,New York,"['Coronavirus (2019-nCoV)', 'Education (K-12)', 'Contact Tracing (Public Health)', 'Teachers and School Employees', 'Shutdowns (Institutional)', 'Education (Pre-School)', 'Coronavirus Reopenings', 'Disease Rates']"
F.D.A. Requires Stronger Warning Label for Xanax and Similar Drugs,2020-09-23,article,News,"Benzodiazepines — commonly prescribed for anxiety, insomnia, seizures and panic disorders — are highly addictive and come with health risks, especially when combined with other drugs.",The New York Times,Science,Health,"['Drug Abuse and Traffic', 'Drugs (Pharmaceuticals)', 'Mental Health and Disorders', 'Opioids and Opiates', 'your-feed-healthcare']"
Trump Nominates Former Nunes Aide to Intelligence Watchdog Post,2020-09-23,article,News,The president fired the official who previously held the job and had played a key role in telling lawmakers about the whistle-blower complaint that prompted impeachment proceedings.,The New York Times,Washington,U.S.,"['Trump-Ukraine Whistle-blower Complaint and Impeachment Inquiry', 'Espionage and Intelligence Services', 'Appointments and Executive Changes', 'Inspectors General', 'United States Politics and Government', 'Ethics and Official Misconduct']"
Ginsburg Clerks Remember Her as a Mentor Who Treated Them Like Family,2020-09-23,article,News,"With birthday cakes, baby clothes, meticulous edits and high standards, Justice Ruth Bader Ginsburg forged a personal bond with her clerks that transcended the legal profession.",The New York Times,Washington,U.S.,"['Legal Profession', 'Families and Family Life', 'United States Politics and Government']"
"Trump May Reject Tougher F.D.A. Vaccine Standards, Calling Them ‘Political’",2020-09-23,article,News,"In suggesting he might reject tougher guidelines, President Trump once again undermined efforts by government scientists to bolster public confidence in their work.",The New York Times,Washington,U.S.,"['Coronavirus (2019-nCoV)', 'Masks', 'United States Politics and Government', 'Vaccination and Immunization', 'Presidential Election of 2020']"
Chief Executive of Embattled Alaskan Mine Project Resigns,2020-09-23,article,News,"The executive made “offensive” remarks about the state’s political leaders, the company said, in meetings recorded by an environmental group.",The New York Times,Climate,Climate,"['Mines and Mining', 'Appointments and Executive Changes', 'Regulation and Deregulation of Industry', 'United States Politics and Government']"
Fired Officer Is Indicted in Breonna Taylor Case; Protesters Wanted Stronger Charges,2020-09-24,article,News,A former officer was charged with “wanton endangerment” for endangering Ms. Taylor’s neighbors with gunshots when she was killed by police officers in her Louisville apartment.,The New York Times,National,U.S.,"['Police Brutality, Misconduct and Shootings', 'Black Lives Matter Movement', 'George Floyd Protests (2020)', 'Demonstrations, Protests and Riots']"
Ginsburg Remembered as Champion of Justice as Struggle Continues Over Her Successor,2020-09-24,article,News,"Long lines of mourners waited outside the Supreme Court to pay their respects, but President Trump again made clear he would not honor her dying wish that filling her seat wait until the next president was chosen.",The New York Times,Washington,U.S.,"['United States Politics and Government', 'Presidential Election of 2020', ""Women's Rights"", 'Funerals and Memorials', 'Capitol Building (Washington, DC)', 'Patient Protection and Affordable Care Act (2010)', 'ABORTION', 'Appointments and Executive Changes']"
Trump Won’t Commit to ‘Peaceful’ Post-Election Transfer of Power,2020-09-24,article,News,"In response to a question, the president complained about mail-in ballots and said: “There won’t be a transfer, frankly. There will be a continuation.”",The New York Times,Washington,U.S.,"['Presidential Election of 2020', 'United States Politics and Government', 'Absentee Voting']"
"Nothing Eats Viruses, Right? Meet Some Hungry Protists",2020-09-24,article,News,New genetic evidence builds the case that single-celled marine microbes might chow down on viruses.,The New York Times,Science,Science,"['Microbiology', 'Viruses', 'Oceans and Seas', 'Research', 'your-feed-science', 'Fish and Other Marine Life']"
North Korea Accused of Shooting and Burning South Korean Defector,2020-09-24,article,News,"The body of the fisheries official was set ablaze in the North’s waters for fear he was carrying the coronavirus, South Korean officials said.",The New York Times,Foreign,World,"['Defense and Military Forces', 'Murders, Attempted Murders and Homicides', 'Coronavirus (2019-nCoV)']"
A Manila Barbershop’s Mirrors Reflect the Pain of the Pandemic,2020-09-24,article,News,"Seven months since the Philippines enacted its first lockdown, Jolog’s Barbershop exemplifies the toll the coronavirus has exacted on the country in lost lives, income and sense of community.",The New York Times,Foreign,World,"['Coronavirus (2019-nCoV)', 'Barbers and Barbering', 'Deaths (Fatalities)', 'Recession and Depression']"
"Even as Virus Surges, Hungary Forges Ahead With Super Cup Soccer Game",2020-09-24,article,News,Bayern Munich and Sevilla battled for the European trophy in Budapest despite growing concerns over fan safety.,The New York Times,Foreign,World,"['Soccer', 'Coronavirus (2019-nCoV)', 'Stadiums and Arenas']"
Night Images Reveal Many New Detention Sites in China’s Xinjiang Region,2020-09-24,article,News,"China said it was winding down its “re-education” camps for Uighurs and other minorities, but researchers found evidence that incarceration is on the rise.",The New York Times,Foreign,World,"['Uighurs (Chinese Ethnic Group)', 'Political Prisoners', 'Forced Labor', 'Human Rights and Human Rights Violations', 'War Crimes, Genocide and Crimes Against Humanity', 'Muslims and Islam']"
"Israel Tightens Holiday Lockdown, Restricting Prayers and Protests",2020-09-24,article,News,"Israel now has one of the world’s worst outbreaks of the coronavirus, but the government’s response has gotten mired in political and cultural wars.",The New York Times,Foreign,World,"['Coronavirus (2019-nCoV)', 'Shutdowns (Institutional)', 'Politics and Government', 'Yom Kippur', 'Demonstrations, Protests and Riots']"
A Manly Response to Disease,2020-09-24,article,News,A conventional model of masculinity inhibits some men from expressing their emotional responses to assaults on the body.,The New York Times,Well,Well,"['Bladder Cancer', 'Men and Boys', 'Bladder']"
"Accustomed to Helping Others, They Now Find Themselves in Need",2020-09-24,article,News,"In pandemic’s grip, concerns about food insecurity are compounded for older Americans.",The New York Times,Neediest,Neediest Cases,[]
This Is the Casual Racism That I Face at My Elite High School,2020-09-24,article,News,"Unexpectedly, the school did something about it.",The New York Times,Metropolitan,New York,"['Private and Sectarian Schools', 'Black People', 'Blacks', 'Discrimination']"
"Even When They Lost Their Jobs, Immigrants Sent Money Home",2020-09-24,article,News,Predictions were that immigrants would stop sending money home when the coronavirus took their jobs. But that did not take into account how determined foreign workers were to help their families.,The New York Times,National,U.S.,"['Foreign Workers', 'Immigration and Emigration', 'Remittances', 'Labor and Jobs', 'Coronavirus (2019-nCoV)']"
Whole Foods Founder: ‘The Whole World Is Getting Fat’,2020-09-24,article,News,"John Mackey, who espouses a high-minded version of capitalism, sold his upscale grocery chain to Amazon.",The New York Times,SundayBusiness,Business Day,"['Supermarkets and Grocery Stores', 'Capitalism (Theory and Philosophy)', 'Food', 'Executives and Management (Theory)', 'Corporate Social Responsibility']"
"Beyond the Pandemic, Libraries Look Toward a New Era",2020-09-24,article,News,"With a shift to online resources well underway, “the most trusted civic institutions” are in a good position to deal with the changing future.",The New York Times,SpecialSections,Business Day,"['Libraries and Librarians', 'Coronavirus (2019-nCoV)', 'Books and Literature', 'Computers and the Internet', 'E-Books and Readers', 'ARCHITECTURE', 'Book Trade and Publishing']"
The Future of Airbnb,2020-09-24,article,News,"Home-sharing’s challenges aren’t only about social distancing and hygiene. Overtourism, racial bias, fee transparency and controlling the party crowd are also in the mix.",The New York Times,Travel,Travel,"['Coronavirus (2019-nCoV)', 'Travel and Vacations', 'Hotels and Travel Lodgings', 'Coronavirus Reopenings']"
U.S. Prepares to Take Sudan Off List of States That Support Terrorism,2020-09-24,article,News,"Coming before the election, the move would give President Trump another chance to broker diplomacy on Israel’s behalf. But it could be at the cost of compensation for terrorism victims.",The New York Times,Washington,U.S.,"['United States International Relations', 'Terrorism', 'Cole (USS)', 'Diplomatic Service, Embassies and Consulates']"
"A Quadriplegic, a Specialty Van and a Lifetime of Adventures",2020-09-24,article,News,"A biking accident left Kirk Williams paralyzed, but he has traveled widely and inspired others to follow in his tire tracks.",The New York Times,Business,Business Day,"['Disabilities', 'Vans', 'Wheelchairs']"
Few Police Officers Who Cause Deaths Are Charged or Convicted,2020-09-24,article,News,A wide gulf remains between the public perception of police violence and how it is treated in court.,The New York Times,National,U.S.,"['Police Brutality, Misconduct and Shootings']"
"In Politically Charged Inquiry, Durham Sought Details About Scrutiny of Clintons",2020-09-24,article,News,"John Durham’s team has sought information about the F.B.I.’s handling of the Clinton Foundation investigation, raising questions about the scope of the prosecutor’s review.",The New York Times,Washington,U.S.,"['Special Prosecutors (Independent Counsel)', 'Russian Interference in 2016 US Elections and Ties to Trump Associates', 'Presidential Election of 2016', 'Presidential Election of 2020', 'United States Politics and Government', 'Classified Information and State Secrets', 'Wiretapping and Other Eavesdropping Devices and Methods', 'Cyberwarfare and Defense', 'Corruption (Institutional)']"
"Trump Faces Challenges Even in Red States, Poll Shows, as Women Favor Biden",2020-09-24,article,News,"Close races in Georgia, Iowa and Texas show President Trump’s vulnerability and suggest that Joseph Biden has assembled a formidable coalition, according to a New York Times/Siena College poll.",The New York Times,Politics,U.S.,"['Presidential Election of 2020', 'Polls and Public Opinion', 'Voting and Voters', 'Women and Girls', 'United States Politics and Government']"
What Will It Take to Vote in Milwaukee?,2020-09-24,article,News,The coronavirus has added strain to Wisconsin voters already facing challenges to ballot access.,The New York Times,Politics,U.S.,"['Voter Registration and Requirements', 'Presidential Election of 2020', 'Coronavirus (2019-nCoV)', 'Black People', 'Blacks', 'Absentee Voting', 'Content Type: Service', 'United States Politics and Government', 'Hispanic-Americans']"
Home Sales Surge in Brooklyn,2020-09-24,article,News,"Six months into the pandemic, inventory is up in Manhattan while buyers are heading to Brooklyn for more space and lower prices.",The New York Times,RealEstate,Real Estate,"['Real Estate and Housing (Residential)', 'Quarantine (Life and Culture)']"
Stalled Talks Over Covid-19 Stimulus in the U.S. Show Signs of Life,2020-09-24,article,News,It was far from clear that Republican and Democratic negotiators would be able to reach a deal. Rio de Janeiro’s annual Carnival parade will be delayed for the first time in decades.,The New York Times,Foreign,World,['Coronavirus (2019-nCoV)']
"As Virus Cases Surge in Europe, Hospitalizations Lag. But for How Long?",2020-09-24,article,News,"For now, countries are betting they can suppress hospital admissions and deaths without imposing more lockdowns, even as case numbers approach peak levels from last spring.",The New York Times,Foreign,World,"['Coronavirus (2019-nCoV)', 'Disease Rates', 'Hospitals', 'Quarantines']"
YouTube Tries Again to Amplify Accurate Voting Information,2020-09-24,article,News,Tech platforms have struggled to keep false and misleading information about mail-in ballots off their services.,The New York Times,Business,Technology,"['Rumors and Misinformation', 'Absentee Voting', 'Social Media', 'United States Politics and Government', 'Computers and the Internet', 'Presidential Election of 2020']"
"To Fight Apple and Google, Smaller App Rivals Organize a Coalition",2020-09-24,article,News,"Spotify, Match Group, Epic Games and others have created a nonprofit alliance that they hope will amplify a protest against the power of the giants.",The New York Times,Business,Technology,"['Mobile Applications', 'Computers and the Internet', 'Mobile Commerce and Payments', 'Software', 'Antitrust Laws and Competition Issues', 'Computer and Video Games', 'Smartphones']"
"The Race for Iowa, Georgia and Texas",2020-09-24,article,News,A Times poll shows Biden and Trump neck and neck in three states: This is your morning tip sheet.,The New York Times,Politics,U.S.,['Polls and Public Opinion']
Hong Kong Police Arrest Activist for Violating 2019 Mask Ban,2020-09-24,article,News,"Joshua Wong, one of Hong Kong’s most visible pro-democracy activists, suggested that the authorities had political motives for charging him, at a time when the coronavirus has made mask-wearing ubiquitous.",The New York Times,Foreign,World,"['Demonstrations, Protests and Riots', 'Masks', 'Hong Kong Protests (2019)', 'Coronavirus (2019-nCoV)']"
Another Big Investment in Racial Justice,2020-09-24,article,News,"Square plans to put $100 million into programs to bolster Black communities, joining the likes of Netflix and others.",The New York Times,Business,Business Day,['Coronavirus (2019-nCoV)']
Biden gives cautious answers on Breonna Taylor and the Supreme Court.,2020-09-24,article,News,"Asked by reporters about two issues of deep importance to Democrats, the party’s nominee was circumspect. The Biden campaign later released a fuller statement about Ms. Taylor.",The New York Times,Politics,U.S.,[]
2 Republicans resign from the North Carolina elections board over a mail ballot extension.,2020-09-24,article,News,,The New York Times,Politics,U.S.,[]
What will it take to vote in Milwaukee?,2020-09-24,article,News,,The New York Times,Politics,U.S.,[]
"Andrea Campbell, the first Black woman to serve as Boston’s City Council president, jumps into the mayor’s race.",2020-09-24,article,News,,The New York Times,Politics,U.S.,[]
Trump shifts the 2020 focus by again threatening to undermine the democratic process.,2020-09-24,article,News,,The New York Times,Politics,U.S.,[]
Suspect Is Charged in Shooting of 2 Louisville Police Officers,2020-09-24,article,News,"Demonstrators marched downtown without police intervention a day after a grand jury decided not to charge the officers who fatally shot Ms. Taylor. After curfew, protesters took refuge at a church.",The New York Times,National,U.S.,"['Police Brutality, Misconduct and Shootings', 'Demonstrations, Protests and Riots', 'Black Lives Matter Movement', 'Attacks on Police']"
A $300 unemployment supplement remains elusive for many.,2020-09-24,article,News,,The New York Times,Business,Business Day,[]
"Furloughed, then laid off, a cruise worker may soon leave New York.",2020-09-24,article,News,,The New York Times,Business,Business Day,[]
Trump will hold a rally in Florida tonight as Pence travels to Minneapolis.,2020-09-24,article,News,,The New York Times,Politics,U.S.,[]
"Whole Foods and Trader Joe’s Downstairs, Higher Rent Upstairs",2020-09-24,article,News,"High-end grocery stores at the ground level of rental buildings have been shown to produce higher rents, greater rent increases and faster leasing.",The New York Times,RealEstate,Real Estate,"['Real Estate and Housing (Residential)', 'Renting and Leasing (Real Estate)', 'Supermarkets and Grocery Stores']"
Homes for Sale in Westchester and Connecticut,2020-09-24,article,News,"This week’s properties are five-bedroom houses in Scarsdale, N.Y., and Fairfield, Conn.",The New York Times,RealEstate,Real Estate,['Real Estate and Housing (Residential)']
"Homes for Sale in Brooklyn, Manhattan and Queens",2020-09-24,article,News,"This week’s properties are in Greenwood Heights, Ridgewood and Greenwich Village.",The New York Times,RealEstate,Real Estate,['Real Estate and Housing (Residential)']
A former top military commander under Trump is among 489 security leaders who say he is unfit for office.,2020-09-24,article,News,,The New York Times,Politics,U.S.,[]
Square plans to invest $100 million in Black communities.,2020-09-24,article,News,,The New York Times,Business,Business Day,"['Income Inequality', 'Mobile Commerce and Payments', 'Black People', 'Blacks', 'Corporate Social Responsibility', 'Race and Ethnicity', 'Minorities']"
‘There Are Breonnas Everywhere’: Protests for Breonna Taylor in Pictures,2020-09-24,article,News,The New York Times has photographers on the ground following protests across the country.,The New York Times,National,U.S.,"['Demonstrations, Protests and Riots', 'George Floyd Protests (2020)']"
And the Emmy Goes to … My Therapist,2020-09-24,article,News,"As he accepted the award for outstanding writing, Cord Jefferson thanked his therapist, and he wasn’t kidding.",The New York Times,Well,Well,"['Emmy Awards', 'Black People', 'Blacks', 'Therapy and Rehabilitation', 'Mental Health and Disorders']"
Losing Your Hair Can Be Another Consequence of the Pandemic,2020-09-24,article,News,"Doctors are seeing a huge increase in patients who have been shedding abnormal amounts of hair, and they believe it is related to stress associated with the coronavirus.",The New York Times,Science,Health,"['your-feed-science', 'Hair', 'Anxiety and Stress', 'Coronavirus (2019-nCoV)', 'Alopecia Areata', 'your-feed-healthcare']"
How to Deal With a Friendship ‘Quiet Season’,2020-09-24,article,News,"You might emerge from 2020 with fewer friendships, and that’s OK.",The New York Times,Smarter Living,Smarter Living,"['Content Type: Service', 'Friendship', 'Quarantine (Life and Culture)', 'Coronavirus (2019-nCoV)']"
"‘Vote him out,’ protesters chant as Trump visits Justice Ginsburg’s coffin.",2020-09-24,article,News,,The New York Times,Politics,U.S.,[]
Trump Administration Adds to American Travel Restrictions in Cuba,2020-09-24,article,News,"Among other measures, Americans will no longer be able to import Cuban cigars or stay in hotels owned by the Cuban government.",The New York Times,Travel,Travel,"['Embargoes and Sanctions', 'United States International Relations', 'Presidential Election of 2020']"
"Mary Trump Sues President and Family, Claiming Fraud of Millions",2020-09-24,article,News,"Two months after she claimed in a tell-all book that her family cheated her out of her inheritance, Ms. Trump made similar allegations in a civil suit in Manhattan.",The New York Times,Metro,New York,"['Suits and Litigation (Civil)', 'Wills and Estates', 'Frauds and Swindling', 'Books and Literature']"
Corey Johnson Drops Out of 2021 Race for N.Y.C. Mayor,2020-09-24,article,News,"Mr. Johnson, the City Council speaker, was one of the front-runners to succeed Mayor Bill de Blasio, but the recent rigors of his job had worn on him.",The New York Times,Metro,New York,"['Elections, Mayors', 'Race and Ethnicity', 'Police Reform']"
"After Brief TikTok Run, Kevin Mayer Is in Talks to Join Investment Firm",2020-09-24,article,News,"Mr. Mayer, for years a top dealmaker at Disney, is in advanced talks with RedBird Capital, which has holdings in sports, entertainment and financial services.",The New York Times,Business,Business Day,['Appointments and Executive Changes']
