headline,date,doc_type,type_of_material,snippet,source,news_desk,section_name,keywords
How to Get a Virus Test in N.Y.C. Without Waiting for Hours,2020-09-17,article,News,"With the city facing a second wave of the coronavirus, the mayor is encouraging New Yorkers to get tested regularly.",The New York Times,Metro,New York,"['Tests (Medical)', 'Coronavirus (2019-nCoV)', 'Teachers and School Employees', 'Content Type: Service', 'Education (K-12)', 'Coronavirus Reopenings', 'Parenting']"
Navigating the Emotional Turf of Fall Family Gatherings,2020-09-17,article,News,"While warm weather has given families the opportunity to gather relatively safely in backyards, fall and winter celebrations are a trickier proposition.",The New York Times,Well,Well,"['Coronavirus Risks and Safety Concerns', 'Content Type: Service', 'Holidays and Special Occasions', 'Coronavirus (2019-nCoV)', 'Families and Family Life', 'Thanksgiving Day', 'Quarantine (Life and Culture)']"
Trump’s Secret Health Plan Is a Promise Voters Have Heard Before,2020-09-17,article,News,"On Tuesday night, President Trump told a town-hall-style meeting he had a health plan to replace the Affordable Care Act that’s “all ready,” a pitch he has delivered for four years.",The New York Times,Washington,U.S.,"['Health Insurance and Managed Care', 'Patient Protection and Affordable Care Act (2010)', 'Presidential Election of 2020', 'United States Politics and Government']"
Small Tech Stocks Soar as the Future Arrives Early,2020-09-17,article,News,"The giants aren’t the only ones. A subset of software, streaming, security and e-commerce firms are also posting eye-popping gains.",The New York Times,Business,Business Day,"['Stocks and Bonds', 'E-Commerce', 'Computers and the Internet', 'Coronavirus (2019-nCoV)', 'Quarantine (Life and Culture)']"
Senate Democrats Present $350 Billion Strategy to Counter China,2020-09-17,article,News,Democrats rolled out sprawling legislation that proposes substantial new funding over a decade in a bid to reinvest in the nation’s economy and challenge Beijing.,The New York Times,Washington,U.S.,"['United States International Relations', 'United States Politics and Government', 'Science and Technology']"
Is This the End of the New York Yoga Studio?,2020-09-17,article,News,"Soaring rents, the pandemic and the rise of the Instagram yogi could mean the demise of the urban wellness oasis.",The New York Times,Metropolitan,New York,"['Yoga', 'Shutdowns (Institutional)', 'Small Business', 'Renting and Leasing (Real Estate)', 'Coronavirus (2019-nCoV)', 'Quarantine (Life and Culture)']"
Charge That Maxwell ‘Groomed’ Girls for Epstein Is Central to Case,2020-09-17,article,News,Prosecutors are relying on a theory that Ghislaine Maxwell slowly broke down the resistance of teenage girls to sexual abuse at the hands of Jeffrey Epstein.,The New York Times,Metro,New York,"['#MeToo Movement', 'Prostitution', 'Sex Crimes', 'Women and Girls']"
Does Biden Need a Higher Gear? Some Democrats Think So,2020-09-17,article,News,"As President Trump’s campaign barrels ahead with crowded rallies and in-person door-knocking, some Democratic officials in battleground states are warning that Joe Biden may not be doing enough to excite voters.",The New York Times,Politics,U.S.,"['States (US)', 'Voting and Voters', 'Polls and Public Opinion', 'Presidential Election of 2020', 'United States Politics and Government']"
Why French Politicians Can’t Stop Talking About Crime,2020-09-17,article,News,"Statistics show a steady decline in major crimes. But what has intensified are the challenges to France’s traditional national identity, and the jockeying in the race to be the next president.",The New York Times,Foreign,World,"['Politics and Government', 'Elections', 'Crime and Criminals', 'Demonstrations, Protests and Riots', 'Immigration and Emigration', 'Race and Ethnicity']"
Fall’s Here. Can We Still Go Apple Picking?,2020-09-17,article,News,"Wandering through corn mazes, picking pumpkins and visits to wineries and haunted houses are still on the calendar, but social distancing and face masks are part of the plan.",The New York Times,Travel,Travel,"['Labyrinths and Mazes', 'Autumn (Season)', 'Agriculture and Farming', 'Halloween', 'APPLES', 'Travel and Vacations', 'Pumpkins', 'Wines']"
"Unable to Pay Rent, Small Businesses Hope for a Deal With Their Landlord",2020-09-17,article,News,Months of pandemic-related closures have left many business owners too deeply in debt to survive without concessions or deferrals.,The New York Times,Business,Business Day,"['Shutdowns (Institutional)', 'Renting and Leasing (Real Estate)', 'Landlords', 'Shopping and Retail', 'Coronavirus Reopenings', 'Restaurants', 'Credit and Debt', 'Small Business', 'Coronavirus (2019-nCoV)', 'Coronavirus Aid, Relief, and Economic Security Act (2020)']"
A New Ship’s Mission: Let the Deep Sea Be Seen,2020-09-17,article,News,"A giant new vessel, OceanXplorer, seeks to unveil the secrets of the abyss for a global audience.",The New York Times,Science,Science,"['Oceans and Seas', 'Ships and Shipping', 'Fish and Other Marine Life', 'Science and Technology', 'Oil (Petroleum) and Gasoline', 'Robots and Robotics', 'Diving and Divers', 'Documentary Films and Programs', 'your-feed-science']"
C.D.C.’s Contentious Testing Guidance on Covid-19 Was Not Written by Its Scientists,2020-09-17,article,News,Joe Biden is trying to focus the election on President Trump’s coronavirus response. The global caseload passed 30 million. New Zealand recorded no new cases for the first time in weeks.,The New York Times,Foreign,World,['Coronavirus (2019-nCoV)']
"Aleksei Navalny Was Poisoned at His Hotel, His Team Says",2020-09-17,article,News,"Aides of the Russian opposition leader collected items from his hotel room in Siberia as soon as he fell ill, according to a video posted on his Instagram account.",The New York Times,Foreign,World,"['Biological and Chemical Warfare', 'Poisoning and Poisons', 'Politics and Government', 'Assassinations and Attempted Assassinations']"
A Car Insurance Claim Estimate Before the Tow Truck Is Called,2020-09-17,article,News,"Using algorithms, tech companies are helping insurers speed up the process after an accident, make it more accurate and keep estimators out of the field — a plus during a pandemic.",The New York Times,Business,Business Day,"['Automobile Insurance and Liability', 'Traffic Accidents and Safety', 'Artificial Intelligence', 'Computer Vision', 'Mobile Applications']"
Many business owners are too deeply in debt to survive without rent concessions.,2020-09-17,article,News,,The New York Times,Business,Business Day,[]
Nobody Knows What’s Happening With TikTok,2020-09-17,article,News,Deal makers involved in the talks to sell TikTok are exasperated.,The New York Times,Business,Business Day,"['Mergers, Acquisitions and Divestitures', 'Coronavirus (2019-nCoV)', 'Initial Public Offerings']"
Trump Hits Out at the C.D.C. Director,2020-09-17,article,News,The president bends reality further as he pushes for a vaccine: This is your morning tip sheet.,The New York Times,Politics,U.S.,"['Coronavirus (2019-nCoV)', 'Vaccination and Immunization', 'Presidential Election of 2020']"
Small tech stocks are posting eye-popping gains.,2020-09-17,article,News,,The New York Times,Business,Business Day,[]
First the Pandemic. Now the Storm. Gulf Shores High School Can’t Catch a Break.,2020-09-17,article,News,"It was supposed to be homecoming week at an Alabama high school, but Hurricane Sally ruined those plans.",The New York Times,National,U.S.,['Hurricane Sally (2020)']
Trump scorns his own scientists over coronavirus data.,2020-09-17,article,News,A public scolding of the C.D.C. chief was only the latest but perhaps the starkest instance when the president has rejected not just the policy advice of his public health officials but the facts and information that they provided.,The New York Times,Politics,U.S.,[]
Here’s where the candidates will be today.,2020-09-17,article,News,,The New York Times,Politics,U.S.,[]
Ohio’s secretary of state challenges a court ruling allowing more ballot drop boxes.,2020-09-17,article,News,,The New York Times,Politics,U.S.,[]
"Warning of Russian disinformation, Senate Democrats tried to squelch Republicans’ report on Hunter Biden.",2020-09-17,article,News,,The New York Times,Politics,U.S.,[]
Does Biden need a higher gear? Some Democrats think so.,2020-09-17,article,News,"As President Trump’s campaign barrels ahead with crowded rallies and in-person door-knocking, some Democratic officials in battleground states are warning that Joe Biden may not be doing enough to excite voters.",The New York Times,Politics,U.S.,[]
Expect vote-by-mail fireworks today as the postmaster general talks with dozens of secretaries of state.,2020-09-17,article,News,,The New York Times,Politics,U.S.,[]
McClatchy’s 30 newspapers probably won’t be endorsing this year.,2020-09-17,article,News,,The New York Times,Politics,U.S.,[]
"U.S. Official Visits Taiwan, and China Warns of Consequences",2020-09-17,article,News,"The trip by Keith Krach, an economic representative, defies Beijing’s opposition to formal exchanges. China sent two anti-submarine aircraft toward the island in response.",The New York Times,Foreign,World,"['Defense and Military Forces', 'United States Defense and Military Forces', 'United States International Relations']"
Moderna and Pfizer Reveal Secret Blueprints for Coronavirus Vaccine Trials,2020-09-17,article,News,The companies hope to earn the trust of the public and of scientists who have clamored for details of the studies.,The New York Times,Science,Health,"['Coronavirus (2019-nCoV)', 'Vaccination and Immunization', 'Clinical Trials']"
"China’s Communists to Private Business: You Heed Us, We’ll Help You",2020-09-17,article,News,"Party leaders have pledged to increase their influence over entrepreneurs even as they promise greater aid, reflecting Xi Jinping’s greatest — and sometimes conflicting — challenges.",The New York Times,Business,Business Day,"['Politics and Government', 'Economic Conditions and Trends', 'Entrepreneurship']"
A wave of job searches has yet to come.,2020-09-17,article,News,,The New York Times,Business,Business Day,[]
"‘Two steps backward.’ With jobless pay but still no job, financial stress takes a toll.",2020-09-17,article,News,,The New York Times,Business,Business Day,[]
The New Apple Watch Measures Your Blood Oxygen. Now What?,2020-09-17,article,News,"Blood oxygen readings can be a useful indicator of wellness, but context is important — and so is medical advice from a doctor.",The New York Times,Business,Technology,"['Wearable Computing', 'Watches and Clocks', 'Oxygen', 'Coronavirus (2019-nCoV)', 'Sleep', 'Content Type: Service', 'Pulse Oximetry']"
"Homes for Sale in Manhattan, Brooklyn and Queens",2020-09-17,article,News,"This week’s properties are in Carnegie Hill, Prospect Heights and Jackson Heights.",The New York Times,RealEstate,Real Estate,['Real Estate and Housing (Residential)']
Homes for Sale in New York and Connecticut,2020-09-17,article,News,"This week’s properties are three-bedroom homes in Norwalk, Conn., and Carle Place, N.Y.",The New York Times,RealEstate,Real Estate,['Real Estate and Housing (Residential)']
"For a working couple, one income isn’t enough to keep the 401(k) intact.",2020-09-17,article,News,,The New York Times,Business,Business Day,[]
Wildfires Are Among 4 Recent Disasters Costing at Least $1 Billion,2020-09-17,article,News,"Firefighters were making progress against several significant wildfires in California and Oregon, hopeful that changing weather conditions would help rather than hinder efforts.",The New York Times,National,U.S.,"['Fires and Firefighters', 'Wildfires', 'Rescues', 'Rumors and Misinformation']"
Obama is publishing the first half of his memoir right after the election.,2020-09-17,article,News,,The New York Times,Politics,U.S.,[]
The Most Popular Listings of August,2020-09-17,article,News,"The most-viewed properties of the month in included the $88,000,000 former home of Jeffrey Epstein, the convicted sex offender who died in jail.",The New York Times,RealEstate,Real Estate,['Real Estate and Housing (Residential)']
Deal Reached in N.J. for ‘Millionaires Tax’ to Address Fiscal Crisis,2020-09-17,article,News,"Gov. Philip Murphy said the tax would help make up shortfalls caused by the pandemic, but Republicans warned it would lead to an exodus of wealthy residents.",The New York Times,Metro,New York,"['Income Tax', 'High Net Worth Individuals', 'Income Inequality', 'Budgets and Budgeting', 'State Legislatures', 'Politics and Government', 'Coronavirus (2019-nCoV)', 'Coronavirus Aid, Relief, and Economic Security Act (2020)']"
Lindsey Graham says Comey will testify before a Senate committee the day after the first presidential debate.,2020-09-17,article,News,,The New York Times,Politics,U.S.,[]
"On This Island, Everyone Knows Your Name (if You Have Covid-19)",2020-09-17,article,News,"When someone tests positive in a small, close-knit community on a Greek island, privacy is the first thing to go.",The New York Times,Foreign,World,"['Coronavirus (2019-nCoV)', 'Contact Tracing (Public Health)', 'Gossip', 'Masks']"
Police Move Migrants From Greek Camp to Temporary Lesbos Site After Fires,2020-09-17,article,News,"The move comes a week after fires destroyed the Moria camp, where 12,000 people were living. But rights groups say the new camp is only a temporary solution.",The New York Times,Foreign,World,"['Middle East and Africa Migrant Crisis', 'Refugees and Displaced Persons']"
"Election results will take longer, but not because of ‘unsolicited ballots,’ despite Trump’s claims.",2020-09-17,article,News,,The New York Times,Politics,U.S.,[]
N.Y.C. Will Again Delay Start of In-Person Classes for Most Students,2020-09-17,article,News,"The city had scheduled classes to start on Monday. Now, students will be allowed to return on a rolling basis, beginning with those in pre-K.",The New York Times,Metro,New York,"['Coronavirus (2019-nCoV)', 'Education (K-12)', 'Coronavirus Reopenings']"
"Racing Fire Truck Hits Ambulance, Killing Patient",2020-09-17,article,News,"A ladder truck rushing to a fire slammed into an ambulance carrying a man who had suffered a heart attack, killing him and injuring 11 others.",The New York Times,Metro,New York,"['Traffic Accidents and Safety', 'Deaths (Fatalities)', 'Fires and Firefighters', 'AMBULANCES', 'Emergency Medical Treatment']"
Reproductive Life Span May Affect a Woman’s Heart Risks,2020-09-17,article,News,"Women with a shorter time between menarche and menopause were at higher risk of cardiovascular disease, heart attack and stroke.",The New York Times,Well,Well,"['Heart', 'Menopause', 'Women and Girls', 'Reproduction (Biological)']"
How Republicans Undermined Ex-Felon Voting Rights in Florida,2020-09-17,article,News,It’s a cautionary tale about the messy process of citizen-led ballot initiatives and how a dominant political party can exert its power.,The New York Times,National,U.S.,"['Ex-Convicts', 'Voter Registration and Requirements', 'Presidential Election of 2020', 'Decisions and Verdicts']"
Community Colleges Can Be Engines of Economic Recovery,2020-09-17,article,News,"With proper funding and innovation, two-year public colleges can handle job training for millions of people.",The New York Times,SundayBusiness,Business Day,"['Community Colleges', 'Labor and Jobs', 'Vocational Training', 'For-Profit Schools', 'Computers and the Internet', 'Tuition', 'United States Economy']"
Medical Errors May Increase Around Daylight Saving Time in the Spring,2020-09-17,article,News,"After the loss of an hour from daylight savings, the number of human mistakes increased by almost 20 percent, mostly involving drug errors.",The New York Times,Well,Well,"['Daylight Saving Time', 'Doctors', 'Drugs (Pharmaceuticals)']"
"Boris Johnson, bracing for possible Biden presidency, defends Brexit plan.",2020-09-17,article,News,,The New York Times,Politics,U.S.,[]
The Biden campaign punches back at Trump over the economy.,2020-09-17,article,News,,The New York Times,Politics,U.S.,[]
Disasters on Two Coasts: How to Help,2020-09-17,article,News,"With fires on the West Coast and floods on the Gulf Coast, relief organizations are providing meals and shelter to devastated communities. If you want to give aid, here are some research pointers.",The New York Times,Express,U.S.,"['Philanthropy', 'Wildfires', 'Hurricanes and Tropical Storms']"
One Family’s Remote-School Tale,2020-09-17,article,News,"Like many parents, Valerie Cruz is dealing with a tough situation and making it work.",The New York Times,NewsDesk,Technology,"['E-Learning', 'Computers and the Internet', 'Education (K-12)', 'Coronavirus (2019-nCoV)', 'Rumors and Misinformation']"
"China, Seeking a Friend in Europe, Finds Rising Anger and Frustration",2020-09-17,article,News,"Beijing’s hopes of using Europe as a counterweight to the United States have faltered as country after country confronts China over trade, Hong Kong, human rights and other issues.",The New York Times,Foreign,World,"['Politics and Government', 'International Relations', 'International Trade and World Market', 'Political Prisoners', 'United States International Relations', 'Coronavirus (2019-nCoV)']"
Biden and Kelly have the edge in a new Monmouth poll of likely voters in Arizona.,2020-09-17,article,News,,The New York Times,Politics,U.S.,[]
"‘Hotel Rwanda’ Hero, in Jailhouse Interview, Says He Was Duped Into Arrest",2020-09-17,article,News,"Paul Rusesabagina, who mysteriously disappeared from Dubai last month and then resurfaced as a prisoner in Rwanda, says he believed he was being flown to Burundi to talk to church groups.",The New York Times,Foreign,World,"['Political Prisoners', 'War Crimes, Genocide and Crimes Against Humanity']"
"Amy Dorris, a former model, accuses Trump of sexually assaulting her at the U.S. Open in 1997.",2020-09-17,article,News,,The New York Times,Politics,U.S.,"['Sexual Harassment', 'Sex Crimes', 'United States Politics and Government', 'Presidential Election of 2020']"
"Ex-felons in Florida got back the right to vote, but then state Republicans gutted the effort.",2020-09-17,article,News,,The New York Times,Politics,U.S.,[]
When Will You Be Able to Get a Coronavirus Vaccine?,2020-09-17,article,News,"Despite the president’s repeated claims that a vaccine will be available in October, scientists, companies and federal officials all say that most people won’t get one until well into next year.",The New York Times,Science,Health,"['Clinical Trials', 'Shortages', 'Vaccination and Immunization', 'Coronavirus (2019-nCoV)', 'United States Politics and Government']"
"Biden continues a run of strong state polls, as Democrats get good news in the Senate.",2020-09-17,article,News,,The New York Times,Politics,U.S.,[]
"Walmart will raise wages for 165,000 employees.",2020-09-17,article,News,The raises at Walmart will be carefully watched because the giant retailer sets the benchmark for lower-wage workers.,The New York Times,Business,Business Day,[]
New duo of Trump ads target Biden on taxes.,2020-09-17,article,News,,The New York Times,Politics,U.S.,[]
Under Armour’s C.E.O. marks his first election as a U.S. citizen with a voting drive.,2020-09-17,article,News,,The New York Times,Politics,U.S.,[]
"Richard Uihlein, a top G.O.P. megadonor, gave another $10 million in August.",2020-09-17,article,News,,The New York Times,Politics,U.S.,[]
TikTok Accepts Deal Revisions as Trump Prepares to Review Proposal,2020-09-17,article,News,The video app is also looking for a new chief executive and has talked to candidates including a founder of Instagram.,The New York Times,Business,Technology,"['Mergers, Acquisitions and Divestitures', 'Social Media', 'Computer Security', 'Mobile Applications', 'Executive Orders and Memorandums', 'United States Politics and Government', 'Presidential Election of 2020']"
Blue Bell is hit with a $17.25 million penalty over 2015 listeria contamination.,2020-09-17,article,News,,The New York Times,Business,Business Day,[]
"Olivia Troye and other former Trump administration officials back Biden, saying it is time to put ‘country over party.’",2020-09-17,article,News,,The New York Times,Politics,U.S.,[]
"Lev Parnas, Giuliani Associate, Faces New Fraud Charges",2020-09-17,article,News,"Mr. Parnas, who participated in a campaign to dig up dirt on the president’s political rivals, is accused of swindling investors.",The New York Times,Metro,New York,"['Frauds and Swindling', 'Trump-Ukraine Whistle-blower Complaint and Impeachment Inquiry', 'United States Politics and Government']"
For-Profit Jail Is Accused of Abuse After Death of Woman With H.I.V.,2020-09-17,article,News,"Holly Barlow-Austin was kept in “deplorable and inhumane conditions,” deprived of water and denied medications, according to a lawsuit filed this week in federal court.",The New York Times,Express,U.S.,"['Prisons and Prisoners', 'Deaths (Fatalities)', 'Suits and Litigation (Civil)']"
Isolated Ballot Errors Do Not Equal a ‘Rigged Election’,2020-09-17,article,News,"President Trump continued his assault on voting by mail, but printing and mailing errors are nothing new, and have affected Republican and Democratic candidates alike.",The New York Times,Business,Technology,"['Absentee Voting', 'Presidential Election of 2020', 'Voter Fraud (Election Fraud)', 'United States Politics and Government', 'Social Media']"
"Don’t Mess With Ireland, Biden Warns Boris Johnson",2020-09-17,article,News,The Democratic presidential candidate warned Britain’s prime minister that any deal with the European Union must protect the Irish peace agreement.,The New York Times,Foreign,World,"['United States International Relations', 'Great Britain Withdrawal from EU (Brexit)', 'United States Politics and Government', 'Presidential Election of 2020']"
A Nigerian State Plans to Castrate Convicted Child Rapists,2020-09-17,article,News,"A harsh new law to punish those who rape children in the state of Kaduna has drawn praise from some, and accusations of “legislative sadism” from others.",The New York Times,Foreign,World,"['Castration', 'Sex Crimes', 'Women and Girls', 'Politics and Government', 'Law and Legislation', 'Domestic Violence']"
C.D.C. Testing Guidance Was Published Against Scientists’ Objections,2020-09-17,article,News,A controversial guideline saying people without Covid-19 symptoms didn’t need to get tested for the virus came from H.H.S. officials and skipped the C.D.C.’s scientific review process.,The New York Times,Science,Health,"['your-feed-science', 'Coronavirus (2019-nCoV)', 'Tests (Medical)', 'United States Politics and Government', 'Medicine and Health']"
"Coronavirus May Increase Premature Births, Studies Suggest",2020-09-17,article,News,New studies provide more evidence that pregnant women may get severe Covid-19 symptoms and have an increased risk of pregnancy loss.,The New York Times,Science,Health,"['Women and Girls', 'Pregnancy and Childbirth', 'Coronavirus (2019-nCoV)', 'Premature Babies', 'Stillbirth', 'Research', 'your-feed-science', 'your-feed-health']"
"Unemployment Claims Dip, but Layoffs Remain a Worry",2020-09-17,article,News,"“I’m concerned about a plateau,” one economist said, pointing to a slower phase of the recovery after a hiring bounce in the spring.",The New York Times,Business,Business Day,"['United States Economy', 'Unemployment Insurance', 'Layoffs and Job Reductions', 'Unemployment', 'Labor and Jobs', 'Coronavirus (2019-nCoV)', 'Coronavirus Aid, Relief, and Economic Security Act (2020)']"
"Eric Trump Will Comply With N.Y. Inquiry, but Only After Election",2020-09-17,article,News,Mr. Trump’s lawyers said in a court filing that he was willing to be interviewed by investigators after voters cast their presidential ballots.,The New York Times,Metro,New York,[]
"U.S. Pushes Large Arms Sale to Taiwan, Including Jet Missiles That Can Hit China",2020-09-17,article,News,The administration is proposing the packages as President Trump’s strategists try to paint him as being tough on China despite soft actions earlier.,The New York Times,Washington,U.S.,"['Arms Trade', 'Defense and Military Forces', 'International Relations', 'United States International Relations', 'United States Defense and Military Forces', 'United States Politics and Government', 'Military Aircraft']"
Playing Politics With a Vaccine,2020-09-17,article,News,"Growing numbers of Americans say they wouldn’t take a coronavirus vaccine if it were available today. If you’ve been watching the presidential campaign, that’s not surprising.",The New York Times,Politics,U.S.,"['Presidential Election of 2020', 'Vaccination and Immunization']"
Biden and Trump hold dueling prime-time events tonight.,2020-09-17,article,News,,The New York Times,Politics,U.S.,[]
Top Justice Dept. Official Embraces Use of Sedition Charges for Protest Violence,2020-09-17,article,News,"The deputy attorney general, Jeffrey A. Rosen, emphasized that the sedition statute covered a variety of crimes and the push to consider it was proper.",The New York Times,Washington,U.S.,"['Treason and Sedition', 'Demonstrations, Protests and Riots', 'George Floyd Protests (2020)', 'United States Attorneys', 'Attorneys General', 'United States Politics and Government']"
