headline,date,doc_type,type_of_material,snippet,source,news_desk,section_name,keywords
Don’t Be Ashamed of Those Extra Pounds,2020-08-08,article,News,"So you’ve put on some weight during lockdown. You can obsess over it, but you can also be kinder to yourself. Here’s how.",The New York Times,AtHome,At Home,"['Quarantine (Life and Culture)', 'Weight', 'Content Type: Service', 'Exercise', 'your-feed-selfcare']"
"No Pajama Pants Allowed While Learning From Home, Illinois District Says",2020-08-08,article,News,"The Springfield, Ill., school district said it would require students to follow its dress code regardless of how classes are held.",The New York Times,National,U.S.,"['E-Learning', 'Education (K-12)', 'Coronavirus (2019-nCoV)', 'Fashion and Apparel']"
Air India Crash Investigators Focus On a Dangerous Runway and a Pilot’s Actions,2020-08-08,article,News,"As investigators sought the cause of a jetliner accident that killed 18 people, blame began to fall on the pilot and the hilltop runway.",The New York Times,Foreign,World,"['Aviation Accidents, Safety and Disasters']"
Profits Rebound at Warren Buffett’s Berkshire Hathaway,2020-08-08,article,News,"Berkshire reported earnings of $26.4 billion in the second quarter, a turnaround from its $49.7 billion loss in the first quarter, when the pandemic caused a plunge in the stock market.",The New York Times,Business,Business Day,"['Company Reports', 'Stocks and Bonds', 'Automobile Insurance and Liability', 'Coronavirus (2019-nCoV)', 'United States Economy']"
It’s Neighbor vs. Neighbor in a Co-op. Who Wins?,2020-08-08,article,News,"Co-op boards do not like to get in the middle of resident disputes. But if one shareholder is tormenting another, the issue must be addressed.",The New York Times,RealEstate,Real Estate,"['Real Estate and Housing (Residential)', 'Cooperatives', 'Noise']"
Make This Ginger-Lime Chicken ASAP,2020-08-08,article,News,"Ali Slagle’s chicken recipe, J. Kenji López-Alt empanadas, and more recipes.",The New York Times,Dining,Admin,"['Chickens', 'Content Type: Service', 'Cooking and Cookbooks']"
"Your Hot-Weather Guide to Coronavirus, Air-Conditioning and Airflow",2020-08-08,article,News,Indoor air is riskier than outdoor air. So what do you do if it’s really hot out?,The New York Times,Express,Science,"['Coronavirus Risks and Safety Concerns', 'Coronavirus (2019-nCoV)', 'Air Conditioning', 'Engineering and Engineers', 'Windows']"
Perfect the Art of Pickling and Ponder a Night of Poetry,2020-08-08,article,News,"Check out a reading by emerging writers, learn the secrets of Jewish cuisine and channel Rube Goldberg.",The New York Times,AtHome,At Home,['Content Type: Service']
Sports Podcasts Even a Newbie Can Enjoy,2020-08-08,article,News,Just because you can’t go to the games doesn’t mean your summer has to be athlete-free.,The New York Times,AtHome,At Home,"['Athletics and Sports', 'Basketball', 'Quarantine (Life and Culture)', 'Comedy and Humor', 'Soccer']"
Pelosi Is Playing Hardball on Coronavirus Relief. She Thinks She’ll Win.,2020-08-08,article,News,"Emboldened by Republican divisions and a favorable political landscape, the speaker is refusing to agree to a narrow relief measure, unbothered by charges that she is an impediment to a deal.",The New York Times,Washington,U.S.,"['United States Politics and Government', 'Coronavirus Aid, Relief, and Economic Security Act (2020)', 'Stimulus (Economic)', 'United States Economy']"
Clashes Erupt in Beirut at Blast Protest as Lebanon’s Anger Boils Over,2020-08-08,article,News,The demonstrations were fueled by fury over the corruption and negligence of the country’s ruling elite. Security forces fired tear gas to push back the protesters.,The New York Times,Foreign,World,"['Beirut, Lebanon, Explosions (2020)', 'Demonstrations, Protests and Riots']"
"How Kristi Noem, Mt. Rushmore and Trump Fueled Speculation About Pence’s Job",2020-08-08,article,News,"After Ms. Noem, the South Dakota governor, flew to Washington on Air Force One, rumors about her ambitions ensued. She made a second trip to smooth things over with Mike Pence.",The New York Times,Politics,U.S.,"['Presidential Election of 2020', 'Vice Presidents and Vice Presidency (US)']"
C.D.C. Closes Some Offices Over Bacteria Discovery,2020-08-08,article,News,The move highlights the risk of Legionnaires’ disease outbreaks when buildings are reopened after coronavirus lockdowns.,The New York Times,Science,Health,"['your-feed-science', 'Coronavirus (2019-nCoV)', ""Legionnaires' Disease""]"
The Voting Will End Nov. 3. The Legal Battle Probably Won’t.,2020-08-08,article,News,"As the two parties clash over how to conduct an election in a pandemic, President Trump’s litigiousness and unfounded claims of fraud have increased the likelihood of epic postelection court fights.",The New York Times,Washington,U.S.,"['Absentee Voting', 'Presidential Election of 2020', 'Voter Fraud (Election Fraud)']"
Remains of Sailor and 7 Marines Killed in Training Accident Are Recovered,2020-08-08,article,News,The servicemen had been missing since the amphibious assault vehicle they were in sank off the coast of Southern California on July 30.,The New York Times,Express,U.S.,"['United States Defense and Military Forces', 'Maritime Accidents and Safety']"
Stay Cool Without Racking Up a Bill,2020-08-08,article,News,Four ways to air-condition your home more efficiently in the summer heat.,The New York Times,AtHome,At Home,"['Content Type: Service', 'Energy Efficiency', 'Fans (Airflow)', 'Air Conditioning']"
How to Prepare for Your Return to the Office,2020-08-08,article,News,Nervous about the possibility of going back to the workplace? Here’s what to take into consideration.,The New York Times,AtHome,At Home,"['Workplace Hazards and Violations', 'Coronavirus Risks and Safety Concerns', 'Quarantine (Life and Culture)', 'Hygiene and Cleanliness', 'Workplace Environment', 'Content Type: Service']"
"Sidestepping Congress, Trump Signs Executive Measures for Pandemic Relief",2020-08-08,article,News,"President Trump signed the directives after two weeks of stalemate with Democrats over a recovery package, using legally dubious measures to try to restore lapsed benefits.",The New York Times,Washington,U.S.,"['Coronavirus (2019-nCoV)', 'Coronavirus Aid, Relief, and Economic Security Act (2020)', 'Executive Orders and Memorandums', 'United States Politics and Government', 'Stimulus (Economic)']"
Trump’s Go-It-Alone Stimulus Won’t Do Much to Lift the Recovery,2020-08-08,article,News,A series of executive actions will provoke lawsuits but is unlikely to stoke faster growth in an economy that has cooled this summer.,The New York Times,Washington,Business Day,"['Executive Orders and Memorandums', 'United States Economy', 'United States Politics and Government', 'Stimulus (Economic)', 'Coronavirus Aid, Relief, and Economic Security Act (2020)']"
"‘The Guy in Front of Me Called a Name, and the Other Guy Turned’",2020-08-09,article,News,"A street scene at the end of the day, carrying a gift on a packed train and more reader tales of New York City in this week’s Metropolitan Diary.",The New York Times,Metropolitan,New York,[]
Democrats Hold Edge as Battle for Senate Majority Becomes ‘Knife Fight’,2020-08-09,article,News,"As the campaign enters a critical period, the pandemic, their primary strategy and their presumptive nominee have given Democrats a shot at winning the chamber.",The New York Times,Washington,U.S.,"['Elections, Senate', 'Primaries and Caucuses', 'United States Politics and Government']"
A Bookstore That Shines as ‘a Lighthouse of a Free Society’,2020-08-09,article,News,"A Hong Kong bookseller has recreated his shop in Taipei, and it has become a symbol of Taiwan’s vibrant democracy.",The New York Times,Foreign,World,"['Books and Literature', 'Politics and Government', 'Secession and Independence Movements', 'Freedom of Speech and Expression', 'Book Trade and Publishing']"
"In California, It Will Take More Than a Parade to Save an Imperiled Census",2020-08-09,article,News,Many Latinos in low-income communities say they are hearing a message about the 2020 census: Your participation is not wanted.,The New York Times,National,U.S.,"['Census', 'Immigration and Emigration', 'Hispanic-Americans', 'Population', 'Coronavirus (2019-nCoV)', 'United States Politics and Government']"
‘Christianity Will Have Power’,2020-08-09,article,News,"Donald Trump made a promise to white evangelical Christians, whose support can seem mystifying to the outside observer.",The New York Times,National,U.S.,"['Presidential Election of 2020', 'Whites', 'Evangelical Movement', 'United States Politics and Government', 'Freedom of Religion']"
"Afghanistan to Release Last Taliban Prisoners, Removing Final Hurdle to Talks",2020-08-09,article,News,"The decision clears the way for the last of 5,000 insurgents to be freed. President Ashraf Ghani announced the release after convening an assembly of 3,000 representatives to seek their advice.",The New York Times,Foreign,World,"['Politics and Government', 'Afghanistan War (2001- )', 'United States Defense and Military Forces']"
‘Top Cop’ Kamala Harris’s Record of Policing the Police,2020-08-09,article,News,Senator Harris is speaking out amid the police reform movement. But how did she oversee police misconduct as a district attorney and attorney general?,The New York Times,Politics,U.S.,"['Presidential Election of 2020', 'George Floyd Protests (2020)', 'Black Lives Matter Movement', 'Police Brutality, Misconduct and Shootings', 'Police Reform', 'Black People', 'Blacks', 'Racial Profiling', 'Race and Ethnicity', 'Attorneys General', 'District Attorneys', 'Vice Presidents and Vice Presidency (US)', 'Criminal Justice']"
Notes From a Virus Tracker’s Log,2020-08-09,article,News,"With over 200,000 cases in Los Angeles County alone, contact tracers like Radhika Kumar have their work cut out for them.",The New York Times,National,U.S.,"['Coronavirus (2019-nCoV)', 'Contact Tracing (Public Health)']"
This Contact Tracer Is Fighting Two Contagions: The Virus and Fear,2020-08-09,article,News,Convincing infected people to open up means helping them confront deeply held concerns about deportation or job loss.,The New York Times,National,U.S.,"['Contact Tracing (Public Health)', 'Coronavirus (2019-nCoV)']"
Boycotted. Criticized. But Fox News Leads the Pack in Prime Time.,2020-08-09,article,News,"Led by Tucker Carlson and Sean Hannity, the channel’s pro-Trump lineup outranked every network from 8 to 11 p.m. in June and July.",The New York Times,Business,Business Day,"['News and News Media', 'Television', 'Ratings (Audience Measurement)', 'Cable Television', 'Presidential Election of 2020']"
"The Wallets of Wall Street Are With Joe Biden, if Not the Hearts",2020-08-09,article,News,"Through donations, finance executives played a critical role in helping Joe Biden turn his campaign around. They’ve mostly grown to like him, if not love him.",The New York Times,Politics,Business Day,"['Presidential Election of 2020', 'Banking and Financial Institutions', 'United States Politics and Government', 'Campaign Finance']"
How to Move Your Elephant During a Pandemic,2020-08-09,article,News,"After decades in captivity and a 1,700-mile road trip from Argentina into Brazil, an Asian elephant named Mara finally gained a chance to roam.",The New York Times,Science,Science,"['Elephants', 'Coronavirus (2019-nCoV)', 'Animal Abuse, Rights and Welfare', 'Circuses', 'Zoos', 'Wildlife Sanctuaries and Nature Reserves', 'your-feed-science', 'your-feed-photojournalism', 'your-feed-animals']"
Saudi Aramco Says Profit Fell 73 Percent as Demand for Oil Shrank,2020-08-09,article,News,"The coronavirus pandemic took a major toll on the oil giant’s earnings, but Aramco will maintain its hefty dividend for shareholders.",The New York Times,Business,Business Day,"['Oil (Petroleum) and Gasoline', 'Prices (Fares, Fees and Rates)', 'Coronavirus (2019-nCoV)', 'Company Reports']"
The Week in Business: The Stimulus Mess,2020-08-09,article,News,"A jobs report that found  the U.S. economy added 1.8 million jobs in July, and President Trump signed executive orders to extend some of the benefits in the virus relief law.",The New York Times,SundayBusiness,Business Day,"['United States Economy', 'Labor and Jobs', 'Coronavirus Aid, Relief, and Economic Security Act (2020)', 'Coronavirus (2019-nCoV)', 'Unemployment', 'Stimulus (Economic)']"
This Company Boasted to Trump About Its Covid-19 Vaccine. Experts Are Skeptical.,2020-08-09,article,News,"Inovio, a Pennsylvania biotech company, has spent years claiming to be on the cusp of important vaccines. It has never brought one to market.",The New York Times,Business,Business Day,"['Vaccination and Immunization', 'Coronavirus (2019-nCoV)', 'Drugs (Pharmaceuticals)', 'Factories and Manufacturing', 'DNA (Deoxyribonucleic Acid)']"
"At Least 97,000 Children in the U.S. Tested Positive in Last 2 Weeks of July",2020-08-09,article,News,"Trump’s unilateral economic relief actions come under fire. Ohio’s governor urges use of rapid tests, but with caution after his false positive.",The New York Times,Foreign,World,['Coronavirus (2019-nCoV)']
"At Least 1 Dead and 20 Wounded in Washington, D.C., Shooting",2020-08-09,article,News,"An off-duty police officer was in critical condition after multiple people opened fire on what appeared to be a block party, the police said.",The New York Times,Express,U.S.,"['Murders, Attempted Murders and Homicides', 'Attacks on Police']"
Macron Urges World Leaders to Speed Aid to Lebanon After Explosions,2020-08-09,article,News,"The vow to accelerate help, made during a video call with other heads of state, comes amid furious demonstrations in Beirut against the Lebanese government.",The New York Times,Foreign,World,"['Beirut, Lebanon, Explosions (2020)']"
5.1 Magnitude Earthquake Strikes North Carolina,2020-08-09,article,News,"The earthquake near the border with Virginia was the strongest in the region since 1916, the authorities said.",The New York Times,Express,U.S.,['Earthquakes']
Composting Has Been Scrapped. These New Yorkers Picked Up the Slack.,2020-08-09,article,News,"People like Vivian Lin, who quit her job at an architecture firm to start a composting business, have helped fill the void after the city suspended curbside organic waste collection.",The New York Times,Metro,New York,"['Compost', 'Greenhouse Gas Emissions', 'Coronavirus (2019-nCoV)', 'Global Warming']"
Trump’s Orders on Coronavirus Relief Create Confusion,2020-08-09,article,News,Businesses and the unemployed faced uncertainty as administration officials defended the president’s directives and Democrats criticized them.,The New York Times,Washington,U.S.,"['United States Politics and Government', 'United States Economy', 'Coronavirus (2019-nCoV)', 'Coronavirus Aid, Relief, and Economic Security Act (2020)', 'Stimulus (Economic)', 'Federal Budget (US)', 'Federal Aid (US)', 'Federal Taxes (US)', 'Payroll Tax', 'Unemployment', 'Unemployment Insurance', 'Labor and Jobs', 'Small Business', 'Executive Orders and Memorandums']"
Retired Police Officer Tracks Down Escapee Who Shot Him Almost 50 Years Ago,2020-08-09,article,News,"“It was like unfinished business,” the former Denver officer said of finding the fugitive, who had been living under an alias in New Mexico for decades.",The New York Times,Express,U.S.,"['Prison Escapes', 'Fugitives', 'Murders, Attempted Murders and Homicides', 'Attacks on Police']"
Belarus Says Longtime Leader Is Re-elected in Vote Critics Call Rigged,2020-08-09,article,News,"A government exit poll said Aleksandr Lukashenko had won almost 80 percent of the vote. That triggered protests against the repressive regime, and a heavy police response.",The New York Times,Foreign,World,"['Politics and Government', 'Demonstrations, Protests and Riots', 'Voter Fraud (Election Fraud)', 'Elections']"
"Ohio Governor Says His Flawed Virus Test Shouldn’t Undercut New, Rapid Methods",2020-08-09,article,News,"Several states are trying to increase coronavirus testing with faster methods, undeterred by less accurate but quicker readouts.",The New York Times,Science,Health,"['Tests (Medical)', 'Coronavirus (2019-nCoV)']"
Beirut Blast Hit 3 Disparate Neighborhoods. Now They’re United in Rage.,2020-08-09,article,News,The demands for a change in Lebanon’s leadership are growing louder.,The New York Times,Foreign,World,"['Beirut, Lebanon, Explosions (2020)', 'Corruption (Institutional)']"
8 Dead After Attack in a Wildlife Reserve in Niger,2020-08-09,article,News,"French humanitarian workers, their Nigerien driver and a guide were killed, according to the authorities. The group was visiting an area known for its West African giraffes.",The New York Times,Foreign,World,"['Murders, Attempted Murders and Homicides', 'Giraffes', 'United States Defense and Military Forces', 'Politics and Government', 'Terrorism']"
The Key to an Inclusive Recovery? Putting Women in Decision-Making Roles,2020-08-09,article,News,"As the world sketches out post-pandemic plans, Phumzile Mlambo-Ngcuka, the head of U.N. Women, explains why having more women in leadership positions could lead to better results.",The New York Times,Gender,U.S.,"['Women and Girls', ""Women's Rights"", 'Coronavirus (2019-nCoV)']"
Trump’s Directives Were Supposed to Offer Relief. Most May Not.,2020-08-09,article,News,"Because Congress controls federal spending, at least some of the measures will almost certainly be challenged in court. Or they may become moot if Congress reaches a deal.",The New York Times,Business,Business Day,"['Federal Taxes (US)', 'Unemployment Insurance', 'United States Politics and Government', 'Layoffs and Job Reductions', 'Executive Orders and Memorandums', 'Student Loans', 'States (US)', 'Wages and Salaries', 'Payroll Tax', 'Coronavirus Aid, Relief, and Economic Security Act (2020)', 'Evictions']"
"After Falwell Stumbles, His Hometown Sees a Leader in Need of Redemption",2020-08-09,article,News,"Jerry Falwell Jr. has courted controversy repeatedly, but a provocative Instagram post led to him stepping aside as Liberty University’s president.",The New York Times,National,U.S.,"['Ministers (Protestant)', 'Evangelical Movement', 'Colleges and Universities', 'Christians and Christianity']"
"Scenes From a Biker Rally, Undaunted by the Virus",2020-08-09,article,News,"Meet the motorcyclists gathered in Sturgis, S.D., for a giant annual rally, with plenty of regard for one another but little for the pandemic.",The New York Times,National,U.S.,"['Motorcycles, Motor Bikes and Motorscooters', 'Coronavirus (2019-nCoV)', 'Camps and Camping', 'Festivals']"
Salmonella Cases Linked to Onions Increase to Nearly 900,2020-08-10,article,News,"Grocery chains, including Publix and Giant Eagle, have recalled onions supplied by Thomson International and products that may contain the onions.",The New York Times,Express,U.S.,"['Food Contamination and Poisoning', 'States (US)', 'Onions', 'Salmonella (Bacteria)']"
How Pro-Trump Forces Work the Refs in Silicon Valley,2020-08-10,article,News,"The new referees in American politics are Facebook, Google and Twitter, and they would be wise to pay attention to lessons the old media tried to learn.",The New York Times,Business,Business Day,"['Computers and the Internet', 'Social Media', 'Rumors and Misinformation', 'News and News Media', 'United States Politics and Government', 'Presidential Election of 2020', 'Fringe Groups and Movements']"
"Hong Kong Arrests Jimmy Lai, Media Mogul, Under National Security Law",2020-08-10,article,News,"The pro-democracy figure is the most high-profile person detained under the sweeping legislation imposed by Beijing. “It’s hard to believe this is Hong Kong,” said a journalist.",The New York Times,Foreign,World,"['Law and Legislation', 'Frauds and Swindling', 'Demonstrations, Protests and Riots', 'Hong Kong Protests (2019)']"
"As U.S. and Taiwan Celebrate a Bond, China Responds With Screaming Jets",2020-08-10,article,News,The highest-level American visit to Taiwan in decades shows the island’s importance as ties between the United States and China deteriorate.,The New York Times,Foreign,World,"['Coronavirus (2019-nCoV)', 'United States International Relations', 'Presidential Election of 2020']"
Ambition Has Always Been ‘Ladylike’,2020-08-10,article,News,"Black women have long known this. With Kamala Harris as Biden’s V.P. pick, perhaps there’s an opportunity to change the idea that aspirations are something to apologize for.",The New York Times,Politics,U.S.,"['Presidential Election of 2020', 'Women and Girls', 'Discrimination', 'Research', 'Vice Presidents and Vice Presidency (US)']"
Who Opposes Defunding the N.Y.P.D.? These Black Lawmakers,2020-08-10,article,News,"Several Black City Council members have lashed out at progressives, comparing calls to defund the police to “colonization” and “political gentrification.”",The New York Times,Metro,New York,"['Police Reform', 'Black Lives Matter Movement', 'Budgets and Budgeting', 'Police Brutality, Misconduct and Shootings', 'Hispanic-Americans']"
‘I’d Rather Stay Home and Die’,2020-08-10,article,News,A fear of hospitals is leading many Mexicans to delay treatment for coronavirus until it is too late for doctors to help them.,The New York Times,Foreign,World,"['Hospitals', 'Coronavirus (2019-nCoV)', 'Emergency Medical Treatment', 'Deaths (Fatalities)']"
Should Montreal Subway Honor Polarizing Priest or Jazz Genius?,2020-08-10,article,News,A fight to rename a metro stop pits those who want to celebrate a revered Black musician against those who want to retain the name of a priest who espoused equal rights for Francophone Quebecers — and also anti-Semitism.,The New York Times,Foreign,World,"['Names, Geographical', 'Black People', 'Blacks', 'Monuments and Memorials (Structures)', 'Race and Ethnicity', 'Jazz', 'Historic Buildings and Sites']"
Should a Study on Pesticides Affect Our Use of Them?,2020-08-10,article,News,"Recent research, which found a link between pyrethroids and deaths from heart disease, highlights the limitations of epidemiological research.",The New York Times,Well,Well,"['Pesticides', 'Hazardous and Toxic Substances', 'Research', 'Heart', 'West Nile Virus', 'DDT (Dichlorodiphenyltrichloroethane)', 'Medicine and Health']"
When Things Aren’t OK With a Child’s Mental Health,2020-08-10,article,News,Everyone is stressed and anxious now. We have to find and help the children who are hurting most.,The New York Times,Well,Well,"['Children and Childhood', 'Anxiety and Stress', 'Mental Health and Disorders', 'Coronavirus (2019-nCoV)', 'Parenting', 'Families and Family Life', 'Depression (Mental)', 'Teenagers and Adolescence']"
Big Tech Makes Inroads With the Biden Campaign,2020-08-10,article,News,"While Joe Biden has criticized the largest tech companies, his campaign and transition teams have welcomed allies of Facebook, Google, Amazon and Apple onto its staff and policy groups.",The New York Times,Business,Technology,"['Computers and the Internet', 'United States Politics and Government', 'Conflicts of Interest', 'Antitrust Laws and Competition Issues', 'Presidential Election of 2020', 'Regulation and Deregulation of Industry']"
Start-Ups Braced for the Worst. The Worst Never Came.,2020-08-10,article,News,The doomsday warnings about tech start-ups failing in the pandemic have not yielded the shakeout that many expected a few months ago.,The New York Times,Business,Technology,"['Venture Capital', 'Computers and the Internet', 'Layoffs and Job Reductions', 'Start-ups', 'Coronavirus (2019-nCoV)']"
"Stephen Hahn, F.D.A. Chief, Is Caught Between Scientists and the President",2020-08-10,article,News,Many medical experts — including members of his own staff — worry about whether Dr. Hahn has the fortitude and political savvy to protect the scientific integrity of the F.D.A. from Mr. Trump.,The New York Times,Science,Health,"['Coronavirus (2019-nCoV)', 'Drugs (Pharmaceuticals)', 'Tests (Medical)', 'United States Politics and Government', 'Vaccination and Immunization']"
Shopping for Multi-Light Pendants,2020-08-10,article,News,Why settle for a single hanging fixture when you can have multiples? Here’s what you need to know before you buy.,The New York Times,RealEstate,Real Estate,"['Real Estate and Housing (Residential)', 'Interior Design and Furnishings', 'Design', 'Lighting', 'Content Type: Service']"
Will Cars Rule the Roads in Post-Pandemic New York?,2020-08-10,article,News,"Newly emboldened, many New Yorkers want to repurpose streets for walking, biking, dining and schools, even as traffic returns.",The New York Times,Metro,New York,"['Coronavirus (2019-nCoV)', 'Area Planning and Renewal', 'Pedestrian Malls', 'Roads and Traffic', 'Bicycles and Bicycling', 'Restaurants']"
Amazon Satellites Add to Astronomers’ Worries About the Night Sky,2020-08-10,article,News,"The F.C.C. approved the company’s 3,236-satellite constellation, which aims to provide high-speed internet service around the world.",The New York Times,Science,Science,"['Satellites', 'Computers and the Internet', 'Private Spaceflight', 'Telescopes and Observatories', 'Pollution', 'Research', 'Space and Astronomy']"
"On the Shores of Cape Cod, Where the Oyster Is Their World",2020-08-10,article,News,"Pollution, development and overharvesting have greatly diminished America’s natural oyster habitat. Aquaculture and adaptable farmers have changed the game.",The New York Times,Travel,Travel,"['Oysters', 'Fish Farming', 'Travel and Vacations']"
