headline,date,doc_type,type_of_material,snippet,source,news_desk,section_name,keywords
"Belarus Protests Test Limits of Lukashenko’s Brutal, One-Man Rule",2020-08-24,article,News,"For 26 years, President Aleksandr Lukashenko has built a regime in his own eccentric, authoritarian image. Now he faces the greatest challenge yet to his hold on power.",The New York Times,Foreign,World,"['Demonstrations, Protests and Riots', 'Elections', 'Voter Fraud (Election Fraud)']"
"Kellyanne Conway, Long-Serving Trump Aide, Is Leaving the White House",2020-08-24,article,News,Ms. Conway said she was stepping away from her role as the president’s counselor to spend more time with her four teenage children.,The New York Times,Washington,U.S.,['United States Politics and Government']
At Least 14 Killed After Suicide Bombers Hit Philippines,2020-08-24,article,News,Soldiers and civilians were among the dead. The explosions occurred in a town plaza and near a cathedral targeted in a suicide bombing last year.,The New York Times,Foreign,World,"['Bombs and Explosives', 'Terrorism', 'Deaths (Fatalities)']"
A Lawyer’s Tweets Put India’s Supreme Court on Trial and Him at Risk of Imprisonment,2020-08-24,article,News,"Prashant Bhushan, a prominent lawyer who criticized India’s Supreme Court, could be sentenced to jail after he was found in contempt.",The New York Times,Foreign,World,"['Freedom of Speech and Expression', 'Courts and the Judiciary', 'Social Media', 'Politics and Government', 'Coronavirus (2019-nCoV)']"
"As Evictions Loom, Lawyers Are Gearing Up to Help",2020-08-24,article,News,"With a federal moratorium coming to an end, legal aid lawyers say they are preparing to defend renters in housing court.",The New York Times,Business,Business Day,"['Evictions', 'Renting and Leasing (Real Estate)', 'Landlords', 'Legal Aid for the Poor (Civil)', 'Coronavirus Aid, Relief, and Economic Security Act (2020)']"
"As Census Count Resumes, Doubts About Accuracy Continue to Grow",2020-08-24,article,News,Officials project optimism. But a chorus of experts says the pandemic and politics could lead to a deeply flawed count.,The New York Times,National,U.S.,"['Census', 'Population', 'Coronavirus (2019-nCoV)', 'Illegal Immigration']"
Medication and Lifestyle May Lower Breast Cancer Risk,2020-08-24,article,News,There is compelling evidence that two classes of drugs normally prescribed following breast cancer treatment can also help prevent the disease.,The New York Times,Well,Well,"['Breast Cancer', 'Women and Girls', 'Estrogen', 'Breasts', 'Preventive Medicine', 'Hormones', 'Menopause']"
Republicans Renominate Trump in a Roll Call Infused With Fear-Mongering,2020-08-24,article,News,"As 336 party delegates gathered to renominate the president, some warned that “Joe Biden is hiding in the dark, waiting to take the lives of our unborn babies.”",The New York Times,Politics,U.S.,"['Republican National Convention', 'Presidential Election of 2020']"
Why N.Y.C.’s Future May Hinge on Businesses Outside Manhattan,2020-08-24,article,News,"The four other boroughs, hit hard by the pandemic, have increasingly played a crucial role in the city’s expanding economy.",The New York Times,Metro,New York,"['Small Business', 'Coronavirus (2019-nCoV)', 'Economic Conditions and Trends', 'Shopping and Retail']"
He Helped Fellow Immigrants See the World. Now His Business Is Sinking.,2020-08-24,article,News,"Small, minority-owned travel agencies in New York, already pummeled by internet websites, are facing further devastation because of the pandemic.",The New York Times,Metro,New York,"['Travel and Vacations', 'Shutdowns (Institutional)', 'Coronavirus (2019-nCoV)', 'Travel Agencies and Agents', 'Immigration and Emigration', 'Minorities']"
Young Adults’ Pandemic Mental Health Risks,2020-08-24,article,News,"In a new C.D.C. survey, 18- to 24-year-olds reported the highest levels of symptoms of anxiety and depression, and a quarter of them said they had seriously considered suicide.",The New York Times,Well,Well,"['Anxiety and Stress', 'Mental Health and Disorders', 'Youth', 'Colleges and Universities', 'Coronavirus Risks and Safety Concerns', 'Content Type: Service', 'Depression (Mental)', 'Parenting', 'Coronavirus (2019-nCoV)', 'Firearms', 'Teenagers and Adolescence']"
‘The Big Short 2.0’: How Hedge Funds Profited Off the Pain of Malls,2020-08-24,article,News,"As the pandemic accelerated the demise of some brick-and-mortar retailers, a group of investors profited handsomely from their travails.",The New York Times,Business,Business Day,"['Shopping Centers and Malls', 'Coronavirus (2019-nCoV)', 'Hedge Funds', 'Shopping and Retail', 'Short Selling']"
"Not the Convention, or the Election, North Carolina Republicans Hoped For",2020-08-24,article,News,"The G.O.P. was supposed to be celebrating in the state this week. Instead, it is trying to hold on to a Senate seat and lift President Trump’s low poll numbers.",The New York Times,Politics,U.S.,"['Republican National Convention', 'Presidential Election of 2020', 'Elections, Senate']"
"Europe Tried to Limit Mass Layoffs, but the Cuts Are Coming Anyway",2020-08-24,article,News,"Despite furlough schemes that have kept tens of millions of people employed, a tsunami of job cuts is about to hit as companies downsize.",The New York Times,Business,Business Day,"['Layoffs and Job Reductions', 'Labor and Jobs', 'Unemployment', 'Coronavirus (2019-nCoV)']"
Virus Response Fueling G.O.P. Bid to Retake New Mexico Seat,2020-08-24,article,News,"A district flipped by Democrats is suddenly in play again as Republicans mobilize opposition to pandemic measures, signaling the tenuous hold Democrats have on some seats they picked up in 2018.",The New York Times,National,U.S.,"['Politics and Government', 'Elections', 'Coronavirus (2019-nCoV)', 'United States Politics and Government', 'Elections, House of Representatives']"
Social Media Offered Bannon’s Group a Tool to Promote Ties to Trump and Raise Millions,2020-08-24,article,News,An encounter with an administration official. A photo with Donald Trump Jr. A chat with the president himself. Officials at We Build the Wall turned a stream of postings into a gusher of donations.,The New York Times,Washington,U.S.,"['Border Barriers', 'United States Politics and Government', 'Embezzlement']"
Roaming Through Lanzarote’s Otherworldly Vineyards,2020-08-24,article,News,"The desolate beauty of the winemaking tradition on Lanzarote, the easternmost of the Canary Islands, is evidence of human resilience in the face of adversity.",The New York Times,Travel,Travel,"['Wines', 'Islands', 'Grapes', 'Travel and Vacations', 'Volcanoes', 'Drought']"
Florida Judge Strikes Down Order Requiring Schools to Physically Reopen Amid Covid-19 Risks,2020-08-24,article,News,"Quarantine rules are expanding around the world, but not in America. The virus is circulating in Gaza. Researchers in Hong Kong find that in rare cases, a person can get reinfected.",The New York Times,Foreign,World,['Coronavirus (2019-nCoV)']
"Doctors are offering direct access in the pandemic, for those who can afford it.",2020-08-24,article,News,,The New York Times,Business,Business Day,[]
"Reluctant to vacation abroad, Britons are pitching a tent and sticking close to home.",2020-08-24,article,News,,The New York Times,Business,Business Day,[]
"On Mideast Trip, Pompeo Mixes Diplomacy With Partisan Politics",2020-08-24,article,News,The secretary of state’s five-day tour is intended to discuss regional peace and security. He also planned to use Jerusalem as a backdrop for an address to the Republican National Convention.,The New York Times,Foreign,World,"['United States International Relations', 'Presidential Election of 2020', 'Republican National Convention', 'Speeches and Statements']"
Bringing a ‘Broad City’ Approach to Energizing the Youth Vote,2020-08-24,article,News,A new voting project from Ilana Glazer is aimed at millennials and Gen Z members who just need to be persuaded to show up.,The New York Times,Politics,U.S.,"['Presidential Election of 2020', 'Voting and Voters', 'Youth', 'United States Politics and Government']"
This Is the Week Trump’s Been Waiting For,2020-08-24,article,News,But will Republicans’ celebration of their president deliver the agenda-setting boost he needs?,The New York Times,Politics,U.S.,"['Republican National Convention', 'Presidential Election of 2020']"
Why TikTok Will Lose,2020-08-24,article,News,The Chinese-owned video app plans to sue the Trump administration over its order to force a sale. It faces long odds.,The New York Times,Business,Business Day,"['Coronavirus (2019-nCoV)', 'Executive Orders and Memorandums']"
Key Highlights of Louis DeJoy’s Testimony to a House Panel,2020-08-24,article,News,"Louis DeJoy testified before the House Oversight Committee on Monday, where lawmakers continued to express concern about postal changes that could complicate mail-in voting.",The New York Times,Washington,U.S.,"['Presidential Election of 2020', 'United States Politics and Government', 'Politics and Government', 'Suits and Litigation (Civil)', 'Absentee Voting']"
"Afghan Soccer Official, Charged With Sexual Abuse, Evades Arrest",2020-08-24,article,News,"The unsuccessful operation against Keramuddin Keram, whom players accused of rape and other abuses, showed the limited reach of the national government.",The New York Times,Foreign,World,"['Sex Crimes', 'Soccer', 'Tajiks (Ethnic Group)', 'Fugitives']"
Trump releases a largely detail-free agenda for a second term.,2020-08-24,article,News,,The New York Times,Politics,U.S.,[]
"Biden and Harris, in their first interview, dismiss questions about their differences.",2020-08-24,article,News,,The New York Times,Politics,U.S.,[]
"After a week of setbacks, Trump hopes to change the story line.",2020-08-24,article,News,,The New York Times,Politics,U.S.,[]
The Republican convention is underway. Here’s how to watch.,2020-08-24,article,News,,The New York Times,Politics,U.S.,[]
Trump hasn’t tried much to expand his base. Will he change that this week?,2020-08-24,article,News,,The New York Times,Politics,U.S.,[]
$3.7 Million Homes in California,2020-08-24,article,News,"An Edwardian house in San Francisco, a modern beach retreat in Malibu and a renovated 1945 home in La Jolla.",The New York Times,RealEstate,Real Estate,['Real Estate and Housing (Residential)']
"In House testimony, DeJoy calls Trump’s comments about mail-in voting ‘not helpful.’",2020-08-24,article,News,,The New York Times,Politics,U.S.,[]
Shopping for Bar Tools,2020-08-24,article,News,"With most indoor bars still closed, the next best thing is the do-it-yourself version. Here’s what you need to get started.",The New York Times,RealEstate,Real Estate,"['Real Estate and Housing (Residential)', 'Interior Design and Furnishings', 'Furniture', 'Design', 'Tableware', 'Cocktails and Mixed Drinks']"
"Born to the Internet, Grew Up Fast in a Pandemic",2020-08-24,article,News,"When traditional college jobs suddenly went away, these students used their ingenuity to find new ways to pay the bills.",The New York Times,Express,U.S.,"['Generation Z', 'Quarantine (Life and Culture)', 'Entrepreneurship', 'Colleges and Universities', 'Coronavirus (2019-nCoV)', 'Unemployment', 'Labor and Jobs', 'Social Media', 'Fashion and Apparel', 'Computers and the Internet']"
What Are Your Kids Drawing?,2020-08-24,article,News,We’d love to see the ways your children are interpreting and reflecting on the coronavirus pandemic.,The New York Times,NYTNow,Education,"['Coronavirus (2019-nCoV)', 'Art', 'Children and Childhood', 'Parenting', 'internal-essential']"
5 Simple Ways to Improve Your Wi-Fi,2020-08-24,article,News,"So long, sluggish internet.",The New York Times,Smarter Living,Smarter Living,"['Computers and the Internet', 'Telecommuting', 'Quarantine (Life and Culture)']"
Dancing Ban Aimed at Young People Breaks the Rhythm of Many Older Italians,2020-08-24,article,News,"In many Italian towns and villages, outdoor dance halls are a central part of life for the older generation. But a pandemic rule intended to stop crowding in nightclubs is forcing them to close their dance floors.",The New York Times,Foreign,World,"['Coronavirus (2019-nCoV)', 'Coronavirus Reopenings', 'Dancing']"
A New Mexico House seat that flipped to a Democrat in 2018 is back in play.,2020-08-24,article,News,,The New York Times,Politics,U.S.,[]
Partial Zoom Outage Is Fixed After School Disruptions,2020-08-24,article,News,"Some school districts and colleges also had outages on Canvas, an online learning platform.",The New York Times,Express,Business Day,"['Education (K-12)', 'Videophones and Videoconferencing', 'E-Learning', 'Computer Network Outages']"
"Aleksei Navalny, Putin Critic in a Coma, Was Poisoned, German Doctors Say",2020-08-24,article,News,"Once again, a prominent critic of Moscow has mysteriously fallen ill. And once again, poison appears to be the culprit.",The New York Times,Foreign,World,"['Poisoning and Poisons', 'Assassinations and Attempted Assassinations']"
Honey May Ease Coughs and Other Respiratory Symptoms,2020-08-24,article,News,A review of studies confirms an old home remedy: honey for colds.,The New York Times,Well,Well,"['Respiratory Diseases', 'Coughs', 'Colds', 'Honey']"
TikTok Sues U.S. Government Over Trump Ban,2020-08-24,article,News,The suit escalates a bitter back-and-forth between the popular video app and American officials.,The New York Times,Business,Technology,"['Executive Orders and Memorandums', 'United States Politics and Government', 'Presidential Election of 2020', 'Social Media', 'Suits and Litigation (Civil)', 'Mobile Applications', 'Computers and the Internet', 'Blacklisting']"
Pence tells the convention he and Trump will defend borders and the ‘right to life.’,2020-08-24,article,News,,The New York Times,Politics,U.S.,[]
Scope of California Wildfires Is Staggering,2020-08-24,article,News,"Fires have chewed through 1.4 million acres in the state this year. By this point in 2019, 56,000 acres had burned.",The New York Times,National,U.S.,"['Fires and Firefighters', 'Wildfires']"
"1,100-Year-Old Treasure Is Unearthed by Teenagers in Israel",2020-08-24,article,News,The discovery of hundreds of gold coins dating to the ninth century could help archaeologists better understand the history of the region.,The New York Times,Foreign,World,"['Treasure Troves', 'Gold', 'ARCHAEOLOGY AND ANTHROPOLOGY']"
Why Trump’s Approval Ratings on the Economy Remain Durable,2020-08-24,article,News,"Despite the recession, polling data and interviews with voters and political analysts suggest that a confluence of factors is raising the president’s standing on the economy issue.",The New York Times,Politics,U.S.,"['Presidential Election of 2020', 'United States Economy', 'Polls and Public Opinion', 'Coronavirus (2019-nCoV)', 'United States Politics and Government', 'Labor and Jobs']"
"Climate Is Taking On a Growing Role for Voters, Research Suggests",2020-08-24,article,News,"Concern about global warming is steady despite other crises, a survey found, and the number of voters who are deeply engaged on the issue is rising sharply.",The New York Times,Climate,Climate,"['Global Warming', 'Polls and Public Opinion', 'Environment', 'Presidential Election of 2020', 'United States Politics and Government']"
Over two dozen Republicans who served in Congress endorse Biden.,2020-08-24,article,News,,The New York Times,Politics,U.S.,[]
Daughter of Immigrants to Be 1st Black Woman on N.J. Supreme Court,2020-08-24,article,News,"Fabiana Pierre-Louis, 39, will also be the only Black judge currently seated on the state’s highest court.",The New York Times,Metro,New York,"['Supreme Courts (State)', 'State Legislatures', 'George Floyd Protests (2020)', 'Black Lives Matter Movement', 'Black People', 'Blacks', 'Legal Profession', 'Police Brutality, Misconduct and Shootings', 'Immigration and Emigration']"
Africa Celebrates the End of the Wild Poliovirus (but Not the End of All Polio),2020-08-24,article,News,"A virus that once paralyzed tens of thousands of children a year is said to have been eradicated on the African continent, though a minor strain still infects hundreds.",The New York Times,Foreign,World,"['Vaccination and Immunization', 'Poliomyelitis']"
Schools Briefing: The Outlook for In-Person Classes,2020-08-24,article,News,"A look at how U.S. colleges and universities are starting the semester, and the challenges for students with special needs.",The New York Times,NYTNow,U.S.,"['Coronavirus (2019-nCoV)', 'Coronavirus Reopenings', 'Colleges and Universities', 'Learning Disabilities']"
First Documented Coronavirus Reinfection Reported in Hong Kong,2020-08-24,article,News,"The patient did mount an immune response to the new infection, however, and did not experience symptoms.",The New York Times,Science,Health,"['Coronavirus (2019-nCoV)', 'Disease Rates', 'Antibodies', 'Vaccination and Immunization', 'your-feed-science']"
"Marco Spares Gulf Coast, Which Is Bracing for Tropical Storm Laura",2020-08-24,article,News,"While Louisiana’s governor said the region caught a big break as Tropical Storm Marco faded, evacuation orders were issued as communities prepared for Laura’s strength.",The New York Times,National,U.S.,"['Hurricanes and Tropical Storms', 'Disasters and Emergencies', 'Weather', 'Oil (Petroleum) and Gasoline', 'Coronavirus (2019-nCoV)']"
"Biden reiterates a plan to raise taxes on ‘anybody making over $400,000.’",2020-08-24,article,News,,The New York Times,Politics,U.S.,[]
N.Y. Attorney General Asks Judge to Order Eric Trump’s Testimony,2020-08-24,article,News,"The Trump Organization has stalled a state inquiry into the financing of four properties for months, Attorney General Letitia James said in court papers.",The New York Times,Metro,New York,"['Banking and Financial Institutions', 'Attorneys General', 'Frauds and Swindling']"
"This isn’t the convention, or the election, North Carolina Republicans had hoped for.",2020-08-24,article,News,,The New York Times,Politics,U.S.,[]
LeBron James and a Multimillion-Dollar Push for More Poll Workers,2020-08-24,article,News,"More Than a Vote, a group of athletes headlined by LeBron James, is launching a campaign to address poll worker shortages and the need to keep polling stations open in Black electoral districts.",The New York Times,Politics,U.S.,"['Black People', 'Blacks', 'Absentee Voting', 'Coronavirus (2019-nCoV)', 'Voter Registration and Requirements']"
Wisconsin Reels After Police Shooting and Second Night of Protests,2020-08-24,article,News,"Jacob Blake, a Black resident of Kenosha, was shot in the back, setting off condemnations from Wisconsin’s governor and Joe Biden, the Democrats’ presidential nominee.",The New York Times,National,U.S.,"['Police Brutality, Misconduct and Shootings', 'Black Lives Matter Movement', 'George Floyd Protests (2020)', 'Demonstrations, Protests and Riots', 'Black People', 'Blacks']"
Ilana Glazer brings a ‘Broad City’ approach to energizing young voters.,2020-08-24,article,News,,The New York Times,Politics,U.S.,[]
The N.Y. attorney general asked a judge to order Eric Trump to testify about the Trump family business.,2020-08-24,article,News,,The New York Times,Politics,U.S.,[]
"Day After Mass Protests, Belarus Arrests Opposition Activists",2020-08-24,article,News,"After rallies in the capital, Minsk, drew 100,000 people, the authorities arrested two more opposition activists and summoned others for questioning.",The New York Times,Foreign,World,"['Demonstrations, Protests and Riots', 'Politics and Government', 'Diplomatic Service, Embassies and Consulates']"
Kellyanne Conway is leaving the White House.,2020-08-24,article,News,,The New York Times,Politics,U.S.,[]
Scott Peterson’s Death Sentence Is Overturned,2020-08-24,article,News,"The California Supreme Court upheld Mr. Peterson’s 2004 conviction for killing his wife, Laci Peterson, but it said the judge’s mistakes had denied him an impartial jury during sentencing.",The New York Times,Express,U.S.,"['Jury System', 'Capital Punishment', 'Decisions and Verdicts']"
Networks’ Challenge: Covering a Live Convention When Falsehoods Fly,2020-08-24,article,News,"President Trump lobbed unsubstantiated claims during his Monday speech in Charlotte, N.C. TV broadcasters are trying to balance voters’ right to hear directly from their president with efforts to keep viewers informed of the facts.",The New York Times,Politics,U.S.,"['Republican National Convention', 'Presidential Election of 2020', 'News and News Media', 'Rumors and Misinformation', 'Television', 'United States Politics and Government']"
Puerto Rican officials tested positive for the coronavirus after indoor campaign events.,2020-08-24,article,News,,The New York Times,Politics,U.S.,[]
Jerry Falwell Jr.’s Leadership at Liberty Appears Near End,2020-08-24,article,News,"One of President Trump’s most prominent evangelical supporters, Mr. Falwell denied reports he had resigned from the university.",The New York Times,National,U.S.,"['Appointments and Executive Changes', 'Evangelical Movement', 'ADULTERY']"
"Even before Falwell resigned, he was not invited back to the Republican convention.",2020-08-24,article,News,,The New York Times,Politics,U.S.,[]
DeJoy Defends Postal Changes as Trump Continues to Attack Voting by Mail,2020-08-24,article,News,"Facing tough questioning from a House panel, the postmaster general denounced suggestions that he was working to help President Trump politically and defended the cost-cutting changes he has overseen.",The New York Times,Washington,U.S.,"['Presidential Election of 2020', 'United States Politics and Government', 'Coronavirus (2019-nCoV)', 'Absentee Voting', 'Postal Service and Post Offices']"
Biden and Harris will be tested regularly for the coronavirus.,2020-08-24,article,News,,The New York Times,Politics,U.S.,[]
Trump Keeps Promoting a Drug Order That No One Has Seen,2020-08-24,article,News,"The president’s campaign has made his efforts to lower prescription drug prices a centerpiece of his re-election pitch, but the executive order remains unseen.",The New York Times,Washington,U.S.,"['Drugs (Pharmaceuticals)', 'Prices (Fares, Fees and Rates)', 'Executive Orders and Memorandums', 'United States Politics and Government', 'Presidential Election of 2020', 'Political Advertising', 'International Trade and World Market']"
4 Years of Catastrophic Fires in California: ‘I’m Numb’,2020-08-24,article,News,"For the eight million residents of the San Francisco Bay Area, a ring of fire across Northern California feels inescapable.",The New York Times,National,U.S.,"['Wildfires', 'Fires and Firefighters']"
The One-Man Show Begins,2020-08-24,article,News,President Trump takes center stage at the R.N.C.,The New York Times,Politics,U.S.,['Presidential Election of 2020']
"Nominating Trump, Republicans Rewrite His Record",2020-08-24,article,News,"President Trump and his party engaged in sweeping revisionism about his management of the coronavirus, his record on race relations and much else. And they painted a dystopian picture of what the nation would look like if Joseph R. Biden Jr. were ...",The New York Times,Politics,U.S.,"['Presidential Election of 2020', 'United States Politics and Government', 'Republican National Convention', 'Conservatism (US Politics)', 'Politics and Government', 'George Floyd Protests (2020)', 'Coronavirus (2019-nCoV)', 'Race and Ethnicity']"
Radical Break From Tradition: Trump Stages Part of His Convention From the White House,2020-08-24,article,News,But President Trump’s convention speech and those of Melania Trump and Secretary of State Mike Pompeo are only the latest examples of how Mr. Trump has further blurred the lines between the government and his campaign.,The New York Times,Washington,U.S.,"['Republican National Convention', 'United States Politics and Government', 'Presidential Election of 2020', 'Hatch Act (1939)', 'Presidents and Presidency (US)', 'White House Building (Washington, DC)']"
"Insurer Drops Whistle-Blower Lawyer, Citing High-Profile Work",2020-08-24,article,News,The decision shows some of the risks for government whistle-blowers and those who work to support them.,The New York Times,Washington,U.S.,"['Trump-Ukraine Whistle-blower Complaint and Impeachment Inquiry', 'United States Politics and Government', 'Whistle-Blowers', 'Insurance', 'Malpractice']"
"F.D.A. ‘Grossly Misrepresented’ Blood Plasma Data, Scientists Say",2020-08-25,article,News,Many experts — including a scientist who worked on the Mayo Clinic study — were bewildered about where a key statistic came from.,The New York Times,Science,Health,"['Coronavirus (2019-nCoV)', 'Antibodies', 'Clinical Trials', 'Blood', 'United States Politics and Government']"
"Duncan Hunter’s Wife, Margaret, Is Sentenced for Stealing Campaign Funds",2020-08-25,article,News,"Unlike her husband, a former congressman, she quickly admitted her guilt and cooperated with investigators, officials said.",The New York Times,Express,U.S.,"['Elections, House of Representatives', 'United States Politics and Government', 'United States Attorneys']"
"American and Chinese Officials Take Pulse on Trade Deal, Six Months In",2020-08-25,article,News,Trade negotiators from the two countries met by videoconference to review the progress in enacting their trade deal.,The New York Times,Washington,Business Day,"['International Trade and World Market', 'Economic Conditions and Trends', 'United States International Relations', 'United States Economy', 'Coronavirus (2019-nCoV)', 'Elections', 'Agriculture and Farming']"
