headline,date,doc_type,type_of_material,snippet,source,news_desk,section_name,keywords
Endless Summer vs. Hurry-Up Fall,2020-09-09,article,News,"New season, new concerns, new ways of coping.",The New York Times,AtHome,At Home,['Quarantine (Life and Culture)']
Barr says it’s normal for the Justice Dept. to defend the president in a defamation suit.,2020-09-09,article,News,,The New York Times,Politics,U.S.,[]
Bankrupt J.C. Penney Is Bought by Mall Operators in Need of Tenants,2020-09-09,article,News,The deal for the company’s retail business will keep a number of locations open and is likely to save tens of thousands of jobs.,The New York Times,Business,Business Day,"['Shopping and Retail', 'Shopping Centers and Malls', 'Bankruptcies']"
What We Don’t Know About 2020,2020-09-09,article,News,"With less than eight weeks to go until Election Day, a number of factors could still shake the race.",The New York Times,Politics,U.S.,"['United States Politics and Government', 'Presidential Election of 2020', 'Absentee Voting', 'Demonstrations, Protests and Riots', 'Vaccination and Immunization', 'Coronavirus (2019-nCoV)']"
"5 Takeaways From ‘Rage,’ Bob Woodward’s New Book About Trump",2020-09-09,article,News,Mr. Woodward reveals that President Trump sought to play down the severity of the coronavirus and repeatedly denigrated the U.S. military.,The New York Times,Washington,U.S.,"['United States Politics and Government', 'Coronavirus (2019-nCoV)', 'Black People', 'Blacks', 'United States Defense and Military Forces', 'United States International Relations']"
"Trump Resumes the Rallies He Cherishes, but Virus Vexes His Plans",2020-09-09,article,News,"With hyperbole and falsehoods, the president has increased stops at airports that resemble campaign rallies, his favorite type of politicking. But Nevada said the events violated health restrictions and canceled two rallies there.",The New York Times,Politics,U.S.,"['Presidential Election of 2020', 'Demonstrations, Protests and Riots', 'Masks', 'United States Politics and Government', 'Coronavirus (2019-nCoV)', 'States (US)', 'AIRPORTS', 'Freedom of Speech and Expression']"
Wildfires Bring New Devastation Across the West,2020-09-09,article,News,"A record 2.5 million acres have burned in California, while entire communities in Oregon and Washington were largely wiped out.",The New York Times,National,U.S.,"['Wildfires', 'Deaths (Fatalities)', 'Evacuations and Evacuees']"
Health Official Tries to Reassure Public That Science Will Set Vaccine Approval,2020-09-09,article,News,"Dr. Francis S. Collins, the National Institutes of Health director, who testified before senators along with Surgeon General Jerome Adams, said a vaccine wouldn’t be made available unless it was safe.",The New York Times,Washington,U.S.,"['Coronavirus (2019-nCoV)', 'Vaccination and Immunization', 'Clinical Trials', 'United States Politics and Government']"
Postal Service to Tap Republican Lobbyist to Quell Mounting Scrutiny,2020-09-10,article,News,"Facing multiple investigations and calls for his ouster, the postmaster general turned to a G.O.P. lobbyist viewed as adept at reaching out to Democrats.",The New York Times,Washington,U.S.,"['Postal Service and Post Offices', 'Absentee Voting', 'Lobbying and Lobbyists', 'Voter Fraud (Election Fraud)', 'Presidential Election of 2020', 'United States Politics and Government', 'Coronavirus (2019-nCoV)']"
Federal Prosecutors Intervene to Charge 2 Over Rochester Protests,2020-09-10,article,News,"The men are accused of civil disorder, in the latest move by the federal authorities to target those they say are bent on causing violence.",The New York Times,Metro,New York,"['Demonstrations, Protests and Riots', 'Attacks on Police']"
Texas Man Sentenced to Five Years for Planting Bombs in Beaumont,2020-09-10,article,News,"Jonathan Matthew Torres “preyed upon Beaumont,” terrifying residents days after a bomb spree in Austin, federal officials said.",The New York Times,Express,U.S.,"['Bombs and Explosives', 'Postal Service and Post Offices', 'Churches (Buildings)', 'Postcards']"
Surging Euro Presents E.C.B. With a Dilemma,2020-09-10,article,News,A rising currency is eroding the competitiveness of European exporters. Central bankers are starting to worry.,The New York Times,Business,Business Day,"['Euro (Currency)', 'Stimulus (Economic)', 'Interest Rates', 'International Trade and World Market', 'US Dollar (Currency)']"
Do Jobless Benefits Deter Workers? Some Employers Say Yes. Studies Don’t.,2020-09-10,article,News,A $600-a-week supplement that expired in July has been credited with bolstering the economy. Its impact on hiring is central to a political fight.,The New York Times,Business,Business Day,"['Unemployment Insurance', 'Hiring and Promotion', 'United States Economy', 'Labor and Jobs', 'Unemployment', 'Coronavirus (2019-nCoV)', 'Coronavirus Aid, Relief, and Economic Security Act (2020)', 'United States Politics and Government', 'Economics (Theory and Philosophy)']"
Chinese Ambassador ‘Likes’ an X-Rated Video. Awkward.,2020-09-10,article,News,"China demanded that Twitter investigate, suggesting that Liu Xiaoming’s account had been compromised. But the account has a history of unusual likes.",The New York Times,Foreign,World,"['Politics and Government', 'Diplomatic Service, Embassies and Consulates', 'Social Media']"
How Should Feminism Target Sexual Abuse? A Battle in Patriarchal France,2020-09-10,article,News,A high-profile sexual abuse case has pitted competing strains of feminism against each other in a country where the #MeToo movement was slow to take hold.,The New York Times,Foreign,World,"[""Women's Rights"", 'Politics and Government', 'Women and Girls', '#MeToo Movement', 'Black People', 'Blacks', 'Sexual Harassment', 'Sex Crimes', 'Child Abuse and Neglect']"
"If You See Someone Not Wearing a Mask, Do You Say Something?",2020-09-10,article,News,"I considered whether to put on a mask at the party and, as a doctor, did so. People glanced at me hesitantly, noticing. I felt awkward.",The New York Times,Well,Well,"['Masks', 'Medicine and Health', 'Coronavirus (2019-nCoV)', 'Doctors', 'Psychology and Psychologists', 'Parties (Social)']"
"That Person Floating Over the East River Is Riding a $12,000 Water Toy",2020-09-10,article,News,"A cross between a surfboard and a Jet Ski, the eFoil can go as fast as 25 miles per hour — but only for 90 minutes at a time.",The New York Times,Metropolitan,New York,"['Surfing', 'Electric and Hybrid Vehicles']"
"On the Packing List This Year: Masks, Sanitizer and a Very Good Boy",2020-09-10,article,News,"Neither house sitters nor jetting off for the weekend are possibilities for most dog owners who want to travel right now. So these furry friends are increasingly curled up in the back (or front) seat, enjoying the ride.",The New York Times,Travel,Travel,"['Travel and Vacations', 'Road Trips', 'Dogs', 'Pets', 'Summer (Season)', 'AIRLINES AND AIRPLANES', 'Hotels and Travel Lodgings', 'Coronavirus (2019-nCoV)']"
"In Encounters With Black Leaders, Trump Has Chosen Photo Ops Over Substance",2020-09-10,article,News,The president claims he is a champion of Black Americans. But those who have tried to work with him tell a different story.,The New York Times,Politics,U.S.,"['Black People', 'Blacks', 'Discrimination', 'Presidential Election of 2020', 'United States Politics and Government']"
"In a Year Like No Other, a ‘Historic Crisis’ of Need",2020-09-10,article,News,"When Times readers heard the call of The Neediest Cases Fund’s annual campaign, they gave. And when a pandemic took hold, they gave again.",The New York Times,Neediest,Neediest Cases,['Philanthropy']
‘They Call Me a Criminal’: Nursing Home Workers Who May Spread the Virus,2020-09-10,article,News,"As states struggle to keep the coronavirus out of nursing homes, employees who work at multiple facilities are thought to be behind some of the continuing spread.",The New York Times,National,U.S.,"['Nursing Homes', 'Elderly', 'Elder Care', 'Coronavirus (2019-nCoV)', 'Disease Rates']"
London Offices Aren’t Refilling Fast Enough for Shops Relying on Them,2020-09-10,article,News,"The British government and business lobby want workers to return to support surrounding businesses, but some city offices are only 15 percent full.",The New York Times,Business,Business Day,"['Real Estate (Commercial)', 'Shopping and Retail', 'Small Business', 'Economic Conditions and Trends', 'Coronavirus (2019-nCoV)', 'Quarantines', 'Telecommuting']"
"Coronavirus Can Be Deadly for Young Adults, Too, Study Finds",2020-09-10,article,News,"India set another record for new infections, adding more than 96,000. The Senate did not approve a Republican proposal for more virus aid.",The New York Times,National,World,['Coronavirus (2019-nCoV)']
"These Changes Are Needed Amid Worsening Wildfires, Experts Say",2020-09-10,article,News,"The blazes scorching the West highlight the urgency of rethinking fire management policies, as climate change threatens to make things worse.",The New York Times,Climate,Climate,"['Global Warming', 'Environment', 'Greenhouse Gas Emissions', 'Wildfires', 'Land Use Policies', 'Building (Construction)', 'Forests and Forestry']"
"Business owners fret that jobless benefits deter workers, but studies show otherwise.",2020-09-10,article,News,,The New York Times,Business,Business Day,[]
"London’s offices are largely empty, like the tills in nearby shops.",2020-09-10,article,News,,The New York Times,Business,Business Day,[]
Safety Review Underway of AstraZeneca’s Vaccine Trial,2020-09-10,article,News,A participant in the company’s late-stage coronavirus vaccine trial reportedly developed severe neurological symptoms. Now experts must assess whether the vaccine was responsible.,The New York Times,Science,Health,"['Clinical Trials', 'Vaccination and Immunization', 'Coronavirus (2019-nCoV)', 'your-feed-healthcare']"
What Milton Friedman Missed About Social Inequality,2020-09-10,article,News,"Since the economist wrote his influential essay on capitalism, the “haves” have gained much — and everyone else has missed out.",The New York Times,Business,Business Day,"['Corporate Social Responsibility', 'Executive Compensation']"
The Woodward Revelations,2020-09-10,article,News,"In March, Trump admitted he was downplaying the coronavirus: This is your morning tip sheet.",The New York Times,Politics,U.S.,"['Coronavirus (2019-nCoV)', 'Presidential Election of 2020']"
"New Fire Erupts in Beirut Port, Just Weeks After Devastating Blast",2020-09-10,article,News,"Orange flames and a plume of black smoke rose over the city, terrifying residents still recovering from last month’s explosion.",The New York Times,Foreign,World,"['Beirut, Lebanon, Explosions (2020)', 'Fires and Firefighters']"
The Case of the LVMH Letter,2020-09-10,article,News,Can a French government intervention excuse the luxury conglomerate from its $16.2 billion deal with Tiffany? It depends on what counts as an order.,The New York Times,Business,Business Day,"['Mergers, Acquisitions and Divestitures', 'Clinical Trials', 'Coronavirus (2019-nCoV)', 'Bitcoin (Currency)']"
"The president is holding frequent rallies again, though the virus has caused snags.",2020-09-10,article,News,"With hyperbole and falsehoods, the president has increased stops at airports that resemble campaign rallies, his favorite type of politicking. But Nevada said the events violated health restrictions and canceled two rallies there.",The New York Times,Politics,U.S.,[]
Trump’s Supreme Court list comes as he seeks a political boost.,2020-09-10,article,News,"The president, who views his commitment to a conservative federal judiciary as critical to his 2016 victory, added 20 more names to earlier lists.",The New York Times,Politics,U.S.,[]
"Many ask if Woodward should have revealed Trump’s comments sooner, and Trump weighs in.",2020-09-10,article,News,,The New York Times,Politics,U.S.,[]
Biden says his rival ‘failed to do his job on purpose’ as the virus ravaged the country.,2020-09-10,article,News,"Before sketching out a plan to keep more jobs in the United States, the former vice president denounced his rival over revelations in a new book that the president knowingly minimized the coronavirus’s dangers.",The New York Times,Politics,U.S.,[]
"Pelosi and Schumer advise Americans to vote early, warning of possible election interference.",2020-09-10,article,News,,The New York Times,Politics,U.S.,[]
Trump will head to Michigan amid multiple controversies.,2020-09-10,article,News,,The New York Times,Politics,U.S.,[]
"For Survivors at Charlie Hebdo Trial, Wounds Are Still Raw",2020-09-10,article,News,Victims of the 2015 attack on the satirical weekly took the stand this week with vivid accounts of how their colleagues were killed — and how their own lives were suddenly overturned.,The New York Times,Foreign,World,"['Terrorism', 'Muslims and Islam']"
Tucker Carlson blames Trump’s 18 interviews with Bob Woodward on Lindsey Graham.,2020-09-10,article,News,,The New York Times,Politics,U.S.,[]
Citigroup’s Fraser to Be First Woman to Lead a Big Wall Street Bank,2020-09-10,article,News,"Jane Fraser, Citigroup’s president, will replace Michael Corbat as chief executive in February as he retires after eight years.",The New York Times,Business,Business Day,"['Appointments and Executive Changes', 'Banking and Financial Institutions', 'Women and Girls']"
Cleaners Demand Harassment Safeguards From the Booking Service Handy,2020-09-10,article,News,Workers for a home services company say they face sexual harassment and unfair fees. A civil rights group is asking California regulators to step in.,The New York Times,Business,Business Day,"['Labor and Jobs', 'Sexual Harassment', 'Domestic Service', 'Freelancing, Self-Employment and Independent Contracting', 'Workplace Hazards and Violations']"
"Fewer Homes, Higher Asking Prices",2020-09-10,article,News,"Though asking prices are up somewhat, reduced inventory could cause final selling prices to be even higher.",The New York Times,RealEstate,Real Estate,"['Real Estate and Housing (Residential)', 'Prices (Fares, Fees and Rates)', 'Mortgages', 'Coronavirus (2019-nCoV)']"
Homes for Sale in New York and New Jersey,2020-09-10,article,News,"This week’s properties include a six-bedroom, 1788 house in Albertson, N.Y., and a five-bedroom in Absecon, N.J.",The New York Times,RealEstate,Real Estate,['Real Estate and Housing (Residential)']
"Homes for Sale in Brooklyn, the Bronx and Manhattan",2020-09-10,article,News,"This week’s properties are in Red Hook, Kingsbridge and Midtown East.",The New York Times,RealEstate,Real Estate,['Real Estate and Housing (Residential)']
10 Dead in California as Wildfires Spread on West Coast,2020-09-10,article,News,"More than three million acres have burned in California, and officials said one of the most damaging fires in Oregon may have been deliberately set.",The New York Times,National,U.S.,"['Fires and Firefighters', 'Deaths (Fatalities)', 'Wildfires', 'Evacuations and Evacuees']"
Violent Protests Erupt in Colombia After a Man Dies in Police Custody,2020-09-10,article,News,A video showed officers pinning down Javier Ordóñez and shocking him with a stun gun as he begged them to stop.,The New York Times,Foreign,World,"['Demonstrations, Protests and Riots', 'Deaths (Fatalities)', 'Police Brutality, Misconduct and Shootings']"
A poll finds most Americans are worried the Trump administration will rush a virus vaccine.,2020-09-10,article,News,,The New York Times,Politics,U.S.,[]
What We Know About the Death of Rayshard Brooks,2020-09-10,article,News,"Killed by an Atlanta police officer just weeks after George Floyd’s death touched off nationwide protests, Mr. Brooks became a potent symbol.",The New York Times,Express,U.S.,"['George Floyd Protests (2020)', 'Black Lives Matter Movement', 'Police Brutality, Misconduct and Shootings', 'Black People', 'Blacks', 'Murders, Attempted Murders and Homicides', 'Demonstrations, Protests and Riots']"
What We Know About the Shooting of Jacob Blake,2020-09-10,article,News,"The police shooting of Mr. Blake ignited protests in Kenosha, Wis., including one in which the authorities said a teenager fatally shot two demonstrators.",The New York Times,Express,U.S.,"['George Floyd Protests (2020)', 'Police Brutality, Misconduct and Shootings', 'Black Lives Matter Movement', 'Demonstrations, Protests and Riots', 'Black People', 'Blacks', 'Murders, Attempted Murders and Homicides', 'Presidential Election of 2020', 'Civil Rights and Liberties']"
Pandemic Collides With Europe’s Migrant Crisis to Set Off a Calamity in Greece,2020-09-10,article,News,"Frustrated asylum seekers lit fires this week in protest over lockdowns that worsened cramped and squalid conditions on Lesbos. Now 12,000 migrants are homeless.",The New York Times,Foreign,World,"['Fires and Firefighters', 'ARSON', 'Middle East and Africa Migrant Crisis', 'Politics and Government', 'Immigration and Emigration', 'Refugees and Displaced Persons', 'Asylum, Right of', 'Coronavirus (2019-nCoV)', 'Quarantines']"
The Native Artists Showing Us What’s Happening in Indigenous America,2020-09-10,article,News,"We spoke with Wendy Red Star about what it was like to curate, edit and feature a wide range of Native artists for the Fall issue of Aperture.",The New York Times,National,U.S.,"['Art', 'Native Americans', 'Photography']"
A Black Venture Capitalist Sees Challenges as an Investing Edge,2020-09-10,article,News,"“Black Founders Matter” started out as a T-shirt design. Now, a once-jilted start-up founder is trying to turn it into a moneymaking strategy.",The New York Times,Business,Business Day,"['Venture Capital', 'Black People', 'Blacks', 'Race and Ethnicity', 'Discrimination', 'Black Lives Matter Movement', 'Entrepreneurship', 'Start-ups']"
Dress code for tonight’s Michigan rally: the only acceptable campaign gear is Trump’s.,2020-09-10,article,News,,The New York Times,Politics,U.S.,[]
"The Causes of Estrangement, and How Families Heal",2020-09-10,article,News,"For those who reconcile with estranged relatives, the key is “letting go of the attempt to have the other person see the past as they saw it,” the author of a new book says.",The New York Times,Well,Well,"['Content Type: Service', 'Families and Family Life', 'Children and Childhood', 'Psychology and Psychologists', 'Parenting']"
"The racial justice movement is motivating young Latinos to vote, a poll finds.",2020-09-10,article,News,,The New York Times,Politics,U.S.,[]
"The Fire Compounding Misery at the Lesbos Camp, in Photos",2020-09-10,article,News,Thousands were displaced by fires at Europe’s largest refugee camp on the Greek island of Lesbos this week.,The New York Times,Foreign,World,['Fires and Firefighters']
Social Media Shaming Your College,2020-09-10,article,News,Students are using apps to shame their schools into better coronavirus plans.,The New York Times,NewsDesk,Technology,"['Colleges and Universities', 'Coronavirus (2019-nCoV)', 'Photography', 'Social Media', 'Wildfires']"
"In encounters with Black leaders, Trump has chosen photo ops over substance.",2020-09-10,article,News,The president claims he is a champion of Black Americans. But those who have tried to work with him tell a different story.,The New York Times,Politics,U.S.,[]
Afghan Peace Talks Begin This Week. Here’s What to Know.,2020-09-10,article,News,The Afghan government and the Taliban are to meet on Saturday to open negotiations about power sharing after years of relentless war. The differences on major issues are vast.,The New York Times,Foreign,World,"['Afghanistan War (2001- )', 'Politics and Government', 'United States Defense and Military Forces', 'International Relations', 'Peace Process']"
Democrats are sending a truck to Trump’s Michigan rally to play audio of his coronavirus comments.,2020-09-10,article,News,,The New York Times,Politics,U.S.,[]
"Return of the King: Ninja, a Video Game Star, Goes Back to Twitch",2020-09-10,article,News,"After months of speculation, one of the world’s most famous video gamers announced his next move.",The New York Times,Business,Business Day,"['Computer and Video Games', 'Video Recordings, Downloads and Streaming']"
"When the Otters Vanished, Everything Else Started to Crumble",2020-09-10,article,News,"Against the backdrop of climate change, the delicate underwater ecology of Alaska’s Aleutian Islands is hurting from declines in otters.",The New York Times,Science,Science,"['Otters (Animals)', 'ALGAE', 'Seaweed', 'Reefs', 'Fish and Other Marine Life', 'Greenhouse Gas Emissions', 'Global Warming', 'Carbon Dioxide', 'Research', 'your-feed-science', 'your-feed-animals']"
Killings Reignite Racial Tensions in Guyana,2020-09-10,article,News,"The South American country, already deeply split by a presidential election and an oil windfall, is tested again as three teenagers are slain.",The New York Times,Foreign,World,"['Demonstrations, Protests and Riots', 'Murders, Attempted Murders and Homicides']"
Ethiopian Region Holds Local Elections in Defiance of Prime Minister,2020-09-10,article,News,"The government of Prime Minister Abiy Ahmed postponed elections this year because of the coronavirus, but the restive northern region of Tigray went ahead and held a vote anyway, escalating tensions.",The New York Times,Foreign,World,['Elections']
"Russian Intelligence Hackers Are Back, Microsoft Warns, Aiming at Officials of Both Parties",2020-09-10,article,News,"China is also growing more adept at targeting campaign workers. But contrary to Trump administration warnings, Beijing is mostly aiming at Biden campaign officials.",The New York Times,Washington,U.S.,"['Presidential Election of 2020', 'Cyberwarfare and Defense', 'Espionage and Intelligence Services', 'Russian Interference in 2016 US Elections and Ties to Trump Associates']"
Chevy’s Little Engine That Could,2020-09-10,article,News,"For six decades, a small-block Chevy has powered the dreams of hot-rodders and Corvettes, and plenty of other cars, even a Ford Mustang.",The New York Times,Business,Business Day,"['Automobiles', 'Antique and Classic Cars', 'Engines', 'Engineering and Engineers', 'Automobile Racing']"
3 Air National Guard Members Killed in Plane Crash in Tennessee,2020-09-10,article,News,"The crash, which occurred near an airport 70 miles southeast of Nashville, is being investigated by the F.A.A. and the National Transportation Safety Board.",The New York Times,Express,U.S.,"['Aviation Accidents, Safety and Disasters', 'Deaths (Fatalities)']"
Historic Wildfires Rage in Western States,2020-09-10,article,News,"Photographs from California, Oregon and Washington, where hundreds of thousands were under evacuation orders.",The New York Times,National,U.S.,"['Fires and Firefighters', 'Wildfires']"
Justice Dept. Announces Dozens of Fraud Charges in Small-Business Aid Program,2020-09-10,article,News,"Fifty-seven people were charged with trying to steal more than $175 million from the Paycheck Protection Program, law enforcement officials said.",The New York Times,Washington,U.S.,"['Small Business', 'Frauds and Swindling', 'Federal Aid (US)', 'Stimulus (Economic)', 'Coronavirus Aid, Relief, and Economic Security Act (2020)', 'Coronavirus (2019-nCoV)', 'United States Politics and Government', 'Banking and Financial Institutions']"
Biden Campaign Lashes Trump Over Concealing the Danger of the Virus,2020-09-10,article,News,"A day after revelations that President Trump had knowingly downplayed the virus, Joe Biden’s surrogates attacked that response, while the Trump campaign tried to deflect blame back on the former vice president.",The New York Times,Politics,U.S.,"['Presidential Election of 2020', 'United States Politics and Government', 'Coronavirus (2019-nCoV)', 'Rumors and Misinformation']"
Netanyahu Apology to Bedouins Is Taken as an Affront,2020-09-10,article,News,"Critics and outraged officials accused the Israeli prime minister, on trial for corruption, of exploiting a tragic episode to discredit his own law enforcement agencies.",The New York Times,Foreign,World,"['Bedouins', 'Bribery and Kickbacks', 'Police Brutality, Misconduct and Shootings', 'Deaths (Fatalities)', 'Apologies', 'Nomadic People']"
Brexit Talks Hit Crisis as Boris Johnson Rejects Ultimatum,2020-09-10,article,News,Europe has demanded the quick withdrawal of draft Brexit legislation that breaks international law. Britain has refused.,The New York Times,Foreign,World,"['International Trade and World Market', 'Great Britain Withdrawal from EU (Brexit)']"
"U.S. Imposes Sanctions on Ukrainian With Ties to Russia, Citing Election Interference",2020-09-10,article,News,"Andriy Derkach has released information intended to hurt former Vice President Joseph R. Biden Jr., which President Trump has promoted.",The New York Times,Washington,U.S.,"['Russian Interference in 2016 US Elections and Ties to Trump Associates', 'Embargoes and Sanctions', 'Trump-Ukraine Whistle-blower Complaint and Impeachment Inquiry', 'Elections']"
"Century 21, Fabled New York Bargain Destination, Is Closing",2020-09-10,article,News,"The retailer, famous for offering designer goods at discount prices, said it had failed to receive $175 million from its insurers and would close its 13 locations.",The New York Times,Business,Business Day,"['Shopping and Retail', 'Bankruptcies', 'Fashion and Apparel']"
