headline,date,doc_type,type_of_material,snippet,source,news_desk,section_name,keywords
The Conventions Are Starting. Cue the Virtual Excitement.,2020-08-17,article,News,Here’s what you need to know about the unconventional conventions.,The New York Times,Video,U.S.,"['Republican National Convention', 'Democratic National Convention', 'Coronavirus (2019-nCoV)', 'Quarantines']"
"With ‘Nobody Going to Work,’ Private Bus Companies Are Worried About the Future",2020-08-17,article,News,One company has suspended all operations for the first time in 150 years. Others have drastically reduced service and are pleading for financial help from the federal government.,The New York Times,Metro,New York,"['Buses', 'Transit Systems', 'Shutdowns (Institutional)', 'Layoffs and Job Reductions', 'Commuting', 'Coronavirus (2019-nCoV)', 'Transportation', 'Coronavirus Aid, Relief, and Economic Security Act (2020)']"
Save the Gaiters!,2020-08-17,article,News,A small study prompted fears that neck gaiters could spread more virus droplets than they stop. But new research shows that those face coverings can protect just as well as other cloth masks.,The New York Times,Well,Well,"['Masks', 'Protective Clothing and Gear', 'Coronavirus Risks and Safety Concerns', 'Neck', 'Textiles', 'Face', 'Coronavirus (2019-nCoV)']"
A College’s ‘Free Speech Areas’ Face Supreme Court Review,2020-08-17,article,News,The justices will consider whether a student’s First Amendment lawsuit may proceed after a college in Georgia abandoned its restrictions.,The New York Times,Washington,U.S.,"['Appeals Courts (US)', 'Suits and Litigation (Civil)', 'First Amendment (US Constitution)', 'Freedom of Speech and Expression', 'Religion and Belief', 'Colleges and Universities']"
What if ‘Herd Immunity’ Is Closer Than Scientists Thought?,2020-08-17,article,News,"In what may be the world’s most important math puzzle, researchers are trying to figure out how many people in a community must be immune before the coronavirus fades.",The New York Times,Science,Health,"['Disease Rates', 'Antibodies', 'Coronavirus (2019-nCoV)', 'Immune System', 'Vaccination and Immunization', 'Income Inequality', 'Jews and Judaism', 'Elderly', 'your-feed-science']"
The ‘Rage Moms’ Democrats Are Counting On,2020-08-17,article,News,"As millions of American families face an uncertain start to the school year, the anger of women who find themselves expected to be teacher, caregiver, employee and parent is fueling a political uprising.",The New York Times,Politics,U.S.,"['Presidential Election of 2020', 'Women and Girls', 'Work-Life Balance', 'Child Care']"
New York Has Tamed the Virus. Can It Hold Off a Second Wave?,2020-08-17,article,News,"The sustained low rate of infection has surprised local health officials. But a resurgence may be inevitable, despite the state’s and city’s best efforts.",The New York Times,Metro,New York,"['Coronavirus (2019-nCoV)', 'Quarantines', 'Contact Tracing (Public Health)', 'States (US)', 'Shutdowns (Institutional)', 'Disease Rates']"
"Sorry, the World’s Biggest Bike Maker Can’t Help You Buy a Bike Right Now",2020-08-17,article,News,"The pandemic has created a bicycle boom — and a shortage. Giant, the Taiwanese juggernaut, is trying to meet demand while navigating the politics of trade.",The New York Times,Business,Business Day,"['Bicycles and Bicycling', 'Coronavirus (2019-nCoV)', 'International Trade and World Market', 'Factories and Manufacturing', 'Shortages']"
A Crackdown in Belarus Backfires. Here’s What Videos Show.,2020-08-17,article,News,Protests took a decisive turn last week after videos of security officers brutally repressing demonstrators were widely shared.,The New York Times,Foreign,World,"['Demonstrations, Protests and Riots', 'Police Brutality, Misconduct and Shootings', 'Human Rights and Human Rights Violations']"
Quiet Reflections on the Enchanting Italian Village of Panicale,2020-08-17,article,News,"Pensive after the loss of a friend, a photographer finds solace — and instruction — on a trip to the central Italian region of Umbria.",The New York Times,Travel,Travel,"['Travel and Vacations', 'Historic Buildings and Sites']"
U.N.C. at Chapel Hill Shifts to Remote Learning After a Covid-19 Outbreak,2020-08-17,article,News,"The virus is roaring again in France. Louis DeJoy, the U.S. postmaster general, agreed to testify before the House Oversight Committee on Aug. 24.",The New York Times,Foreign,World,['Coronavirus (2019-nCoV)']
A Big Ol’ Virtual Experiment,2020-08-17,article,News,Here’s what we’re watching as the Democrats begin their week of nightly Zoom addresses.,The New York Times,Politics,U.S.,"['Democratic National Convention', 'Video Recordings, Downloads and Streaming']"
TikTok Makes a Deal (Not That One),2020-08-17,article,News,"As the Chinese-owned app negotiates its potential sale, it is signing a different sort of deal.",The New York Times,Business,Business Day,"['Social Media', 'Mergers, Acquisitions and Divestitures']"
Here’s how to watch the Democratic convention.,2020-08-17,article,News,,The New York Times,Politics,U.S.,[]
"Milwaukee loses a mega-event: ‘No Brewers, no Bucks, no convention.’",2020-08-17,article,News,,The New York Times,Politics,U.S.,[]
The president’s top donors from 2016 are not giving as much to his re-election.,2020-08-17,article,News,,The New York Times,Politics,U.S.,[]
"Will the Democrats’ virtual convention be a flop, or must-see TV?",2020-08-17,article,News,,The New York Times,Politics,U.S.,[]
"Despite his defeat, Bernie Sanders will deliver a sort of victory speech tonight.",2020-08-17,article,News,,The New York Times,Politics,U.S.,[]
$2.7 Million Homes in California,2020-08-17,article,News,"A 1935 storybook house in Palo Alto, a midcentury-modern home in Los Angeles and an 1895 Mission Revival-style retreat in Santa Barbara.",The New York Times,RealEstate,Real Estate,['Real Estate and Housing (Residential)']
Critics pile on an S.E.C. proposal to limit investor disclosure,2020-08-17,article,News,,The New York Times,Business,Business Day,[]
The Power of Low-Stakes Productivity,2020-08-17,article,News,The smaller the better.,The New York Times,Smarter Living,Smarter Living,"['Coronavirus (2019-nCoV)', 'Productivity', 'Quarantine (Life and Culture)']"
Trump Administration Finalizes Plan to Open Arctic Refuge to Drilling,2020-08-17,article,News,"The decision sets up a fierce legal battle over the fate of a vast, remote area that is home to polar bears, caribou and the promise of oil wealth.",The New York Times,Climate,Climate,"['Environment', 'Oil (Petroleum) and Gasoline', 'United States Politics and Government', 'Federal Lands', 'Drilling and Boring']"
The M.V.P.s of This Year’s Conventions? The Digital and I.T. Teams,2020-08-17,article,News,Making sure livestreams don’t lag. Sending out remote video kits. Showing speakers how to avoid microphone mishaps. Digital planners for the conventions have suddenly become all-important.,The New York Times,Politics,U.S.,"['Democratic National Convention', 'Republican National Convention', 'Computers and the Internet', 'Video Recordings, Downloads and Streaming']"
"Trump, in Minneapolis, claims Biden and Harris would bring ‘left-wing war on cops’ to the White House.",2020-08-17,article,News,,The New York Times,Politics,U.S.,[]
"Ending a Mystery, Spain Says Ex-King Is in U.A.E.",2020-08-17,article,News,"The former monarch, Juan Carlos, said this month that he would be leaving his country amid a series of investigations related to his wealth.",The New York Times,Foreign,World,[]
Coronavirus Doctors Battle Another Scourge: Misinformation,2020-08-17,article,News,Physicians say they regularly treat people more inclined to believe what they read on Facebook than what a medical professional tells them.,The New York Times,Business,Technology,"['Coronavirus (2019-nCoV)', 'Rumors and Misinformation', 'Doctors', 'Social Media', 'Hydroxychloroquine (Drug)', 'Emergency Medical Treatment']"
Puerto Rico’s governor lost her primary bid for a full term.,2020-08-17,article,News,,The New York Times,Politics,U.S.,[]
Trump’s Attacks on TikTok and WeChat Could Further Fracture the Internet,2020-08-17,article,News,The president’s restrictions on Chinese tech may be part of an eye-for-an-eye logic called reciprocity. The price could be a global patchwork of online fiefs.,The New York Times,Business,Technology,"['Social Media', 'United States International Relations', 'Protectionism (Trade)', 'Computers and the Internet']"
"This year’s conventions, brought to you by the I.T. department.",2020-08-17,article,News,,The New York Times,Politics,U.S.,[]
Contact Lenses May Slow Nearsightedness in Children,2020-08-17,article,News,Children who wore high-power bifocal contacts had less worsening of myopia.,The New York Times,Well,Well,"['Eyes and Eyesight', 'Contact Lenses', 'Eyeglasses']"
"John Kasich, a ‘Deeply Worried’ Republican, Steps Up for Biden",2020-08-17,article,News,"John R. Kasich, a lifelong Republican and former rival of President Trump’s spoke at the Democratic convention — and says he will vote for Joseph R. Biden Jr.",The New York Times,Politics,U.S.,"['Democratic National Convention', 'Presidential Election of 2020', 'United States Politics and Government']"
"Kerry Washington, Julia Louis-Dreyfus, Eva Longoria and Tracee Ellis Ross will M.C. the convention.",2020-08-17,article,News,,The New York Times,Politics,U.S.,[]
"No Longer Cowed, Belarus Has Message for Once-Mighty Dictator: ‘Go Away!’",2020-08-17,article,News,"As even his base starts to desert him after protests over a rigged election were met with brutality, Aleksandr G. Lukashenko’s 26-year grip on power may be slipping.",The New York Times,Foreign,World,"['Elections', 'Demonstrations, Protests and Riots', 'Strikes']"
How Are Student Newspapers Covering Back to School?,2020-08-17,article,News,We want to hear how student journalists are approaching this unusual school year.,The New York Times,NYTNow,U.S.,"['Education (K-12)', 'News and News Media', 'Coronavirus (2019-nCoV)', 'Coronavirus Reopenings']"
"N.Y. Gyms and Fitness Studios Can Reopen as Soon as Aug. 24, Cuomo Says",2020-08-17,article,News,"Health clubs will be limited to a third of their total capacity and must meet state requirements before reopening, the governor said.",The New York Times,Metro,New York,"['Coronavirus (2019-nCoV)', 'Health Clubs', 'Coronavirus Reopenings']"
Here is the Democrats’ opening night lineup.,2020-08-17,article,News,,The New York Times,Politics,U.S.,[]
Wisconsin Democrats ponder the convention that might have been.,2020-08-17,article,News,,The New York Times,Politics,U.S.,[]
"In New Jersey, Tanzania, Peru, TV Lessons Replace Online Learning",2020-08-17,article,News,Poor regions across the globe where internet access is scarce are turning to television to reach students under lockdown. That strategy could also help in wealthy countries.,The New York Times,Foreign,World,"['Coronavirus (2019-nCoV)', 'Education (K-12)', 'E-Learning', 'Television', 'Computers and the Internet', 'Teachers and School Employees', 'Third World and Developing Countries']"
"2 Are Charged in Killing of Jam Master Jay, Hip-Hop Pioneer",2020-08-17,article,News,"The two men had long been suspects in the 2002 killing of the D.J., a member of the group Run-DMC.",The New York Times,Metro,New York,"['Murders, Attempted Murders and Homicides', 'Rap and Hip-Hop']"
Schools Briefing: The State of Play for K-12,2020-08-17,article,News,"This year is anything but typical, and individual districts have been largely left to chart their own paths.",The New York Times,NYTNow,U.S.,"['Coronavirus (2019-nCoV)', 'Coronavirus Reopenings', 'Education (K-12)']"
Toxic Trade-Offs at Facebook,2020-08-17,article,News,Facebook groups led to the rise of QAnon. We can only imagine what could happen with encryption.,The New York Times,NewsDesk,Technology,"['Social Media', 'Privacy', 'Web Browsers', 'Fringe Groups and Movements']"
Trump Administration Widens Huawei Dragnet,2020-08-17,article,News,The Commerce Department placed new restrictions on the Chinese tech giant’s ability to work with the global chip industry.,The New York Times,Business,Technology,"['Blacklisting', 'Computer Chips', 'Telephones and Telecommunications', 'United States International Relations', 'United States Politics and Government']"
Kamala Harris Cartoon in Murdoch Paper Is Denounced as Racist,2020-08-17,article,News,"Kevin Rudd, a former prime minister, lodged a complaint against The Australian for publishing material he called “racist and sexist.”",The New York Times,Business,Business Day,"['Presidential Election of 2020', 'News and News Media', 'Race and Ethnicity', 'Cartoons and Cartoonists', 'Discrimination']"
Trump says he plans to deliver his acceptance speech at the White House.,2020-08-17,article,News,,The New York Times,Politics,U.S.,[]
All the Republicans Who Won’t Support Trump,2020-08-17,article,News,Numerous top G.O.P. officials have said publicly or privately that they will not be backing the president’s re-election. Some have even endorsed Joe Biden. Here’s a look at where they all stand.,The New York Times,Politics,U.S.,"['Presidential Election of 2020', 'United States Politics and Government']"
Mail-in voters sue Trump and DeJoy to block cuts at the Postal Service ahead of the election.,2020-08-17,article,News,,The New York Times,Politics,U.S.,[]
Gretchen Whitmer on the Biden Veepstakes and How He Can Win Michigan,2020-08-17,article,News,"Ms. Whitmer, the governor of Michigan and a contender on Joe Biden’s short list for V.P., spoke with The Times ahead of her speech on Monday night at the Democratic National Convention.",The New York Times,Politics,U.S.,['Presidential Election of 2020']
Israeli Jets Arrive for 1st Joint Military Exercises on German Soil,2020-08-17,article,News,"Germany is aiming to modernize its armed forces, even as it struggles with signs of far-right extremism in its ranks. Israel will benefit from NATO techniques and new terrain.",The New York Times,Foreign,World,['Defense and Military Forces']
Toronto Police to Pay $12.5 Million to Protesters Arrested During 2010 G-20 Summit,2020-08-17,article,News,"Brutal police tactics during the global meeting shocked many Canadians, led to 1,100 arrests and were found unlawful.",The New York Times,Foreign,World,"['Demonstrations, Protests and Riots', 'Police Brutality, Misconduct and Shootings']"
The convention’s big-tent approach strains to accommodate both John Kasich and Alexandria Ocasio-Cortez.,2020-08-17,article,News,,The New York Times,Politics,U.S.,[]
Michelle Obama will anchor Monday’s convention program.,2020-08-17,article,News,,The New York Times,Politics,U.S.,[]
How Mail-In Voting Works,2020-08-17,article,News,"Voting by mail has been a part of American elections for over a century, and experts say the president’s allegations of widespread fraud are unfounded.",The New York Times,Express,U.S.,"['Absentee Voting', 'Voter Fraud (Election Fraud)', 'Voter Registration and Requirements', 'United States Politics and Government', 'Presidential Election of 2020']"
"Defying Trump, 5 Automakers Lock In a Deal on Greenhouse Gas Pollution",2020-08-17,article,News,"The five — Ford, Honda, BMW, Volkswagen and Volvo — sealed a binding agreement with California to follow the state’s stricter tailpipe emissions rules.",The New York Times,Climate,Climate,"['Greenhouse Gas Emissions', 'Automobiles', 'United States Economy', 'Fuel Efficiency', 'United States Politics and Government', 'Global Warming']"
"Beaten Back, the Coronavirus Regains Strength in France",2020-08-17,article,News,"Faced with an increase in infections, especially among young adults, French health officials are expanding mask rules and warning against complacence.",The New York Times,Foreign,World,"['Coronavirus (2019-nCoV)', 'Masks', 'Politics and Government']"
Outbreaks Drive U.N.C. Chapel Hill Online After a Week of Classes,2020-08-17,article,News,The university chose to abandon in-person instruction for undergraduates after at least 177 students tested positive for the coronavirus.,The New York Times,National,U.S.,"['Coronavirus (2019-nCoV)', 'Colleges and Universities', 'Quarantines', 'E-Learning', 'Coronavirus Reopenings']"
Cardi B interviews Biden: ‘I just want Trump out.’,2020-08-17,article,News,,The New York Times,Politics,U.S.,[]
Postal Crisis Has States Looking for Alternatives to Mail-In Ballots,2020-08-17,article,News,"A crisis of confidence in the Postal Service is pushing Democratic Party and state officials to look for a Plan B: ballot drop-boxes, curbside voting, and even expanded in-person polling sites.",The New York Times,Politics,U.S.,"['Absentee Voting', 'Postal Service and Post Offices', 'United States Politics and Government', 'Presidential Election of 2020', 'Coronavirus (2019-nCoV)', 'Suits and Litigation (Civil)', 'Voter Fraud (Election Fraud)']"
California Expresses Frustration as Blackouts Enter 4th Day,2020-08-17,article,News,The agency that manages the state’s electric grid says rolling blackouts are needed to balance supply and demand. But the governor said regulators were not prepared.,The New York Times,Business,Business Day,"['Power Failures and Blackouts', 'Regulation and Deregulation of Industry', 'Electric Light and Power', 'Politics and Government', 'Prices (Fares, Fees and Rates)']"
The Convention Kicks Off,2020-08-17,article,News,Who will be watching and what’s on tap?,The New York Times,Politics,U.S.,['Presidential Election of 2020']
Boris Johnson Retreats in a U.K. Exam Debacle,2020-08-17,article,News,"With students unable to sit for college exams during the pandemic, the government tried guessing how they might do. It did not go well.",The New York Times,Foreign,World,"['Tests and Examinations', 'Grading of Students', 'ADMISSIONS STANDARDS']"
They Claimed Covid-19 Cost Them Their Jobs. There Was an Easier Explanation.,2020-08-17,article,News,"Twenty-one inmates in the San Mateo County, Calif., jail filed for pandemic unemployment assistance, resulting in payments of at least $250,000, according to the district attorney.",The New York Times,Express,U.S.,"['Coronavirus (2019-nCoV)', 'Unemployment Insurance', 'Prisons and Prisoners', 'Frauds and Swindling']"
Ex-C.I.A. Officer Is Accused of Spying for China,2020-08-17,article,News,The arrest of a 67-year-old Hawaii resident is the latest case involving former intelligence officers charged with providing classified documents to Beijing.,The New York Times,Washington,U.S.,"['Classified Information and State Secrets', 'Espionage and Intelligence Services', 'Informers', 'United States Politics and Government']"
She Was Selling Honey to Survive. Then Mel Gibson Threatened to Sue.,2020-08-17,article,News,"A single mother in Chile began selling organic honey from home during quarantine, using the actor’s name as a play on words. His lawyer was not amused.",The New York Times,Foreign,World,"['Trademarks and Trade Names', 'Celebrities', 'Honey']"
Death Valley Just Recorded the Hottest Temperature on Earth,2020-08-17,article,News,"Scientists still have to validate the reading of 130 degrees Fahrenheit on Sunday, the equivalent of 54 degrees Celsius.",The New York Times,Express,Climate,"['Weather', 'Deserts', 'Temperature', 'Earth', 'Global Warming', 'National Parks, Monuments and Seashores', 'Parks and Other Recreation Areas']"
Trump Questions Biden’s Mental Abilities and Calls Harris Biden’s ‘Boss’,2020-08-17,article,News,The president made three campaign rally-like appearances at airports in Minnesota and Wisconsin in an attempt to counterprogram the first night of the Democratic National Convention.,The New York Times,Washington,U.S.,"['Presidential Election of 2020', 'Democratic National Convention', 'United States Politics and Government']"
"Doug Emhoff, Kamala Harris’s husband, takes a leave of absence from his law firm.",2020-08-17,article,News,,The New York Times,Politics,U.S.,[]
DeJoy Earned Millions From Company With Financial Ties to Postal Service,2020-08-18,article,News,"The postmaster general, under fire for his business ties and his cost-cutting measures, will testify before the House next week.",The New York Times,Washington,U.S.,"['Postal Service and Post Offices', 'United States Politics and Government', 'Presidential Election of 2020', 'Absentee Voting', 'Conflicts of Interest', 'Ethics and Official Misconduct', 'Coronavirus (2019-nCoV)']"
Barack Obama tweets his convention soundtrack.,2020-08-18,article,News,,The New York Times,Politics,U.S.,[]
A Call to Rally Around Joe Biden ‘Like Our Lives Depend on It’,2020-08-18,article,News,Everyone at the first night of the Democrats’ virtual gathering could at least agree that Mr. Biden should be the next president. They can worry about the rest later.,The New York Times,Politics,U.S.,"['Presidential Election of 2020', 'United States Politics and Government', 'Democratic National Convention']"
Judge Blocks Trump Officials’ Attempt to End Transgender Health Protections,2020-08-18,article,News,The decision arrived a day before a Trump administration rule narrowing the legal definition of sex discrimination was set to take effect.,The New York Times,Washington,U.S.,"['Discrimination', 'Civil Rights and Liberties', 'Transgender and Transsexuals', 'Health Insurance and Managed Care', 'Decisions and Verdicts', 'Workplace Hazards and Violations', 'United States Politics and Government']"
"After CalPERS Investment Chief’s Abrupt Departure, Trustees Talk Next Steps",2020-08-18,article,News,"The California pension fund’s board is searching for a successor to Ben Meng, while another state body investigates conflict-of-interest allegations.",The New York Times,Business,Business Day,"['Pensions and Retirement Plans', 'Conflicts of Interest', 'Appointments and Executive Changes']"
Sturgis Motorcycle Rally Rolls to a Close as Virus Tracking Remains Complex,2020-08-18,article,News,"The annual rally in Sturgis, S.D., drew hundreds of thousands of people. It will be challenging to track any coronavirus outbreak as bikers return to their home states.",The New York Times,National,U.S.,"['Coronavirus (2019-nCoV)', 'Contact Tracing (Public Health)', 'Motorcycles, Motor Bikes and Motorscooters', 'Disease Rates', 'Festivals']"
Ellen DeGeneres Tells Her Staff That 3 Top Producers Are Out,2020-08-18,article,News,"After former employees described a toxic workplace, the facade is cracking at her namesake talk show.",The New York Times,Business,Business Day,"['Television', 'Workplace Hazards and Violations']"
How to Start a New Job During a Pandemic,2020-08-18,article,News,"Connect, connect, connect.",The New York Times,Smarter Living,Smarter Living,"['Labor and Jobs', 'Coronavirus (2019-nCoV)', 'Content Type: Service']"
"Democrats Begin Virtual Convention, Hailing Biden and Denouncing Trump",2020-08-18,article,News,"Driven online because of the coronavirus, the program spanned the ideological gamut, from socialists to Republicans. “Donald Trump is the wrong president for our country,” Michelle Obama said.",The New York Times,Politics,U.S.,"['Presidential Election of 2020', 'United States Politics and Government', 'Democratic National Convention', 'Coronavirus (2019-nCoV)', 'Black Lives Matter Movement']"
Canada Finance Minister Quits Post Amid Charity Scandal,2020-08-18,article,News,Bill Morneau insisted his stepping down was not related to a conflict-of-interest controversy that has embroiled him and Prime Minister Justin Trudeau of Canada.,The New York Times,Foreign,World,"['Politics and Government', 'Conflicts of Interest', 'Ethics and Official Misconduct', 'Appointments and Executive Changes', 'Legislatures and Parliaments']"
"Kristin Urquiza, Whose Father Died of Covid, Denounces Trump at D.N.C.",2020-08-18,article,News,"Ms. Urquiza, whose impassioned obituary drew national attention, said her father’s “only pre-existing condition was trusting Donald Trump — and for that he paid with his life.”",The New York Times,Politics,U.S.,"['Democratic National Convention', 'Coronavirus (2019-nCoV)', 'Deaths (Fatalities)', 'Presidential Election of 2020', 'United States Politics and Government']"
Coronavirus Strikes Mink in Utah,2020-08-18,article,News,"Five animals on two farms test positive, but many more are believed to be affected.",The New York Times,Express,U.S.,"['Minks (Animals)', 'Agriculture and Farming', 'Coronavirus (2019-nCoV)', 'ANIMALS']"
Bernie Sanders Goes on Attack Against Trump and Urges Support for Biden,2020-08-18,article,News,"In a prime-time speech at the Democratic National Convention, the runner-up for the party’s nomination assailed President Trump, warning, “The future of our democracy is at stake.”",The New York Times,Politics,U.S.,"['Democratic National Convention', 'Presidential Election of 2020']"
Full Transcript of Michelle Obama’s D.N.C. Speech,2020-08-18,article,News,"Michelle Obama, the former first lady, was the keynote speaker on the first night of the 2020 Democratic National Convention.",The New York Times,Politics,U.S.,"['Presidential Election of 2020', 'George Floyd Protests (2020)', 'Democratic National Convention', 'Speeches and Statements']"
A most unusual convention is now underway.,2020-08-18,article,News,,The New York Times,Politics,U.S.,[]
"Michelle Obama Calls Trump ‘Wrong President for Our Country,’ Urging Voters to Act",2020-08-18,article,News,"Speaking in deeply personal terms, the former first lady says the country has been living with the failures of a president who is not up to the task.",The New York Times,Politics,U.S.,['Presidential Election of 2020']
