headline,date,doc_type,type_of_material,snippet,source,news_desk,section_name,keywords
"Architect Finds a Sense of Belonging for His Family’s Homeland, and for Himself",2021-07-09,article,News,Omar Degan was born in Italy to Somali parents who fled before the African nation’s civil war. He’s now helping rebuild the country by looking to the past to build for the future.,The New York Times,Foreign,World,"['ARCHITECTURE', 'Content Type: Personal Profile']"
It’s Hollywood Barbie’s Moment (and She’s Bringing Her Friends),2021-07-09,article,News,"Margot Robbie as Barbie, Daniel Kaluuya reimagining Barney, plots based on Uno and View-Master: Mattel, in the throes of a financial comeback, has 13 films in the works.",The New York Times,SundayBusiness,Business Day,"['Toys', 'Movies', 'Barbie (Doll)']"
Did a Cuttlefish Write This?,2021-07-09,article,News,Octopuses and squid are full of cephalopod character. But more scientists are making the case that cuttlefish hold the key to unlocking evolutionary secrets about intelligence.,The New York Times,Science,Science,"['Animal Cognition', 'Animal Behavior', 'Fish and Other Marine Life', 'Octopus', 'Research', 'your-feed-science', 'your-feed-animals']"
What we know and don’t know about the assassination.,2021-07-09,article,News,,The New York Times,Foreign,World,[]
"Pfizer says it will pursue booster shots and a new vaccine, citing the Delta variant.",2021-07-09,article,News,,The New York Times,Foreign,World,[]
Political instability was fueling a rise in gang violence even before the president was killed.,2021-07-09,article,News,"Armed groups have become increasingly powerful in Haiti, playing on the political instability and the growing poverty to seize control of large swaths of big cities.",The New York Times,Foreign,World,[]
I.M.F. Board Backs $650 Billion Aid Plan to Help Poor Countries,2021-07-09,article,News,The expansion of emergency reserves to help fund vaccines and pay down debt is politically contentious in the United States.,The New York Times,Washington,U.S.,"['Third World and Developing Countries', 'Foreign Aid', 'Coronavirus (2019-nCoV)', 'Vaccination and Immunization', 'Economic Conditions and Trends']"
Investors Seek to Cut ‘Pharma Bro’ Out of His Company,2021-07-09,article,News,"A group of shareholders has set up a showdown with Martin Shkreli, who they say continues to exert influence over a pharmaceutical company from prison.",The New York Times,Business,Business Day,"['Appointments and Executive Changes', 'Shareholder Rights and Activism']"
Catch up: A top student loan servicer won’t renew its contract.,2021-07-09,article,News,,The New York Times,Business,Business Day,[]
"Britain’s economy grew for the fourth straight month, but more slowly than expected.",2021-07-09,article,News,"The 0.8 percent growth in May was nearly half the rate expected by economists, who warned that continued expansion would become harder.",The New York Times,Business,Business Day,"['Coronavirus (2019-nCoV)', 'Economic Conditions and Trends']"
Tencent Games uses facial recognition to restrict children’s screen time.,2021-07-09,article,News,,The New York Times,Business,Business Day,[]
Hosting an Airbnb Right Now Is Harder Than You Think,2021-07-09,article,News,The pandemic has increased demand and also ramped up the expectations of vacationers.,The New York Times,RealEstate,Real Estate,"['Real Estate and Housing (Residential)', 'Travel and Vacations', 'Hotels and Travel Lodgings', 'Renting and Leasing (Real Estate)', 'Quarantine (Life and Culture)']"
Dozens Die as Another Factory Fire Strikes Bangladesh,2021-07-09,article,News,"The blaze, at a seven-story building where fruit drinks, packing materials and plastic packaging were made, burned for nearly 24 hours.",The New York Times,Foreign,World,"['Accidents and Safety', 'Rana Plaza Building Collapse, Bangladesh (2013)', 'Fires and Firefighters', 'Deaths (Fatalities)', 'Workplace Hazards and Violations', 'Factories and Manufacturing']"
London Police Officer Pleads Guilty to Murdering Sarah Everard,2021-07-09,article,News,"Wayne Couzens had already admitted to kidnapping and raping the 33-year-old Ms. Everard, whose killing in March set off an outcry against gender violence in Britain.",The New York Times,Foreign,World,"['Murders, Attempted Murders and Homicides', 'Sex Crimes']"
The Space Race for Insurers,2021-07-09,article,News,"As Richard Branson and Jeff Bezos set off into space, without liability insurance, providers are planning ahead for future demand.",The New York Times,Business,Business Day,"['Insurance', 'Private Spaceflight', 'Antitrust Laws and Competition Issues']"
China moves to spur bank lending to help troubled small businesses.,2021-07-09,article,News,"As the country’s economic growth slows, the central bank said lenders could reduce how much money they kept on reserve, an effort to increase lending.",The New York Times,Business,Business Day,"['Banking and Financial Institutions', 'Regulation and Deregulation of Industry', 'Inflation (Economics)']"
How to Manage Your Money if Inflation Flares,2021-07-09,article,News,"While long-term investors may want to stick with standard diversified stock and bond funds, hedges are available for those who worry that inflation will get out of control.",The New York Times,SundayBusiness,Business Day,"['Inflation (Economics)', 'Interest Rates', 'Stocks and Bonds', 'Commodities', 'Asset Allocation (Personal Finances)', 'Exchange Traded Funds']"
The Gift of Financial Education for the New Grad in Your Life,2021-07-09,article,News,"A little professional advice goes a long way, making it a worthy investment for a new graduate entering the working world.",The New York Times,Business,Your Money,"['Content Type: Service', 'Credit and Debt', 'Financial Planners', 'Personal Finances', 'Education (K-12)', 'Colleges and Universities', 'Student Loans']"
President Biden Wants to Pour Money Into Infrastructure. Should You?,2021-07-09,article,News,"The world’s highways, ports, electric wires and roads need repair and upgrades. That could be an opportunity for funds investing in infrastructure.",The New York Times,SundayBusiness,Business Day,"['American Jobs Plan (2021)', 'Infrastructure (Public Works)', 'Mutual Funds', 'Stocks and Bonds', 'Content Type: Service', 'Asset Allocation (Personal Finances)', 'Coronavirus Aid, Relief, and Economic Security Act (2020)']"
"With Inflation Rising, Consider the Humdrum U.S. Savings Bond",2021-07-09,article,News,The annualized rate on Series I (for inflation) bonds is now 3.54 percent. That’s a lot more than savings accounts are paying.,The New York Times,Business,Your Money,"['Content Type: Service', 'Government Bonds', 'Inflation (Economics)', 'Savings', 'Personal Finances', 'Federal Taxes (US)']"
"For Some People, Working From Home Sped Up Their Decision to Retire",2021-07-09,article,News,"Those near the top of the income ladder said it had given them a different perspective on work. As one financial manager put it, “They’re getting a flavor of what retirement will look like.”",The New York Times,Business,Your Money,"['Quarantine (Life and Culture)', 'Telecommuting', 'Coronavirus (2019-nCoV)', 'Careers and Professions', 'Content Type: Service', 'Personal Finances']"
"In Investing, Don’t Sweat the Small Stuff",2021-07-09,article,News,"It is easy to obsess about the smallest parts of your portfolio, like the tiny amounts of interest spun off by money-market funds today. Don’t waste your time.",The New York Times,SundayBusiness,Business Day,"['Content Type: Service', 'Mutual Funds', 'Banking and Financial Institutions', 'Stocks and Bonds', 'Money Market Mutual Funds']"
The Markets Have Prospered. Why Are So Many People Worried?,2021-07-09,article,News,"Stocks keep hitting new highs and getting more expensive, as if nothing could go wrong, and that’s when it often does.",The New York Times,SundayBusiness,Business Day,"['Stocks and Bonds', 'Inflation (Economics)', 'Mutual Funds', ""Standard & Poor's 500-Stock Index"", 'Coronavirus (2019-nCoV)', 'United States Economy', 'Content Type: Service']"
"Spaceflights for Richard Branson and Jeff Bezos spur a race for insurers, too.",2021-07-09,article,News,"Brokers say neither mogul appears to have bought coverage in case of an accident, but some insurers are interested in developing policies for space tourism.",The New York Times,Business,Business Day,"['Insurance', 'Private Spaceflight']"
Should an Oasis Be Replaced by Affordable Housing? SoHo Is Divided.,2021-07-09,article,News,"When the creator of a quirky sculpture garden died, the debate over the plot’s fate intensified.",The New York Times,Metropolitan,New York,"['Affordable Housing', 'Sculpture', 'Suits and Litigation (Civil)', 'Antiques', 'Land Use Policies']"
"Plane Crash in Sweden Kills 9, Including 8 Sky Divers",2021-07-09,article,News,The incident was the second to affect a parachutists’ flight after a similar disaster in the country in 2019.,The New York Times,Foreign,World,"['Aviation Accidents, Safety and Disasters', 'Parachutes and Parachute Jumping']"
Biden Will End Detention for Most Pregnant and Postpartum Undocumented Immigrants,2021-07-09,article,News,"Like the president’s other immigration policies, the protections could disappear under a future administration because they are not being created through legislation.",The New York Times,Washington,U.S.,"['Immigration Detention', 'Pregnancy and Childbirth', 'Breastfeeding', 'Immigration and Emigration', 'Illegal Immigration', 'Executive Orders and Memorandums', 'United States Politics and Government']"
"The Sea of Marmara, a ‘Sapphire’ of Turkey, Is Choking From Pollution",2021-07-09,article,News,A slimy secretion has coated harbors and beaches and smothered marine life. Warming waters are part of the problem.,The New York Times,Foreign,World,"['Water Pollution', 'Fishing, Commercial', 'Fish and Other Marine Life', 'Beaches']"
"After Ex-President’s Arrest, South Africa’s Governing A.N.C. Is More Fractured",2021-07-09,article,News,"There was a sense of relief when Jacob Zuma’s arrest went off without bloodshed, but his deeply divided party must now find a way forward.",The New York Times,Foreign,World,"['Politics and Government', 'Corruption (Institutional)', 'Defense and Military Forces', 'Economic Conditions and Trends', 'Prisons and Prisoners', 'Suits and Litigation (Civil)', 'Bribery and Kickbacks', 'Income Inequality']"
"The C.D.C. Issues New School Guidance, With Emphasis on Full Reopening",2021-07-09,article,News,The guidance acknowledges that many students have suffered from months of virtual learning.,The New York Times,Washington,Health,"['Coronavirus Reopenings', 'Education (K-12)', 'Disease Rates', 'Coronavirus (2019-nCoV)', 'Pediatric Inflammatory Multisystem Syndrome (PIMS)', 'Children and Childhood', 'Quarantines', 'Vaccination and Immunization', 'Parenting']"
Here’s what we know about the new schools guidance the C.D.C. issued on Friday.,2021-07-09,article,News,The recommendations are a departure from the C.D.C.’s past guidelines for schools and arrive less than a month before the first day of school for some districts.,The New York Times,Washington,Education,"['Coronavirus Reopenings', 'Education (K-12)', 'Coronavirus (2019-nCoV)', 'Vaccination and Immunization']"
Like in ‘Postapocalyptic Movies’: Heat Wave Killed Marine Wildlife en Masse,2021-07-09,article,News,"An early estimate points to a huge die-off along the Pacific Coast, and scientists say rivers farther inland are warming to levels that could be lethal for some kinds of salmon.",The New York Times,Climate,Climate,"['Wildlife Die-Offs', 'Global Warming', 'Oceans and Seas', 'Fish and Other Marine Life', 'Rivers', 'Lakes', 'Marine Biology', 'Greenhouse Gas Emissions', 'Mussels', 'Salmon', 'Starfish', 'Drought', 'Heat and Heat Waves']"
Mexico will allow a union vote at a General Motors plant after a U.S. complaint.,2021-07-09,article,News,,The New York Times,Washington,U.S.,[]
The Education Dept. will wipe out $55 million in student loans for borrowers at 3 institutions.,2021-07-09,article,News,"The department approved 1,800 claims from students who attended Westwood College, Marinello Schools of Beauty and the Court Reporting Institute.",The New York Times,Business,Business Day,"['Student Loans', 'Education (K-12)', 'For-Profit Schools']"
How the I.M.F. plans to build a $650 billion fund to fight the pandemic.,2021-07-09,article,News,A reserve fund would help developing nations buy vaccines and bolster their health care systems. But where will the money come from?,The New York Times,Business,Business Day,"['Coronavirus (2019-nCoV)', 'Vaccination and Immunization', 'Third World and Developing Countries']"
"Nostalgia, Inc.",2021-07-09,article,News,“We kind of sell people’s childhoods back to them.”,The New York Times,SundayBusiness,Business Day,['Toys']
Garland Settles In but Trump Era Still Shadows the Justice Dept.,2021-07-09,article,News,The attorney general’s decisions in a handful of cases have shaped an early challenge for him: fortifying the department’s independence.,The New York Times,Washington,U.S.,"['United States Politics and Government', 'Attorneys General', 'Content Type: Personal Profile', 'News and News Media']"
Biden’s order includes 72 initiatives that take aim at very specific practices the White House wants changed.,2021-07-09,article,News,The White House asked more than a dozen federal agencies for input and action on initiatives designed to increase competition and limit the power of large corporations.,The New York Times,Politics,U.S.,"['Executive Orders and Memorandums', 'Labor and Jobs']"
Does Big Tech Make Good Neighbors?,2021-07-09,article,News,"We want our online orders, and we want them now. But we don’t seem ready for Big Tech moving in, too.",The New York Times,Business,Technology,"['Computers and the Internet', 'Delivery Services', 'E-Commerce']"
Chief Guantánamo Prosecutor Retiring Before Sept. 11 Trial Begins,2021-07-09,article,News,"Army Brig. Gen. Mark Martins had held the job longest, and was for many years the public face of military commissions.",The New York Times,Washington,U.S.,"['September 11 (2001)', 'Afghanistan War (2001- )', 'United States Defense and Military Forces', 'Appointments and Executive Changes', 'United States Politics and Government', 'Military Tribunals', 'Terrorism', 'Detainees', 'War Crimes, Genocide and Crimes Against Humanity']"
A Group of Scientists Presses a Case Against the Lab Leak Theory of Covid,2021-07-09,article,News,"In a review of recent studies and comparisons to other outbreaks, a group of virologists contends that there is more evidence to support a natural spillover from animals to humans.",The New York Times,Science,Science,"['Coronavirus (2019-nCoV)', 'Laboratories and Scientific Equipment', 'Bats', 'Animals', 'Research', 'your-feed-science']"
"In another blow to Didi, China halts downloads of 25 more of its apps.",2021-07-09,article,News,"The latest announcement was nearly identical to one the same agency issued on Sunday, ordering Didi’s main, consumer-facing app off mobile stores.",The New York Times,Business,Technology,"['Mobile Applications', 'Politics and Government', 'Computers and the Internet', 'Car-Pooling and Ride-Sharing', 'Car Services and Livery Cabs']"
Biden urges Putin to ‘take action to disrupt’ Russia-based hackers behind ransomware attacks.,2021-07-09,article,News,President Biden warned that the United States reserves the right to respond against hackers who launch attacks from inside Russia.,The New York Times,Politics,U.S.,"['Cyberattacks and Hackers', 'United States Politics and Government']"
Taliban Enter Kandahar City and Seize Border Posts,2021-07-09,article,News,"The insurgent assaulted a vital city in Afghanistan’s south on Friday, less than 24 hours after President Biden reaffirmed his decision to withdraw from the country.",The New York Times,Foreign,World,"['Afghanistan War (2001- )', 'United States Defense and Military Forces']"
F.D.A. Seeks Investigation of Its Own Alzheimer’s Drug Approval,2021-07-09,article,News,"The agency’s acting head said a review should look into whether any interactions between agency staff and the drug developer, Biogen, broke F.D.A. rules.",The New York Times,Business,Health,"[""Alzheimer's Disease"", 'Aduhelm (Drug)', 'Drugs (Pharmaceuticals)', 'Inspectors General', 'Regulation and Deregulation of Industry']"
‘We have a lot of work to do.’ Schumer warns Democrats to expect a busy July.,2021-07-09,article,News,The top Senate Democrat confirmed that he intends to hold votes both on an infrastructure plan and a budget blueprint that could pave the way for a more expansive economic and social policy bill.,The New York Times,Politics,U.S.,"['United States Politics and Government', 'Infrastructure (Public Works)', 'Law and Legislation']"
Italy Holds Its Breath as Its National Soccer Team Prepares to Face England,2021-07-09,article,News,"A small soccer museum in Florence tells the story of the Italian national team, and the fans’ hopes for the Euro 2021 final match.",The New York Times,Foreign,World,"['Soccer', 'Halls of Fame']"
This Moth’s Name Is a Slur. Scientists Won’t Use It Anymore.,2021-07-09,article,News,"The Entomological Society of America will no longer refer to common species of insects as “gypsy moths” and “gypsy ants,” because their names are derogatory to the Romani people.",The New York Times,Science,Science,"['Romani People', 'Butterflies and Moths', 'Ants', 'Race and Ethnicity', 'Discrimination', 'your-feed-science', 'your-feed-animals']"
Heat-Related Deaths Increase as Temperatures Rise in the West,2021-07-09,article,News,"Record-breaking heat was expected throughout the West Coast this weekend, days after a deadly heat wave struck Oregon and Washington State.",The New York Times,National,U.S.,"['Global Warming', 'Deaths (Fatalities)', 'Workplace Hazards and Violations', 'Heat and Heat Waves']"
Oath Keepers Leader Sits for F.B.I. Questioning Against Legal Advice,2021-07-09,article,News,"In a bold move, Stewart Rhodes, the founder and leader of the right-wing militia group, sat for an interview with federal agents after they seized his phone in May.",The New York Times,Washington,U.S.,"['Storming of the US Capitol (Jan, 2021)', 'United States Politics and Government']"
Educators’ unions support the new federal recommendations for reopening schools.,2021-07-09,article,News,"The unions also acknowledged that challenges lay ahead, especially given that vaccines have not been authorized for students under 12.",The New York Times,National,Education,"['Coronavirus Reopenings', 'Education (K-12)', 'Vaccination and Immunization']"
Coronavirus Briefing: What Happened Today,2021-07-09,article,News,The C.D.C. recommends that schools reopen fully in the fall.,The New York Times,NYTNow,U.S.,[]
Officials Kill Grizzly Bear Suspected in Fatal Attack of Woman in Montana,2021-07-09,article,News,"Wildlife officials believe the bear was the same grizzly that killed a California woman on Tuesday, given the proximity to the attack and evidence found at both scenes.",The New York Times,Express,U.S.,"['Bears', 'Deaths (Fatalities)']"
Hidden Costs and Flawed Training Plague the V.A.’s Huge Software Upgrade,2021-07-09,article,News,"A $16 billion effort to modernize health records at the Department of Veterans Affairs ran into major problems in its first installation, two watchdog reports say.",The New York Times,National,U.S.,"['Veterans', 'United States Politics and Government', 'Electronic Health Records', 'Software', 'Computers and the Internet', 'Government Contracts and Procurement', 'Inspectors General']"
How Instagram ‘Collabs’ Help Far-flung Bakers Create Together,2021-07-09,article,News,"Pandemic baking provided a comforting, if solitary, pursuit for people stuck at home. Then the notion of cake “collabs” took off.",The New York Times,SpecialSections,At Home,"['Quarantine (Life and Culture)', 'Bakeries and Baked Products', 'Cakes', 'Social Media', 'Creativity']"
N.Y.C. Halts Plan to Move Homeless People From Hotels After Legal Filing,2021-07-09,article,News,The Legal Aid Society filed a motion accusing the city of violating the rights of people with disabilities.,The New York Times,Metro,New York,"['Homeless Persons', 'Hotels and Travel Lodgings', 'Disabilities', 'Suits and Litigation (Civil)', 'Coronavirus (2019-nCoV)']"
Colombia confirms that 13 of its former soldiers are among the assassination suspects.,2021-07-09,article,News,One told his wife that he had “a very good job opportunity.” Colombian military veterans have been known to act as hired guns after their service.,The New York Times,Foreign,World,"['Mercenaries and Private Military Contractors', 'Assassinations and Attempted Assassinations']"
Blast in Tehran Near State Broadcasting Headquarters Rattles Iran,2021-07-09,article,News,"An explosion in a park near the state broadcasting company rocked Iran’s capital early Saturday morning. No casualties were reported, and it was uncertain if the blast was an attack or accident.",The New York Times,Foreign,World,[]
Indigenous Women Assume and Cede Prominent Positions in Canada,2021-07-09,article,News,"This week, Canada’s largest Indigenous organization selected a woman as its chief for the first time and an Inuk was named governor general. But Canada’s first Indigenous justice minister said she’s leaving politics.",The New York Times,Foreign,World,['Indigenous People']
President Biden fired the head of the Social Security Administration.,2021-07-09,article,News,"Andrew Saul, a Trump holdover, drew Democrats’ ire and has vowed to fight his dismissal.",The New York Times,Washington,U.S.,"['Appointments and Executive Changes', 'Social Security (US)', 'Presidential Transition (US)']"
Why the New York Subway Has a Water Problem,2021-07-09,article,News,"Thursday’s storms flooded parts of the subway system, underscoring its vulnerability to heavy rains, which could become more common with climate change.",The New York Times,Metro,New York,"['Subways', 'Floods', 'Transit Systems', 'Weather', 'Infrastructure (Public Works)', 'Rain', 'Global Warming']"
Another top editor of the publisher of Deadspin and The Onion steps down.,2021-07-09,article,News,The previous editorial director of G/O Media resigned in 2019 after a memo caused a staff revolt.,The New York Times,Business,Business Day,"['News and News Media', 'Appointments and Executive Changes']"
What to Do This Weekend,2021-07-09,article,News,Don’t overdo your re-entry.,The New York Times,AtHome,At Home,['Content Type: Service']
"Haiti Calls U.S. for Troops, After Wild Day of Gunfights and Suspicion",2021-07-09,article,News,At least 20 people were arrested in the assassination of the Haitian president — 18 Colombians and 2 Americans of Haitian descent — on a day of deepening mystery.,The New York Times,Foreign,World,"['Assassinations and Attempted Assassinations', 'Politics and Government', 'Defense and Military Forces', 'Mercenaries and Private Military Contractors', 'United States International Relations']"
Charlottesville Removes Robert E. Lee Statue at Center of White Nationalist Rally,2021-07-09,article,News,The statue was a focus of the deadly “Unite the Right” rally in 2017. The city removed it on Saturday along with a monument to Stonewall Jackson and a statue of Lewis & Clark and the Shoshone Indian Sacagawea.,The New York Times,Express,U.S.,"['Monuments and Memorials (Structures)', 'Right-Wing Extremism and Alt-Right', 'Charlottesville, Va, Violence (August, 2017)', 'Native Americans']"
"Texas Democrats Weigh Options for Blocking Voting Bill, Including Flight",2021-07-09,article,News,Some Democrats want to flee the state to deny Republicans a quorum and prevent a vote on stringent new restrictions on voting. Others want to fight on procedural grounds.,The New York Times,Politics,U.S.,"['United States Politics and Government', 'State Legislatures', 'Politics and Government', 'Law and Legislation', 'Voter Registration and Requirements']"
What Parents Need to Know About the C.D.C.’s Covid School Guidelines,2021-07-09,article,News,"The agency’s advice on distancing, masks and vaccination brings the coming school year a bit more into focus.",The New York Times,Science,Health,"['Coronavirus Reopenings', 'Coronavirus Risks and Safety Concerns', 'Education (K-12)', 'Shutdowns (Institutional)', 'Disease Rates', 'Heating, Ventilation and Cooling (HVAC)', 'Masks', 'Vaccination and Immunization', 'Coronavirus (2019-nCoV)', 'Content Type: Service', 'Children and Childhood']"
Biden Fires Trump Appointee as Head of Social Security Administration,2021-07-09,article,News,"The dismissal, the latest effort by President Biden to oust a Trump-appointed director of an independent executive agency, could set off a legal showdown over who rightfully holds the position.",The New York Times,Washington,Business Day,"['Appointments and Executive Changes', 'Social Security (US)', 'United States Politics and Government']"
Biden Administration Punts on Due Process Rights for Guantánamo Detainees,2021-07-09,article,News,"An anticipated brief, filed under seal, is said to take no position on whether the Constitution’s due process clause protects detainees.",The New York Times,Washington,U.S.,"['Detainees', 'United States Politics and Government', 'Military Tribunals', 'Fourteenth Amendment (US Constitution)', 'United States Defense and Military Forces']"
