headline,date,doc_type,type_of_material,snippet,source,news_desk,section_name,keywords
U.N. Security Council Recommends António Guterres for a Second Term,2021-06-08,article,News,The Council’s recommendation basically assures the Portuguese statesman’s tenure as secretary general and extends the history of male-only stewardship of the United Nations since its 1945 founding.,The New York Times,Foreign,World,['Appointments and Executive Changes']
"In the U.S., vaccines for the youngest are expected this fall.",2021-06-08,article,News,"Pfizer and Moderna are testing their vaccines in children under 12, and are expected to have results in hand by the end of the summer.",The New York Times,Science,Health,"['internal-essential', 'Pediatric Inflammatory Multisystem Syndrome (PIMS)', 'Vaccination and Immunization', 'Coronavirus (2019-nCoV)']"
"Job openings hit a record, a Labor Department survey shows.",2021-06-08,article,News,"Employers had 9.3 million positions available in April, more than two million more than before the pandemic.",The New York Times,Business,Business Day,"['Labor and Jobs', 'Coronavirus (2019-nCoV)', 'Unemployment', 'United States Economy', 'Layoffs and Job Reductions']"
"Wealthiest Executives Paid Little to Nothing in Federal Income Taxes, Report Says",2021-06-08,article,News,An analysis by ProPublica based on I.R.S. documents showed billionaires like Jeff Bezos and Elon Musk benefited from tax code loopholes and a focus on taxing income over wealth.,The New York Times,Washington,U.S.,"['Income Tax', 'Federal Taxes (US)', 'Tax Credits, Deductions and Exemptions', 'High Net Worth Individuals', 'United States Politics and Government']"
Sarah Feinberg Chosen to Lead M.T.A.; Would Be First Woman in Role,2021-06-08,article,News,"Governor Andrew M. Cuomo will nominate Sarah Feinberg, a close ally, to oversee the largest transit system in North America.",The New York Times,Metro,New York,"['Subways', 'Transit Systems', 'Appointments and Executive Changes', 'Women and Girls']"
"MoviePass Deceived Users So They’d Use It Less, F.T.C. Says",2021-06-08,article,News,"Federal regulators detailed tactics the company, which settled accusations against it, used to try to make its most active users go to the movies less.",The New York Times,Express,Business Day,"['Advertising and Marketing', 'Movies', 'Computer Security', 'Consumer Protection', 'Frauds and Swindling', 'Mobile Applications', 'Prices (Fares, Fees and Rates)']"
Man Slaps Macron During Visit to Southern France,2021-06-08,article,News,"Two people were arrested after a man slapped the French president as he was approaching a small crowd, prompting condemnation of the attack across the political spectrum.",The New York Times,Foreign,World,[]
Colonial Pipeline chief says an oversight let hackers into its system.,2021-06-08,article,News,"Cybercriminals gained access via an old virtual private network, allowing them to paralyze a critical U.S. fuel artery.",The New York Times,Business,Business Day,"['Cyberattacks and Hackers', 'Extortion and Blackmail', 'Computers and the Internet', 'United States Politics and Government', 'Pipelines', 'Oil (Petroleum) and Gasoline']"
YouTube Isn’t the Music Villain Anymore,2021-06-08,article,News,YouTube seems to have shown that it’s possible to both upend an industry and help make it stronger.,The New York Times,Business,Technology,"['Music', 'Video Recordings, Downloads and Streaming', 'Audio Recordings, Downloads and Streaming', 'Social Media']"
"Civil rights leaders press Manchin for a path forward on voting rights, but he remains unmoved on a broad bill.",2021-06-08,article,News,The virtual meeting came two days after Mr. Manchin unequivocally stated his opposition to the Democrats’ landmark elections bill.,The New York Times,Washington,U.S.,"['Voting Rights Act (1965)', 'Filibusters and Debate Curbs', 'Voter Registration and Requirements', 'Law and Legislation']"
"For Asian Americans Wary of Attacks, Reopening Is Not an Option",2021-06-08,article,News,"Facing a wave of animosity, many Asian Americans remain afraid of public places even as the coronavirus pandemic recedes.",The New York Times,National,U.S.,"['Asian-Americans', 'Assaults', 'Hate Crimes', 'Discrimination', 'Coronavirus Reopenings']"
This article was published in error.,2021-06-08,article,News,This article was published in error.,The New York Times,Video,Admin,[]
Workplace Harassment in the Age of Remote Work,2021-06-08,article,News,"When office closures put physical distance between colleagues, many hoped that incidents of harassment would drop. That flame quickly went dark.",The New York Times,Gender,U.S.,"['Workplace Hazards and Violations', 'Telecommuting', 'Discrimination', 'Race and Ethnicity', 'Sexual Harassment', 'Women and Girls', 'Quarantine (Life and Culture)', 'Coronavirus (2019-nCoV)']"
NASA Just Visited the Solar System’s Biggest Moon,2021-06-08,article,News,"The Juno spacecraft completed a close flyby of Ganymede, Jupiter’s biggest moon, as it transitions into a new phase of its mission.",The New York Times,Science,Science,"['Juno (Spacecraft)', 'Ganymede (Jupiter Moon)', 'Space and Astronomy', 'Rocket Science and Propulsion', 'Research']"
States warn J.&J. doses could expire soon and the White House urges them to consult the F.D.A.,2021-06-08,article,News,A White House adviser said governors could consult with the Food and Drug Administration on storage procedures as the agency examines how to possibly extend the shelf life of the vaccine.,The New York Times,Washington,U.S.,"['internal-essential', 'Vaccination and Immunization', 'Coronavirus (2019-nCoV)']"
Electric truck start-up Lordstown doesn’t have cash to begin production.,2021-06-08,article,News,"Lordstown Motors, which bought a shuttered General Motors factory in Ohio, warned that it needs to raise more money and might not survive.",The New York Times,Business,Business Day,"['Mergers, Acquisitions and Divestitures', 'Electric and Hybrid Vehicles', 'Automobiles', 'Sports Utility Vehicles and Light Trucks', 'Factories and Manufacturing']"
Ohio’s attorney general wants Google to be declared a public utility.,2021-06-08,article,News,"If Google were declared a so-called common carrier like a utility company, it would prevent the company from prioritizing its own products, services and websites in search results.",The New York Times,Business,Technology,[]
"Kamala Harris, With Blunt Language on Border, Forges Immigration Image",2021-06-08,article,News,"The vice president concluded her first trip abroad, a high-stakes trip to Mexico and Guatemala during which she took on the politically volatile issue.",The New York Times,Foreign,World,"['Illegal Immigration', 'Immigration and Emigration', 'United States International Relations', 'Asylum, Right of', 'Foreign Aid']"
El Chapo’s Wife Set to Plead Guilty to Helping Run Drug Empire,2021-06-08,article,News,Emma Coronel Aispuro is scheduled to appear in court in Washington on Thursday to admit her role in her husband’s criminal activities.,The New York Times,Washington,U.S.,"['Prison Escapes', 'Drug Cartels', 'United States Politics and Government']"
Biden’s first two judicial nominees are confirmed with modest Republican support.,2021-06-08,article,News,Senate Democrats intend to sprint to fill scores of federal vacancies and rebalance the ideological makeup of the courts after the Trump era.,The New York Times,Washington,U.S.,"['Federal Courts (US)', 'Appointments and Executive Changes', 'United States Politics and Government']"
Coronavirus Briefing: What Happened Today,2021-06-08,article,News,"Amid reopenings, Asian-Americans worry about attacks.",The New York Times,NYTNow,U.S.,"['Coronavirus (2019-nCoV)', 'Vaccination and Immunization', 'Books and Literature']"
"Senate Confirms First Biden Judges, Beginning Push to Rebalance Courts",2021-06-08,article,News,The votes were the start of an effort by Democrats to confirm liberals and people of color to the federal courts after Donald J. Trump moved aggressively to install conservative white men.,The New York Times,Washington,U.S.,"['Appointments and Executive Changes', 'United States Politics and Government', 'Federal Courts (US)', 'Courts and the Judiciary']"
Senate Overwhelmingly Passes Bill to Bolster Competitiveness With China,2021-06-08,article,News,The wide margin of support reflected a sense of urgency among lawmakers in both parties about shoring up the technological and industrial capacity of the United States to counter Beijing.,The New York Times,Washington,U.S.,"['Law and Legislation', 'International Trade and World Market', 'United States Politics and Government', 'United States International Relations']"
Stacey Abrams and her group will try to rally young voters of color behind the For the People Act.,2021-06-08,article,News,"The effort, called Hot Call Summer, will center on a huge texting campaign, with organizers aiming to reach 10 million voters in key states where Republicans have pushed voting restrictions.",The New York Times,Washington,U.S.,"['Politics and Government', 'Voter Registration and Requirements', 'United States Politics and Government', 'Elections', 'Law and Legislation']"
The F.B.I. arrests a Pennsylvania man who impersonated Trump’s relatives.,2021-06-08,article,News,"The Times revealed last year that a 21-year-old delivery driver had posed as Trump family members on Twitter. On Tuesday, he was charged with fraud.",The New York Times,Business,Business Day,[]
Republican Filibuster Blocks Pay Equity Bill in the Senate,2021-06-08,article,News,"In a vote choreographed to fail, Democrats tried to bring to the Senate floor a bill to make it easier to sue over compensation discrimination, hoping to make the case to end the filibuster.",The New York Times,Washington,U.S.,"['United States Politics and Government', 'Law and Legislation', 'Filibusters and Debate Curbs', 'Wages and Salaries']"
"In a Different Capitol Siege, Republicans in Oregon Call for Accountability",2021-06-08,article,News,G.O.P. lawmakers in the state are calling for the resignation of a legislator who appears to have encouraged protesters to breach the State Capitol in December.,The New York Times,National,U.S.,"['Politics and Government', 'State Legislatures', 'Ethics and Official Misconduct', 'Demonstrations, Protests and Riots', 'Presidential Election of 2020', 'Storming of the US Capitol (Jan, 2021)']"
Terry McAuliffe Wins Democratic Nomination for Governor in Virginia,2021-06-08,article,News,"Mr. McAuliffe, who previously served as governor, overcame four rivals, benefiting from the support of the party establishment. His victory set up a general election race against a wealthy Republican, Glenn Youngkin.",The New York Times,Politics,U.S.,"['Politics and Government', 'Elections, Governors', 'Primaries and Caucuses']"
"Biden Ends Infrastructure Talks With Republicans, Falling Short of a Deal",2021-06-09,article,News,"After weeks of failed efforts to bridge deep divides, the president pulled the plug, turning to a bipartisan group to try to salvage a chance at compromise.",The New York Times,Washington,U.S.,"['American Jobs Plan (2021)', 'Infrastructure (Public Works)', 'United States Economy', 'United States Politics and Government', 'Federal Budget (US)']"
Eric Adams Draws Fire for Skipping Mayoral Debate,2021-06-09,article,News,"Mr. Adams, a leading candidate for New York City mayor, was accused by his rivals of trying to dodge questions about his residency.",The New York Times,Metro,New York,"['Elections, Mayors', 'Debates (Political)', 'Primaries and Caucuses']"
New Yorker Employees Stage Protest Outside Anna Wintour’s Townhouse,2021-06-09,article,News,"After more than two years of negotiations with the magazine’s parent company, Condé Nast, more than 100 demonstrators marched on the editorial director’s quiet block.",The New York Times,Business,Business Day,"['Strikes', 'Wages and Salaries', 'Organized Labor', 'Magazines', 'Demonstrations, Protests and Riots']"
It’s Hard to Sue Gun Makers. New York Is Set to Change That.,2021-06-09,article,News,"State lawmakers passed a bill designed to get around a federal law giving gun manufacturers broad immunity from lawsuits, in hopes of cracking down on the smuggling of illegal weapons into New York.",The New York Times,Metro,New York,"['Suits and Litigation (Civil)', 'Law and Legislation', 'Firearms', 'Politics and Government']"
Wisconsin Pharmacist Who Tampered With Vaccine Gets 3-Year Sentence,2021-06-09,article,News,"The pharmacist, Steven R. Brandenburg, believed in conspiracy theories and thought vaccines were dangerous, the authorities said.",The New York Times,Express,U.S.,"['Vaccination and Immunization', 'Coronavirus (2019-nCoV)', 'Drugs (Pharmaceuticals)', 'Conspiracy Theories']"
Ciattarelli Defeats Trump Loyalists in G.O.P. Primary to Take on Murphy,2021-06-09,article,News,"Jack Ciattarelli won New Jersey’s Republican primary and will face Philip D. Murphy, the Democratic incumbent, in November.",The New York Times,Metro,New York,"['Politics and Government', 'Elections, Governors', 'Primaries and Caucuses']"
Times Requests Disclosure of Court Filings Seeking Reporters’ Email Data and Gag Order,2021-06-09,article,News,Lawyers for the newspaper are asking how the Justice Department justified keeping the order secret since its leak inquiry was publicly known.,The New York Times,Washington,U.S.,"['Classified Information and State Secrets', 'United States Politics and Government', 'Newspapers', 'News and News Media', 'Freedom of the Press', 'News Sources, Confidential Status of']"
The Pandemic Messed With Your Sleep. Here’s How to Feel Rested Again.,2021-06-09,article,News,You can overcome ‘coronasomnia.’ Experts say it just takes practice building new and better habits.,The New York Times,Well,Well,"['Sleep', 'Anxiety and Stress', 'Insomnia', 'Coronavirus (2019-nCoV)', 'Beds and Bedding', 'Psychology and Psychologists', 'Habits and Routines (Behavior)', 'Research', 'Caffeine', 'Mental Health and Disorders', 'Sedatives']"
"An Innocent Man Went to Prison for Murder. Now, It’s the Real Killer’s Turn.",2021-06-09,article,News,"Brian Leigh Dripps Sr. was sentenced to life in prison on Tuesday in the 1996 killing of Angie Dodge in Idaho, a crime for which Christopher Tapp was exonerated.",The New York Times,Express,U.S.,"['False Arrests, Convictions and Imprisonments', 'Forensic Science', 'Murders, Attempted Murders and Homicides', 'Sex Crimes', 'Genealogy', 'DNA (Deoxyribonucleic Acid)']"
Queens Man Charged With Murder in Shooting Death of 10-Year-Old,2021-06-09,article,News,"Justin Wallace, who would have turned 11 on Tuesday, was shot as he walked out of his aunt’s home on Saturday.",The New York Times,Metro,New York,"['Murders, Attempted Murders and Homicides']"
Cicadas Took On Biden’s Press Plane. They Won.,2021-06-09,article,News,"The omnipresent insects filled the engines of a flight set to accompany the president on his trip to Europe, forcing a delay and a new plane and pilot to be called in.",The New York Times,Washington,U.S.,"['Cicadas (Insects)', 'AIRLINES AND AIRPLANES', 'News and News Media', 'United States Politics and Government']"
Attack in Afghanistan Kills 10 From Charity That Clears Land Mines,2021-06-09,article,News,"The government blamed the Taliban for the attack on the British-American charity, the HALO Trust. The militant group denied any responsibility.",The New York Times,Foreign,World,"['Mines, Explosive', 'Deaths (Fatalities)', 'Terrorism', 'Afghanistan War (2001- )']"
How Long Should It Take to Give Away Millions?,2021-06-09,article,News,The promise of philanthropy was that the wealthy could enjoy tax breaks for their charitable contributions. The pandemic laid bare how accumulation can trump getting money to those in need. A Senate bill aims to change that.,The New York Times,Business,Business Day,"['Philanthropy', 'High Net Worth Individuals', 'Corporations', 'Tax Credits, Deductions and Exemptions', 'Law and Legislation', 'United States Politics and Government']"
"Biden Aims to Bolster U.S. Alliances in Europe, but Challenges Loom",2021-06-09,article,News,The good will President Biden brings on his first trip abroad papers over lingering doubts about U.S. reliability and the cost that Europe will be expected to pay.,The New York Times,Washington,U.S.,"['United States Politics and Government', 'United States International Relations', 'Cold War Era', 'Presidential Election of 2020', 'Cyberwarfare and Defense', 'Global Warming', 'Greenhouse Gas Emissions', 'United Nations Framework Convention on Climate Change']"
Dianne Morales Faced a Campaign Uprising. Will It Matter to Voters?,2021-06-09,article,News,Ms. Morales is running for New York City mayor on a platform of tackling inequality and shifting resources away from policing. But her campaign has been marred by defections and dysfunction.,The New York Times,Metro,New York,"['Elections, Mayors', 'Politics and Government', 'Primaries and Caucuses', 'Content Type: Personal Profile', 'Black Lives Matter Movement', 'George Floyd Protests (2020)']"
The Best Type of Exercise? A Blood Test Holds Clues,2021-06-09,article,News,Researchers are studying the proteins in blood to learn why some of us respond to certain forms of exercise better than others.,The New York Times,Well,Well,"['Exercise', 'Weight', 'Longevity', 'Research', 'Blood']"
Introverts vs. Extroverts: A Family Feud,2021-06-09,article,News,Please don’t make me stay at that party.,The New York Times,Parenting,Parenting,"['Content Type: Service', 'Quarantine (Life and Culture)', 'Shyness', 'Anxiety and Stress', 'Parenting', 'Families and Family Life']"
On Medicare and Need Dental Work? Beware a Big Bill.,2021-06-09,article,News,"The traditional version doesn’t cover dental, vision or hearing care. Advocates hope for change under a Biden proposal.",The New York Times,SundayBusiness,Business Day,"['Medicare', 'Medicaid', 'Health Insurance and Managed Care', 'Prices (Fares, Fees and Rates)', 'Teeth and Dentistry', 'Ears and Hearing', 'Eyes and Eyesight', 'United States Politics and Government']"
Let’s All Go to the Movies,2021-06-09,article,News,"After a long year of streaming from home, it’s time to head to New York’s cinemas, drive-ins and parks for a proper movie night.",The New York Times,Metro,New York,"['Movies', 'Summer (Season)', 'Museums', 'Drive-in Theaters', 'Festivals', 'Documentary Films and Programs']"
Uber and Lyft Ramp Up Legislative Efforts to Shield Business Model,2021-06-09,article,News,Gig economy companies are backing state laws in New York and elsewhere that would cement drivers’ status as contractors in exchange for a union.,The New York Times,Business,Business Day,"['Freelancing, Self-Employment and Independent Contracting', 'Regulation and Deregulation of Industry', 'Wages and Salaries', 'Organized Labor', 'Collective Bargaining', 'Law and Legislation', 'Car Services and Livery Cabs']"
What to Know About the Newest iPhone and Android Software,2021-06-09,article,News,Apple and Google have unveiled phone features designed for an era of hybrid remote and in-person work.,The New York Times,Business,Technology,"['Content Type: Service', 'Mobile Applications', 'Computers and the Internet', 'iOS (Operating System)', 'Software', 'Smartphones', 'Videophones and Videoconferencing', 'Android (Operating System)', 'Text Messaging', 'Privacy', 'Quarantine (Life and Culture)', 'Cameras', 'iPhone']"
New York’s Vaccine Passport Could Cost Taxpayers $17 Million,2021-06-09,article,News,"The state’s contract with IBM details a Phase 2 of the Excelsior Pass, which could include uses that some advocates say raise privacy concerns.",The New York Times,Metro,New York,"['Coronavirus (2019-nCoV)', 'Vaccination Proof and Immunization Records', 'State Legislatures', 'Civil Rights and Liberties', 'Mobile Applications', 'Disease Rates', 'Privacy']"
What I Gained From Self-Defense Class in the Wake of Anti-Asian Attacks,2021-06-09,article,News,"Some Asian women are learning new skills to protect themselves, bolstering their sense of agency, confidence and competence on the street.",The New York Times,Well,Well,"['Self-Defense', 'Discrimination', 'Content Type: Service', 'Women and Girls', 'Fear (Emotion)', 'Anxiety and Stress', 'Chinese-Americans', 'Minorities', 'Hate Crimes', 'Asian-Americans']"
"After a Year of Protests, Portland Is Ready to Move On. But Where?",2021-06-09,article,News,"The demonstrations that swept the country after George Floyd’s death lived on for much of the year in Portland, a city now engaged in finger-pointing and a debate over what comes next.",The New York Times,National,U.S.,"['Politics and Government', 'George Floyd Protests (2020)', 'Black Lives Matter Movement', 'Police Reform', 'Police', 'Fringe Groups and Movements', 'Vandalism']"
Where to Watch the Ring of Fire Solar Eclipse at Sunrise,2021-06-09,article,News,An annular eclipse will start in Canada and end in a remote part of Russia. People in areas of the United States will see a partial eclipse.,The New York Times,Science,Science,"['Eclipses', 'Sun', 'Moon', 'Content Type: Service', 'Space and Astronomy']"
"Warwick, N.Y.: A Hudson Valley Town That’s Under the Radar",2021-06-09,article,News,"The Orange County community may lack the ‘cool factor’ of other parts of the Hudson Valley, but residents are fine with that.",The New York Times,RealEstate,Real Estate,"['Real Estate and Housing (Residential)', 'Content Type: Service']"
House Hunting in Canada: A Lakeside Super-Cottage in the Muskoka District,2021-06-09,article,News,"Pent-up demand has exploded in Ontario’s ‘cottage country,’ with pandemic buyers seeking turnkey or newly built homes.",The New York Times,RealEstate,Real Estate,['Real Estate and Housing (Residential)']
A Tiny Spanish Island Where Pirates Once Roamed,2021-06-09,article,News,"There is no place to shop on Nueva Tabarca, scant cellphone reception and unreliable internet. To some, that is part of its appeal.",The New York Times,SpecialSections,Real Estate,"['Real Estate and Housing (Residential)', 'Travel and Vacations']"
"If You’ve Never Tried Growing Radicchio, Now Is the Time",2021-06-09,article,News,This cultivated form of chicory is having a moment. Here’s what you need to know before you plant it.,The New York Times,RealEstate,Real Estate,"['Gardens and Gardening', 'Chicory (Vegetable)', 'Content Type: Service']"
"More than a year into the pandemic, many Americans are still getting terrible sleep.",2021-06-09,article,News,,The New York Times,Foreign,World,['internal-essential']
"A slow reopening continues in France, and other news from around the world.",2021-06-09,article,News,,The New York Times,Foreign,World,['internal-essential']
Florida Manatees Died at an Alarming Rate in the First Months of 2021,2021-06-09,article,News,"Years of worsening water quality from toxic runoff have increased algae blooms and killed the sea grass that manatees graze on, experts say.",The New York Times,Express,U.S.,"['Fish and Other Marine Life', 'Manatees', 'Conservation of Resources', 'Wildlife Die-Offs', 'ALGAE', 'Water Pollution']"
Where Did Billionaires’ Billions Go?,2021-06-09,article,News,A bombshell report raises questions about the tax bills of the wealthy.,The New York Times,Business,Business Day,"['Income Tax', 'Federal Taxes (US)', 'Labor and Jobs']"
A new bill would force some philanthropies to spend money faster.,2021-06-09,article,News,,The New York Times,Business,Business Day,[]
Shell says a court ruling on greenhouse gases will speed up its plans to cut emissions.,2021-06-09,article,News,"The oil giant is likely to appeal the judgment, the company’s chief executive said, but it also felt “a determination to rise to the challenge” posed by the court.",The New York Times,Business,Business Day,"['Greenhouse Gas Emissions', 'Global Warming', 'Oil (Petroleum) and Gasoline', 'Fuel Efficiency']"
"$200,000 Homes in Maryland, Minnesota and New York",2021-06-09,article,News,"A 1940 colonial-style house in Salisbury, a two-bedroom condo in Minneapolis and a 1900 home in the Catskills.",The New York Times,RealEstate,Real Estate,['Real Estate and Housing (Residential)']
"Wuhan animal markets sold dozens of species that can carry pathogens that infect humans, a study found.",2021-06-09,article,News,The study sheds new light on the possible role of the wildlife trade in the emergence of the coronavirus.,The New York Times,Foreign,World,"['internal-essential', 'Coronavirus (2019-nCoV)', 'Wildlife Trade and Poaching', 'Viruses', 'Disease Rates']"
Germany Makes Rapid Virus Tests a Key to Everyday Freedoms,2021-06-09,article,News,"As the country begins reopening, it is relying on widespread, free antigen tests to ensure that anyone not yet vaccinated against the coronavirus is also not infectious.",The New York Times,Foreign,World,"['Coronavirus (2019-nCoV)', 'Tests (Medical)', 'Disease Rates', 'Vaccination and Immunization']"
New York Times Names Stella Bugbee as Styles Editor,2021-06-09,article,News,"Ms. Bugbee, who expanded The Cut into a top site for fashion and social issues, is scheduled to start later this month.",The New York Times,Business,Business Day,"['Appointments and Executive Changes', 'News and News Media', 'Fashion and Apparel']"
China Returns to Its Strict Covid Limits to Fight a New Outbreak,2021-06-09,article,News,Foreign businesses worry that tough quarantines and restrictions could persist into next year as Beijing struggles with variants and questions about its vaccines.,The New York Times,Foreign,World,"['Disease Rates', 'Coronavirus (2019-nCoV)', 'Quarantines', 'Travel Warnings', 'Vaccination and Immunization', 'Politics and Government']"
"In Germany, the key to everyday freedoms is a rapid virus test.",2021-06-09,article,News,,The New York Times,Foreign,World,['internal-essential']
