headline,date,doc_type,type_of_material,snippet,source,news_desk,section_name,keywords
"Russia, Once a Space Superpower, Turns to China for Missions",2021-06-15,article,News,"The two countries have pledged to cooperate on expeditions to the moon and to an asteroid, setting the stage for a new space race with the United States and its partners.",The New York Times,Foreign,World,"['Space and Astronomy', 'Politics and Government', 'International Relations', 'Moon', 'Mars (Planet)', 'International Space Station']"
Are You a Current or Former Amazon Employee?,2021-06-15,article,News,We’re interested in learning as much as possible about how Amazon manages its work force.,The New York Times,National,Business Day,"['Labor and Jobs', 'internal-essential']"
"The Police Wanted Free Burgers. When the Workers Refused, They Were Jailed.",2021-06-15,article,News,"Tired of law enforcement corruption, the owners of a fast-food chain in Pakistan sought justice over social media.",The New York Times,Foreign,World,"['Police Brutality, Misconduct and Shootings', 'Fast Food Industry', 'Corruption (Institutional)', 'Police', 'Social Media', 'Restaurants']"
Hungary Adopts Child Sex Abuse Law That Also Targets L.G.B.T. Community,2021-06-15,article,News,Legislation increasing sentences for pedophiles was changed to include restrictions on portrayals of homosexuality and transgender people that young people might see.,The New York Times,Foreign,World,"['Politics and Government', 'Child Abuse and Neglect', 'Homosexuality and Bisexuality', 'Law and Legislation', 'Sex Crimes', 'Television', 'Advertising and Marketing', 'Human Rights and Human Rights Violations', 'Elections']"
"Charitable giving rose in 2020, with civil rights and environmental groups benefiting.",2021-06-15,article,News,"Donations climbed to a record $471.4 billion, bolstered by an increase in the stock market and the rollout of government stimulus spending.",The New York Times,Business,Business Day,"['Philanthropy', 'Civil Rights and Liberties', 'Coronavirus (2019-nCoV)']"
"Harris welcomes the women of the Senate for dinner, building bridges with homemade cheese puffs.",2021-06-15,article,News,The bipartisan dinner marks the first social event Vice President Kamala Harris has held since coming into office five months ago.,The New York Times,Washington,U.S.,"['United States Politics and Government', 'Vice Presidents and Vice Presidency (US)', 'Women and Girls']"
MacKenzie Scott Gives Away Another $2.74 Billion Even as Her Wealth Grows,2021-06-15,article,News,"Ms. Scott made a new round of grants, to 286 organizations. Her net worth, which Forbes estimates at $60 billion, keeps rising, thanks to Amazon stock.",The New York Times,Business,Business Day,"['Philanthropy', 'High Net Worth Individuals', 'Nonprofit Organizations', 'Finances']"
2 Workers Killed in Shooting at Alabama Fire Hydrant Plant,2021-06-15,article,News,"Two others were injured, and the gunman, an employee, was later found dead, apparently of a self-inflicted gunshot wound, the police said.",The New York Times,Express,U.S.,"['Murders, Attempted Murders and Homicides']"
"China, Its Military Might Expanding, Accuses NATO of Hypocrisy",2021-06-15,article,News,"In a sign of rising tensions, Beijing deployed 28 Chinese fighter jets and other aircraft over waters south of Taiwan hours after a U.S. carrier group sailed into the South China Sea.",The New York Times,Foreign,World,"['Defense and Military Forces', 'United States International Relations', 'United States Defense and Military Forces', 'Territorial Disputes']"
A leading voting rights expert is among Biden’s new round of judicial nominees.,2021-06-15,article,News,"Trying to set a fast pace, the White House will submit five more candidates for the federal bench.",The New York Times,Washington,U.S.,"['Federal Courts (US)', 'Appeals Courts (US)', 'Appointments and Executive Changes']"
‘A Momentous Day’: New York and California Lift Most Virus Restrictions,2021-06-15,article,News,Officials made the move after more than 70 percent of adults in both states had received a first dose of the coronavirus vaccine.,The New York Times,Metro,New York,"['Coronavirus Reopenings', 'Coronavirus (2019-nCoV)', 'Vaccination and Immunization', 'Politics and Government']"
Here’s how Californians’ reactions to reopening are colored by politics.,2021-06-15,article,News,"Conservatives say the state waited far too long to reopen, while liberals say vigilance is still needed.",The New York Times,National,U.S.,"['internal-essential', 'Coronavirus (2019-nCoV)', 'Coronavirus Reopenings', 'Politics and Government']"
"Biden Names Lina Khan, a Big-Tech Critic, as F.T.C. Chair",2021-06-15,article,News,"Ms. Khan, who first attracted notice as a critic of Amazon, was confirmed by the Senate as a commissioner on the agency on Tuesday.",The New York Times,Business,Technology,"['Appointments and Executive Changes', 'Antitrust Laws and Competition Issues', 'Regulation and Deregulation of Industry', 'United States Politics and Government', 'Computers and the Internet']"
The F.B.I. warns that some QAnon believers could turn to violence as predictions fail to bear fruit.,2021-06-15,article,News,"The predictions of Q — including mass arrests of Democrats and the return of Donald J. Trump as president — have not come to pass, sowing doubt among believers.",The New York Times,Washington,U.S.,"['QAnon', 'Conspiracy Theories', 'Fringe Groups and Movements', 'Right-Wing Extremism and Alt-Right']"
Southwest Airlines flights are disrupted for the second time in 24 hours.,2021-06-15,article,News,The Federal Aviation Administration said the airline was experiencing “technology issues.” Southwest acknowledged that its operations were hampered but provided few details.,The New York Times,Business,Business Day,"['AIRLINES AND AIRPLANES', 'Delays (Transportation)']"
"Once, Superpower Summits Were About Nukes. Now, It’s Cyberweapons.",2021-06-15,article,News,"But with the ease of denying responsibility and the wide range of possible attackers, the traditional deterrents of the nuclear age no longer work.",The New York Times,Foreign,World,"['United States International Relations', 'Cyberwarfare and Defense', 'US Federal Government Data Breach (2020)', 'Nuclear Weapons', 'Arms Control and Limitation and Disarmament']"
Battle for Black Voters in N.Y.C. Mayor’s Race Centers on Policing,2021-06-15,article,News,"As New York’s Democratic primary nears, Black voters appear torn between Eric Adams and Maya Wiley and their divergent views on balancing public safety and civil rights.",The New York Times,Metro,New York,"['Police Reform', 'Black People', 'Blacks', 'Elections, Mayors', 'Voting and Voters', 'Race and Ethnicity', 'Primaries and Caucuses']"
"Newsom marks California’s reopening with a lottery, a Hollywood robot and no mask.",2021-06-15,article,News,,The New York Times,National,U.S.,['internal-essential']
"Republicans call Biden ‘soft’ on Russia, leaving out Trump’s defense of Putin.",2021-06-15,article,News,Some of President Biden’s most prominent critics neglect to mention their backing of President Donald J. Trump as he spent four years seeking to befriend President Vladimir V. Putin of Russia.,The New York Times,Washington,U.S.,['United States Politics and Government']
"In an about-face, Lordstown Motors says it has enough money and will start building trucks.",2021-06-15,article,News,"Lordstown said last week that it needed to raise more money and might not survive. Now, the company’s new executive chairwoman has said “It’s a new day at Lordstown Motors.”",The New York Times,Business,Business Day,"['Stocks and Bonds', 'Electric and Hybrid Vehicles', 'Production']"
Harvey Weinstein to Be Extradited to Los Angeles to Face Rape Charges,2021-06-15,article,News,"The decision, by Judge Kenneth Case of Erie County Court, ends months of successful delays by Mr. Weinstein’s lawyers.",The New York Times,Metro,New York,['Sex Crimes']
A federal watchdog backs the legality of Biden’s suspension of wall construction along the Mexican border.,2021-06-15,article,News,"The finding dismissed 40 Republican senators’ argument that President Biden’s decision was no different from President Trump’s choice to withhold Ukrainian military aid, for which he was impeached.",The New York Times,Washington,U.S.,['Border Barriers']
The complaint in some cities as California reopened: What took so long?,2021-06-15,article,News,"In some Republican-leaning areas of the state, residents and business owners would have liked to see restrictions lifted sooner.",The New York Times,National,U.S.,"['Coronavirus (2019-nCoV)', 'Coronavirus Reopenings']"
Israel ends its indoor mask mandate after a robust vaccination campaign.,2021-06-15,article,News,"With more than 63 percent of the population vaccinated, Israel lifts one of its last remaining  pandemic restrictions.",The New York Times,Foreign,World,"['internal-essential', 'Coronavirus (2019-nCoV)', 'Vaccination and Immunization', 'Masks']"
Coming Soon: $300 Checks for Parents,2021-06-15,article,News,An expanded Child Tax Credit distributed as monthly checks will start reaching households in July and last through the end of the year.,The New York Times,Gender,U.S.,"['Tax Credits, Deductions and Exemptions', 'Children and Childhood', 'Parenting', 'Single Parents', 'Women and Girls']"
"At a Berkeley supermarket, the mask habit dies hard.",2021-06-15,article,News,"Fully vaccinated people are no longer required to wear masks when they shop indoors in California, but in the Bay Area on Tuesday, many people wore them anyway.",The New York Times,National,U.S.,"['internal-essential', 'Coronavirus (2019-nCoV)', 'Coronavirus Reopenings', 'Masks', 'Supermarkets and Grocery Stores', 'Vaccination and Immunization']"
Girl Scouts Stuck With Over 15 Million Boxes of Unsold Cookies,2021-06-15,article,News,The Girl Scouts faced two major problems during the last year: diminished membership and a pandemic that made in-person cookie selling a risky proposition.,The New York Times,Express,U.S.,"['Cookies', 'Bakeries and Baked Products', 'Women and Girls']"
"A popular Oakland brunch spot hopes to recoup the $25,000-a-month it lost during the pandemic.",2021-06-15,article,News,"Kevyn Johnston, owner of Portal, saw hope in a strong turnout of customers on Tuesday, the first day of the state’s full reopening.",The New York Times,National,U.S.,"['Restaurants', 'Coronavirus Reopenings', 'Coronavirus (2019-nCoV)']"
Pentagon Weighs Proposal to Send Dozens of Troops Back to Somalia,2021-06-15,article,News,The plan for a “train and assist” mission would partly reverse President Donald J. Trump’s withdrawal of nearly all American ground forces from the country.,The New York Times,Washington,U.S.,"['United States Defense and Military Forces', 'Terrorism', 'Drones (Pilotless Planes)']"
"U.S. Nears 600,000 Virus Deaths Despite Progress From Vaccines",2021-06-15,article,News,"Daily deaths have dropped considerably since their January peak, with about 44 percent of the population now fully vaccinated.",The New York Times,National,U.S.,"['Coronavirus (2019-nCoV)', 'Disease Rates', 'Deaths (Fatalities)', 'Vaccination and Immunization']"
Cuomo’s Inner Circle Raised Money for Aide Who Was Convicted of Bribery,2021-06-15,article,News,"Gov. Andrew Cuomo distanced himself from the aide, Joseph Percoco, but the governor’s sister and close allies quietly funded the aide’s legal fight.",The New York Times,Metro,New York,"['Politics and Government', 'Corruption (Institutional)', 'United States Politics and Government', 'Bribery and Kickbacks']"
More Than 30 Pelicans Have Been Mutilated on California’s Beaches,2021-06-15,article,News,"Since March, dozens of brown pelicans appear to have been seriously injured by a person or people in Orange County, conservationists said.",The New York Times,Express,U.S.,"['Pelicans', 'Animal Abuse, Rights and Welfare', 'Beaches']"
Coronavirus Briefing: What Happened Today,2021-06-15,article,News,Reopening day in California.,The New York Times,NYTNow,U.S.,[]
"In Geneva, Putin Wants Respect. Biden Might Just Give Him Some.",2021-06-15,article,News,"By calling the Russian leader “a worthy adversary,” the president raised expectations in Moscow, but he will expect the favor to be returned.",The New York Times,Foreign,World,[]
Biden Names U.S. Ambassador Nominees to Israel and Mexico,2021-06-15,article,News,The official announcements of the long-rumored nominations came as the president traveled to Europe with the goal of demonstrating to global leaders that “America is back at the table.”,The New York Times,Washington,U.S.,"['United States International Relations', 'Diplomatic Service, Embassies and Consulates', 'United States Politics and Government', 'Appointments and Executive Changes']"
Garcia and Wiley Try to Shift Momentum From Adams as Primary Draws Near,2021-06-15,article,News,"A week before the primary and a day before the final debate, Kathryn Garcia and Maya Wiley vied to be seen as the strongest alternative to the race’s front-runner, Eric Adams.",The New York Times,Metro,New York,"['Ranked-Choice Voting', 'Elections, Mayors']"
Trump Executive Could Face Charges as Soon as This Summer,2021-06-15,article,News,"An investigation into Allen Weisselberg, the Trump Organization’s finance chief, appears to be heading into its final stages as prosecutors increase pressure on him.",The New York Times,Metro,New York,"['United States Politics and Government', 'Taxation', 'Tax Evasion', 'Frauds and Swindling']"
"Texas Power Grid, Strained Last Winter, Now Faces an Early Heat Wave",2021-06-15,article,News,Regulators have asked residents to start conserving energy after demand hit a June record just one week into the month.,The New York Times,Climate,Climate,"['Global Warming', 'Greenhouse Gas Emissions', 'Electric Light and Power', 'Weather', 'Power Failures and Blackouts', 'Regulation and Deregulation of Industry']"
Washington Will Open Up for July 4 Fireworks. So Will Biden’s White House.,2021-06-15,article,News,"The White House will host a 1,000-person celebration on the South Lawn, even though President Biden is not on track to meet his goal of vaccinating 70 percent of Americans by July 4.",The New York Times,Washington,U.S.,"['United States Politics and Government', 'White House Building (Washington, DC)', 'Fireworks', 'Independence Day (US) (July 4)', 'Summer (Season)', 'Vaccination and Immunization', 'Coronavirus (2019-nCoV)']"
Ride on: Disneyland in California reopens to out-of-state visitors.,2021-06-15,article,News,,The New York Times,Travel,Travel,"['Coronavirus Reopenings', 'AMUSEMENT AND THEME PARKS', 'Travel and Vacations']"
Democrats Vow to Push Their Own Infrastructure Plan as Talks Drag On,2021-06-15,article,News,"As progressives balked at an emerging bipartisan deal, top Democrats said they hoped to move forward in July with a budget maneuver that would allow them to push through their own plan.",The New York Times,Washington,U.S.,"['United States Politics and Government', 'American Jobs Plan (2021)', 'Federal Budget (US)', 'Infrastructure (Public Works)', 'Federal Taxes (US)', 'Gasoline Tax (US)']"
Southern Baptists Narrowly Head Off Ultraconservative Takeover,2021-06-15,article,News,"Ed Litton, a moderate pastor from Alabama, won a high-stakes presidential election with the potential to reshape the future of the country’s largest Protestant denomination.",The New York Times,National,U.S.,"['Baptist Churches', 'Ministers (Protestant)', 'Appointments and Executive Changes']"
A bill to make Juneteenth a federal holiday clears the Senate.,2021-06-15,article,News,"Many states have recognized Juneteenth for decades, but only some observe it as an official holiday. The first was Texas, where the celebration originated.",The New York Times,Washington,U.S.,"['Juneteenth', 'Holidays and Special Occasions', 'Slavery (Historical)', 'Law and Legislation']"
Biden Selects Sullenberger for Aviation Ambassadorship,2021-06-15,article,News,"Chesley B. Sullenberger III, who gained fame as the pilot who safely landed a plane in the Hudson River, was among President Biden’s long-awaited first slate of ambassadors.",The New York Times,Washington,U.S.,"['Appointments and Executive Changes', 'United States Politics and Government', 'Pilots']"
"F.B.I. Is Pursuing ‘Hundreds’ in Capitol Riot Inquiry, Wray Tells Congress",2021-06-16,article,News,"In two separate hearings, the F.B.I. director and Pentagon officials answered questions about the failure to adequately prepare for and respond to the Jan. 6 attack.",The New York Times,Washington,U.S.,"['Storming of the US Capitol (Jan, 2021)', 'United States Politics and Government', 'United States Defense and Military Forces']"
Federal Judge Says Biden Cannot Pause New Leases for Drilling on Public Lands,2021-06-16,article,News,President Biden suspended new oil and gas drilling leases on federal lands. A judge in Louisiana ruled those leases could not be temporarily halted.,The New York Times,Climate,Climate,"['Global Warming', 'Greenhouse Gas Emissions', 'Oil (Petroleum) and Gasoline', 'Federal Lands', 'Natural Gas', 'Decisions and Verdicts', 'United States Politics and Government', 'States (US)', 'Executive Orders and Memorandums']"
Ex-Shake Shack Manager Sues N.Y.P.D. Unions Over Bogus Poison Claim,2021-06-16,article,News,"As tensions between protesters and the police grew last year, three officers said they’d been attacked with tainted milkshakes. They hadn’t.",The New York Times,Metro,New York,"['Police Brutality, Misconduct and Shootings', 'Suits and Litigation (Civil)', 'Poisoning and Poisons', 'Libel and Slander', 'False Arrests, Convictions and Imprisonments']"
5 Police Officers Are Fired After a Man in Custody Kills Himself,2021-06-16,article,News,"Three of the officers in Savannah, Ga., mocked the death of William Harvey in a group text message exchange, in which an inappropriate GIF was shared, officials said.",The New York Times,Express,U.S.,"['Police Brutality, Misconduct and Shootings', 'George Floyd Protests (2020)', 'Black People', 'Blacks', 'Suicides and Suicide Attempts']"
"The U.S. Averted One Housing Crisis, but Another Is in the Wings",2021-06-16,article,News,A moratorium on evictions did little to address the bigger problem: The country is running out of affordable places for people to live.,The New York Times,Business,Business Day,"['Affordable Housing', 'Evictions', 'Renting and Leasing (Real Estate)', 'Real Estate and Housing (Residential)', 'Landlords', 'American Rescue Plan (2021)', 'Coronavirus (2019-nCoV)']"
Where Did Hideki Tojo’s Body Go After His Execution? A Mystery Is Solved.,2021-06-16,article,News,"The location of the remains of the wartime Japanese prime minister had been a puzzle. Now, documents reveal that U.S. forces secretly scattered his ashes into the Pacific Ocean.",The New York Times,Foreign,World,"['World War II (1939-45)', 'War Crimes, Genocide and Crimes Against Humanity', 'Archives and Records', 'Classified Information and State Secrets', 'United States Defense and Military Forces']"
North Korea Is Facing a ‘Tense’ Food Shortage,2021-06-16,article,News,"Kim Jong-un said addressing food insecurity was “a top priority” in the country, where millions died in a famine during the ’90s.",The New York Times,Foreign,World,"['Shortages', 'Food Insecurity', 'Economic Conditions and Trends', 'Politics and Government', 'Coronavirus (2019-nCoV)', 'Embargoes and Sanctions', 'Deaths (Fatalities)', 'Famine', 'Food Aid', 'Agriculture and Farming', 'Grain']"
What’s at Stake for the New York Mayoral Candidates in the Final Debate,2021-06-16,article,News,The two-hour debate on Wednesday will be one of the last opportunities for the candidates to redefine the New York City mayor’s race.,The New York Times,Metro,New York,"['Elections, Mayors', 'Debates (Political)', 'Ranked-Choice Voting', 'Primaries and Caucuses']"
Zimbabwe Releases Local Reporter Working for The New York Times,2021-06-16,article,News,"The government said that it would not oppose bail for Jeffrey Moyo, a freelance journalist in the capital, Harare, adding that there was evidence to show he had believed he was acting legally.",The New York Times,Foreign,World,"['Suits and Litigation (Civil)', 'News and News Media', 'Freedom of the Press']"
"Biden and Putin say the talks went well, but divisions remain on issues like cyberattacks and human rights.",2021-06-16,article,News,Mr. Biden and Mr. Putin emerged from their first in-person summit offering broad claims of good will.,The New York Times,Foreign,World,[]
Biden raised issues of human rights and digital disruption.,2021-06-16,article,News,The American leader aimed to look strong on security while also not making too many waves.,The New York Times,Foreign,World,['United States International Relations']
Russian and U.S. leaders meet in a high-stakes summit.,2021-06-16,article,News,,The New York Times,Foreign,World,[]
Lifelong Exercise Adds Up to Big Health Care Savings,2021-06-16,article,News,"People who start to exercise before or during middle age typically save from $824 to $1,874 annually on health care costs after retirement.",The New York Times,Well,Well,"['Exercise', 'Age, Chronological', 'Health Insurance and Managed Care', 'Medicare']"
7 Ways to Reset Your Relationship,2021-06-16,article,News,Experts say couples can emerge from the pandemic stronger than ever by learning from the past and looking toward the future.,The New York Times,Well,Well,"['Dating and Relationships', 'Psychology and Psychologists', 'Parties (Social)', 'Marriages', 'Sex', 'Content Type: Service', 'Quarantine (Life and Culture)']"
Honoring Black History on Juneteenth,2021-06-16,article,News,"A day of celebration and lamentation, with events across New York.",The New York Times,Metro,New York,"['Juneteenth', 'Black People', 'Blacks', 'Holidays and Special Occasions', 'Culture (Arts)', 'African Burial Ground (NYC)']"
How to watch New York’s final Democratic mayoral debate.,2021-06-16,article,News,"Eight candidates will participate in the debate, which takes place Wednesday night from 7 to 9 p.m.",The New York Times,Metro,U.S.,"['Debates (Political)', 'Television']"
"As Pandemic Recedes in U.S., Calls Are Growing for an Investigative Commission",2021-06-16,article,News,"Bills have been introduced in both houses of Congress to create a bipartisan panel, but a leader of the Sept. 11 commission thinks a nonpartisan effort would have more success in the current climate.",The New York Times,Washington,U.S.,"['Coronavirus (2019-nCoV)', 'United States Politics and Government']"
New York Is Getting $22 Billion in Federal Aid. How Should It Be Spent?,2021-06-16,article,News,Business leaders warn the mayor that an influx of aid could be squandered on short-term programs that won’t help the unemployed.,The New York Times,Metro,New York,"['Federal Aid (US)', 'American Rescue Plan (2021)', 'Labor and Jobs', 'Politics and Government', 'Income Inequality', 'Culture (Arts)', 'Small Business', 'United States Economy']"
Encounters With Ghosts on Georgia’s Golden Isles,2021-06-16,article,News,"“I’ve spent a lifetime trying to outrun the ghosts of the South,” writes the author, whose African American grandparents were born in Georgia. A road trip reveals both the weight of the past and hope for the future.",The New York Times,Travel,Travel,"['Black People', 'Blacks', 'Slavery (Historical)', 'Discrimination', 'Travel and Vacations']"
The Day Mariano Rivera Learned About ‘the Jackie Robinson of Football’,2021-06-16,article,News,"During a small ceremony at the New Rochelle Walk of Fame, the retired Yankees pitcher (and other guests) got a history lesson.",The New York Times,Metropolitan,New York,"['Football', 'Black People', 'Blacks', 'Content Type: Personal Profile', 'Monuments and Memorials (Structures)', 'Baseball', 'Memorabilia and Souvenirs']"
"New Homes, Pets and Dreams: Big Pandemic Changes",2021-06-16,article,News,"Some families moved across the country and the world, others took to the open road.",The New York Times,Parenting,Parenting,"['Quarantine (Life and Culture)', 'Families and Family Life', 'Coronavirus (2019-nCoV)', 'Parenting']"
Buyers of Amazon Devices Are Guinea Pigs. That’s a Problem.,2021-06-16,article,News,Amazon’s experimental approach to product design can hurt your wallet and the environment. Why does it need our help to figure out what it’s doing?,The New York Times,Business,Technology,"['Computers and the Internet', 'Speakers (Audio)', 'Television Sets and Media Devices', 'Cameras', 'Electronics', 'Recycling of Waste Materials', 'Wearable Computing']"
Who Wants a Hotel With a Hallway Anyway?,2021-06-16,article,News,"“Motor lodges.” “High-end motels.” “Exterior-corridor hotels.” Whatever you call them, the “motorist’s hotel” has gotten a boost these past 15 months. Now about that reputation …",The New York Times,Travel,Travel,"['Hotels and Travel Lodgings', 'Quarantine (Life and Culture)', 'Coronavirus Reopenings', 'Travel and Vacations', 'Restoration and Renovation', 'Road Trips', 'Advertising and Marketing']"
Why American Women Everywhere Are Delaying Motherhood,2021-06-16,article,News,"The birthrate is falling for American women in their 20s, especially in places where the local economy is booming.",The New York Times,National,U.S.,"['Birth Rates', 'Women and Girls', 'States (US)', 'Hispanic-Americans', 'Population', 'Families and Family Life', 'Careers and Professions']"
