headline,date,doc_type,type_of_material,snippet,source,news_desk,section_name,keywords
5 takeaways from the New York City mayoral primary.,2021-06-23,article,News,,The New York Times,Metro,New York,[]
Southwest Names the Airline’s Next Chief Executive,2021-06-23,article,News,"Robert Jordan, a 33-year veteran at Southwest, will take over for Gary Kelly, the longtime chief, early next year.",The New York Times,Business,Business Day,"['Appointments and Executive Changes', 'AIRLINES AND AIRPLANES', 'Company Reports', 'Coronavirus (2019-nCoV)']"
A growing number of Republicans are working to address climate change.,2021-06-23,article,News,,The New York Times,Climate,U.S.,[]
Russia Says It Fired Warning Shots at a U.K. Warship Near Crimea,2021-06-23,article,News,Moscow said the Royal Navy destroyer was in its territorial waters. Britain said that no shots were aimed at the ship and that Russia had warned it was conducting a gunnery exercise.,The New York Times,Foreign,World,"['Defense and Military Forces', 'Ships and Shipping']"
Tech giants are aggressively lobbying Washington to back off on antitrust rules.,2021-06-23,article,News,,The New York Times,Washington,U.S.,[]
Yellen Steers the Economy With Brooklyn on Her Mind,2021-06-23,article,News,The Treasury secretary’s economic philosophy was shaped by her youth in Bay Ridge.,The New York Times,Washington,U.S.,"['United States Economy', 'Labor and Jobs', 'Income Inequality', 'Content Type: Personal Profile']"
Supreme Court Rules for Cheerleader Punished for Vulgar Snapchat Message,2021-06-23,article,News,The decision set new limits on disciplining students for off-campus speech but did not totally bar administrators from doing so.,The New York Times,Washington,U.S.,"['School Discipline (Students)', 'Freedom of Speech and Expression', 'First Amendment (US Constitution)', 'Decisions and Verdicts', 'Cheerleaders', 'Social Media', 'Education (K-12)']"
Supreme Court Rules Against Union Recruiting on California Farms,2021-06-23,article,News,The case concerned a unique state regulation allowing labor representatives to meet with farm workers at their workplaces for up to three hours a day for as many as 120 days a year.,The New York Times,Washington,U.S.,"['Agriculture and Farming', 'Regulation and Deregulation of Industry', 'Decisions and Verdicts', 'Organized Labor', 'Trespassing']"
"The Delta variant is likely to make up 90 percent of E.U. cases by late August, officials warn.",2021-06-23,article,News,"The highly transmissible variant has been detected in more than 20 European countries, but is unlikely to pose much risk to people who have been fully vaccinated, experts said.",The New York Times,Foreign,World,"['Coronavirus (2019-nCoV)', 'Disease Rates', 'Vaccination and Immunization', 'Summer (Season)', 'Travel and Vacations', 'Coronavirus Reopenings']"
The Dangers of Failing Grades,2021-06-23,article,News,Districts are trying to figure out what to do with students who fell behind this year.,The New York Times,National,U.S.,"['Coronavirus Reopenings', 'Education (K-12)', 'Colleges and Universities', 'Student Athlete Compensation', 'Coronavirus (2019-nCoV)']"
How Adams Built a Diverse Coalition That Put Him Ahead in the Mayor’s Race,2021-06-23,article,News,Eric Adams has a significant lead in the New York City mayor’s race thanks to his support from a traditional Democratic coalition of unions and Black and Latino voters.,The New York Times,Metro,New York,"['Elections, Mayors', 'Primaries and Caucuses', 'Race and Ethnicity', 'Ranked-Choice Voting']"
What Is Facebook?,2021-06-23,article,News,"Facebook keeps dabbling in new things. Is it now an overstuffed mess, or a genius idea factory?",The New York Times,Business,Technology,"['Social Media', 'Computers and the Internet']"
A Shift on Climate for Some G.O.P. Leaders,2021-06-23,article,News,A small but growing number of Republicans say it shows the party is done with denial and is ready to debate solutions.,The New York Times,Climate,Climate,"['Global Warming', 'Greenhouse Gas Emissions']"
The Biden administration plans to extend the federal moratorium on evictions for another month.,2021-06-23,article,News,Officials said the move was prompted by lagging vaccination rates and other factors. Landlords’ groups said an extension would be a harmful and unwarranted intrusion in the housing market.,The New York Times,Washington,U.S.,"['Evictions', 'United States Politics and Government', 'Coronavirus (2019-nCoV)', 'Real Estate and Housing (Residential)', 'American Rescue Plan (2021)']"
Musical Chairs? Swapping Seats Could Reduce Orchestra Aerosols.,2021-06-23,article,News,"Moving super-spreading instruments, like the trumpet, closer to air vents could limit the aerosol buildup on stage, according to a new study.",The New York Times,Science,Health,"['your-feed-science', 'your-feed-health', 'Coronavirus (2019-nCoV)', 'Coronavirus Reopenings', 'Classical Music', 'Trumpets', 'Musical Instruments', 'Coronavirus Risks and Safety Concerns', 'Research']"
Ivorian Opposition Leader Sentenced in Absentia to Life in Prison,2021-06-23,article,News,A criminal court in the West African country also ordered the dissolution of Guillaume Soro’s political movement.,The New York Times,Foreign,World,[]
How Press Freedom Is Being Eroded in Hong Kong,2021-06-23,article,News,The forced closure of the pro-democracy Apple Daily newspaper is the latest worrisome sign for journalists in the Chinese territory.,The New York Times,Foreign,World,"['Freedom of the Press', 'News and News Media', 'Hong Kong Protests (2019)', 'Politics and Government', 'Newspapers']"
U.S. to Search Former Native American Schools for Children’s Remains,2021-06-23,article,News,Secretary of the Interior Deb Haaland announced a new initiative that would delve into the records of the federal schools to which Native American children were forcibly relocated for 150 years.,The New York Times,Express,U.S.,"['Native Americans', 'Indigenous People', 'Education', 'Child Abuse and Neglect', 'Law and Legislation', 'Discrimination', 'Navajo Indians']"
Scientist Finds Early Virus Sequences That Had Been Mysteriously Deleted,2021-06-23,article,News,"By rooting through files stored on Google Cloud, a researcher says he recovered 13 early coronavirus sequences that had disappeared from a database last year.",The New York Times,Science,Science,"['Wildlife Trade and Poaching', 'Bats', 'Disease Rates', 'Laboratories and Scientific Equipment', 'Research', 'Coronavirus (2019-nCoV)', 'Genetics and Heredity', 'Computers and the Internet', 'your-feed-science']"
New York’s state of emergency will end Thursday. Takeout alcohol will end along with it.,2021-06-23,article,News,"With most restrictions already relaxed and fewer new coronavirus cases being detected in the state, “the emergency is over,” Gov. Andrew M. Cuomo said.",The New York Times,Metro,New York,"['Coronavirus (2019-nCoV)', 'Disease Rates', 'Politics and Government', 'Disasters and Emergencies', 'Coronavirus Reopenings', 'Alcoholic Beverages']"
N.Y.C.’s Police Chokehold Ban Is Struck Down by Court,2021-06-23,article,News,"In a victory for police unions, a state Supreme Court judge said a law passed by the City Council is too vaguely worded.",The New York Times,Metro,New York,"['George Floyd Protests (2020)', 'Police Brutality, Misconduct and Shootings', 'Black Lives Matter Movement']"
Eric Adams Leads in the Mayor’s Race. Here’s What to Know About Him.,2021-06-23,article,News,"Mr. Adams, a moderate Democrat whose campaign focused on crime and public safety, has a long history in New York politics and has faced scrutiny over his ethics.",The New York Times,Metro,New York,"['Elections, Mayors']"
A Culture War Between Hungary and Europe Escalates Over L.G.B.T. Bill,2021-06-23,article,News,"E.U. leaders say that they will do all they can to thwart a proposed new law in Hungary that would, they say, equate homosexuality with pedophilia.",The New York Times,Foreign,World,"['Politics and Government', 'Homosexuality and Bisexuality', 'Discrimination', 'Law and Legislation']"
"Will Wiley concede? ‘No,’ she said. ‘Because I’m winning.’",2021-06-23,article,News,Her campaign said she won more first-place votes than expected and will likely pick up more support as second- and third-place votes are retabulated.,The New York Times,Metro,New York,"['Elections, Mayors']"
Michigan Republicans Debunk Voter Fraud Claims in Unsparing Report,2021-06-23,article,News,"The report, produced by a G.O.P.-led committee in the State Senate, exposes false claims made about the 2020 election by Trump allies in Michigan and other states.",The New York Times,Politics,U.S.,"['Presidential Election of 2020', 'Voter Fraud (Election Fraud)', 'Rumors and Misinformation', 'State Legislatures', 'United States Politics and Government']"
When Summer Begins,2021-06-23,article,News,Inside and out.,The New York Times,AtHome,At Home,['Content Type: Service']
Indiana Woman Is First Person to Be Sentenced in Capitol Riot,2021-06-23,article,News,"Anna Morgan-Lloyd, who will serve no prison time, said she realized that she and others who breached the Capitol may have helped encourage the violence by other Trump supporters.",The New York Times,Washington,U.S.,"['Storming of the US Capitol (Jan, 2021)', 'United States Politics and Government']"
"John McAfee, Software Pioneer Turned Fugitive, Dies in Spanish Prison",2021-06-23,article,News,"Mr. McAfee, who has not been associated with the company that bears his name for more than two decades, was fighting extradition to the United States after his arrest in Spain.",The New York Times,Business,Business Day,"['Federal Taxes (US)', 'Computer Security', 'Extradition', 'Fugitives', 'Tax Evasion', 'Computers and the Internet', 'Prisons and Prisoners', 'Deaths (Obituaries)']"
"U.S. Opposes U.N. Resolution on Cuba Embargo, Signaling Biden Caution",2021-06-23,article,News,"It was the 29th year that the U.N General Assembly had approved the resolution, an annual event used by critics of the United States to vent their anger over the Cold War embargo.",The New York Times,Foreign,World,"['United States International Relations', 'Embargoes and Sanctions']"
Cindy McCain is Biden’s choice for ambassador to the U.N.’s food program.,2021-06-23,article,News,"President Biden also nominated Claire Cronin, a Massachusetts state senator, as ambassador to Ireland.",The New York Times,Washington,U.S.,"['Appointments and Executive Changes', 'United States International Relations']"
Return to Office? Some Women of Color Aren’t Ready,2021-06-23,article,News,"After more than a year of virtual work, employers are making plans to get back to the physical workplace. That has many workers worrying about the return of microaggressions and bias, too.",The New York Times,Gender,U.S.,"['Black People', 'Blacks', 'Women and Girls', 'Minorities', 'Workplace Environment', 'Quarantine (Life and Culture)', 'Race and Ethnicity']"
"In the race for the Democratic nomination for mayor, some votes cost more than others.",2021-06-23,article,News,"Raymond J. McGuire spent the most per vote, while Kathryn Garcia spent the least, according to early results.",The New York Times,Metro,New York,"['Elections, Mayors', 'Campaign Finance']"
General Milley pushes back on G.O.P. accusations of a ‘woke’ military.,2021-06-23,article,News,"“I want to understand white rage, and I’m white,” General Mark A. Milley, the chairman of the Joint Chiefs of Staff, told a Republican congressman who objected to the teaching of “critical race theory.”",The New York Times,Washington,U.S.,"['United States Defense and Military Forces', 'Race and Ethnicity']"
"‘Hot Pursuit’ Doesn’t Always Justify Entry, Supreme Court Rules",2021-06-23,article,News,"The mere flight of a person suspected of a minor crime, without more, does not allow police officers to enter homes without warrants, the court said.",The New York Times,Washington,U.S.,"['Search and Seizure', 'Fourth Amendment (US Constitution)']"
Basketball Coach Is Fired After Students Toss Tortillas at Rivals,2021-06-23,article,News,"Students at Coronado High School, near San Diego, threw the tortillas at players from the predominantly Latino Orange Glen High School on Saturday.",The New York Times,Express,U.S.,"['Education (K-12)', 'Interscholastic Athletics', 'Coaches and Managers', 'Discrimination', 'Hispanic-Americans', 'Basketball']"
Democrats and Activists Focus on the Filibuster After a Defeat on Voting Rights,2021-06-23,article,News,"Backers of the elections bill hope Republican obstruction will lead to a change in Senate rules, but Democratic holdouts remain firm.",The New York Times,Washington,U.S.,"['United States Politics and Government', 'Voter Registration and Requirements', 'Law and Legislation', 'Filibusters and Debate Curbs']"
"Heart Problems After Vaccination Are Very Rare, Federal Researchers Say",2021-06-23,article,News,"More than 1,200 cases have been reported, mostly mild and more often in young men and boys. The benefits of vaccination still far outweigh the risks, experts said.",The New York Times,Science,Health,"['your-feed-science', 'Disease Rates', 'Coronavirus (2019-nCoV)', 'Vaccination and Immunization', 'Youth', 'Heart', 'Men and Boys', 'Deaths (Fatalities)', 'Children and Childhood']"
Biden Removes Chief of Housing Agency After Supreme Court Ruling,2021-06-23,article,News,"The case was brought by shareholders of Fannie Mae and Freddie Mac, who said the law that created the agency was unconstitutional.",The New York Times,Washington,U.S.,"['Decisions and Verdicts', 'Appointments and Executive Changes', 'United States Politics and Government']"
Coronavirus Briefing: What Happened Today,2021-06-23,article,News,How to convince the vaccine hesitant.,The New York Times,NYTNow,U.S.,[]
What We Know (So Far) About New York’s Altered Political Landscape,2021-06-23,article,News,"As Eric Adams has moderate Democrats feeling bullish, the City Council appears to be shifting leftward.",The New York Times,Politics,U.S.,"['Elections, Mayors', 'Primaries and Caucuses', 'Politics and Government', 'Elections, District Attorneys', 'Elections, Comptrollers', 'City Councils']"
Why Democrats Are Reluctantly Making Voter ID Laws a Bargaining Chip,2021-06-23,article,News,"While party leaders have long worried about the discriminatory effects of such laws, many now see other restrictive voting measures pushed by Republicans as a more urgent threat.",The New York Times,Politics,U.S.,"['Voter Registration and Requirements', 'United States Politics and Government', 'Black People', 'Blacks', 'Discrimination', 'Absentee Voting', 'Law and Legislation', 'States (US)', 'Polls and Public Opinion', 'State Legislatures', 'Identification Devices', 'Hispanic-Americans']"
Mexico’s President Says Carlos Slim Might Help Rebuild Collapsed Metro Line,2021-06-23,article,News,"A New York Times investigation found that poor work by Mr. Slim’s company led to the fatal accident. Mr. Slim may be willing to help fix it, but it is not clear if he would pay the costs.",The New York Times,Foreign,World,"['Mexico City Train Crash (May 2021)', 'Subways', 'Accidents and Safety', 'Engineering and Engineers', 'Politics and Government']"
"Biden administration forces out Border Patrol chief, a supporter of Trump’s policies.",2021-06-23,article,News,The move comes as Vice President Kamala Harris plans to visit the southwest border on Friday.,The New York Times,Washington,U.S.,"['Immigration and Emigration', 'Appointments and Executive Changes', 'United States Politics and Government']"
"After Criticism Over Her Border Absence, Harris Will Visit El Paso",2021-06-23,article,News,"Her trip Friday will come just before former President Donald J. Trump is set to visit the border with House Republicans and the Texas governor, who has pledged to finish the wall.",The New York Times,Washington,U.S.,"['Illegal Immigration', 'United States Politics and Government', 'Immigration and Emigration', 'Border Barriers']"
How India Walton Pulled It Off in the Buffalo Mayoral Primary,2021-06-23,article,News,"Ms. Walton, 38, a democratic socialist who has never held political office, defeated Byron Brown, a four-term incumbent.",The New York Times,Metro,New York,"['Elections, Mayors', 'Primaries and Caucuses', 'Black People', 'Blacks', 'Politics and Government', 'Content Type: Personal Profile', 'Women and Girls']"
"Staving Off G.O.P. Attacks, Democrats Show New Urgency on Crime",2021-06-23,article,News,A strong showing by Eric Adams in the New York mayoral race and President Biden’s announcement of a new crime-fighting agenda signal a shift by Democrats toward themes of public safety.,The New York Times,Politics,U.S.,"['Police Reform', 'United States Politics and Government', 'American Rescue Plan (2021)', 'Crime and Criminals']"
Defense Secretary Backs Changes to Military Law on Sexual Assault,2021-06-23,article,News,A legislative clash looms over whether the military justice system should be overhauled to change the way all serious crimes are handled.,The New York Times,Washington,U.S.,"['United States Politics and Government', 'Law and Legislation', 'United States Defense and Military Forces', 'Sex Crimes']"
"Can Maya Wiley or Kathryn Garcia Still Beat Eric Adams? Yes, but …",2021-06-23,article,News,"Under ranked-choice voting, it is mathematically possible for the second- and third-place finishers in Tuesday’s Democratic primary to overtake the front-runner — but it will be tough.",The New York Times,Metro,New York,"['Elections, Mayors', 'Ranked-Choice Voting', 'Voting and Voters']"
"A Mother and Son Are Found Murdered, Deepening a Mystery in South Carolina",2021-06-23,article,News,The authorities are opening a new investigation into an unsolved 2015 death as a result of information gleaned after two members of a prominent family were killed.,The New York Times,National,U.S.,"['Murders, Attempted Murders and Homicides']"
‘Fire Monks’ Defend Tassajara Zen Monastery From Wildfire,2021-06-23,article,News,"Eight monks protecting the Buddhist center near Big Sur, Calif., are relying not only on training from professional firefighters but also on their Zen practice.",The New York Times,Express,U.S.,"['Fires and Firefighters', 'Wildfires', 'Monasteries and Monks', 'Buddhism', 'Meditation', 'Evacuations and Evacuees']"
Modest Rent Increases Approved for 2.3 Million N.Y.C. Tenants,2021-06-24,article,News,The Rent Guidelines Board voted to allow 1.5 percent increases for the second six months of one-year leases. Tenants had pushed for rent reductions.,The New York Times,Metro,New York,"['Renting and Leasing (Real Estate)', 'Real Estate and Housing (Residential)', 'Landlords', 'Coronavirus (2019-nCoV)', 'Rent Control and Stabilization', 'Affordable Housing']"
Biden Aims to Bolster Police Departments as Homicides Increase,2021-06-24,article,News,"The president made clear that he intends to approach crime prevention by investing in, rather than defunding, the police as he waded into an urgent national debate over policing.",The New York Times,Washington,U.S.,"['Crime and Criminals', 'Police Reform', 'Gun Control', 'Police', 'United States Politics and Government', 'Police Brutality, Misconduct and Shootings', 'American Rescue Plan (2021)']"
Iran Atomic Agency Says It Thwarted Attack on a Facility,2021-06-24,article,News,The attack was said to have been carried out by a small drone against a manufacturing center used in the production of centrifuges.,The New York Times,Foreign,World,"['Presidential Election of 2020', 'Nuclear Energy', 'Arms Control and Limitation and Disarmament', 'Espionage and Intelligence Services']"
The White House plans to send 3 million doses of Johnson & Johnson’s vaccine to Brazil on Thursday.,2021-06-24,article,News,The shipment is part of President Biden’s pledge to deliver 80 million doses overseas by the end of June.,The New York Times,Foreign,World,"['Coronavirus (2019-nCoV)', 'Vaccination and Immunization', 'United States International Relations']"
BuzzFeed Closes In on Deal to Go Public,2021-06-24,article,News,The digital publisher is said to be on the verge of announcing a SPAC merger that would take the company public.,The New York Times,Business,Business Day,"['Mergers, Acquisitions and Divestitures', 'News and News Media', 'Special Purpose Acquisition Companies (SPAC)']"
Biden Administration Forces Out Trump-Era Border Patrol Chief,2021-06-24,article,News,"The chief, Rodney S. Scott, had become known for his support of President Donald J. Trump’s signature border wall, and had resisted a Biden initiative to stop using the phrase “illegal alien.”",The New York Times,Washington,U.S.,"['Illegal Immigration', 'Border Barriers', 'Immigration and Emigration', 'United States Politics and Government']"
"Nearly 900 Secret Service employees were infected with the virus, a watchdog group finds.",2021-06-24,article,News,The Citizens for Responsibility and Ethics in Washington criticized former President Trump for holding large campaign rallies that it said exposed agents to the virus.,The New York Times,Express,World,"['Coronavirus (2019-nCoV)', 'Presidential Election of 2020', 'Freedom of Information Act']"
Judge Blocks $4 Billion U.S. Debt Relief Program for Minority Farmers,2021-06-24,article,News,"The aid program, part of the $1.9 trillion stimulus package that Congress passed in March, is intended to help farmers who have endured generations of racial discrimination.",The New York Times,Express,U.S.,"['Agriculture and Farming', 'Race and Ethnicity', 'Minorities', 'Discrimination', 'American Rescue Plan (2021)', 'Decisions and Verdicts', 'United States Politics and Government', 'Whites', 'Suits and Litigation (Civil)']"
San Francisco will require all city employees to be vaccinated.,2021-06-24,article,News,"The city is one of the largest U.S. municipalities to impose a Covid vaccine mandate for public workers, who could lose their jobs if they decline.",The New York Times,Foreign,World,"['Coronavirus (2019-nCoV)', 'Vaccination and Immunization', 'Local Government']"
Hundreds More Unmarked Graves Found at Former Residential School in Canada,2021-06-24,article,News,"An Indigenous group said the remains of as many as 751 people, mainly children, had been found in unmarked graves on the site of a former boarding school in Saskatchewan.",The New York Times,Foreign,World,"['Indigenous People', 'Private and Sectarian Schools', 'Deaths (Fatalities)', 'Child Abuse and Neglect', 'Discrimination']"
Climate watchdog says Britain lacks a strategy to meet its goals.,2021-06-24,article,News,"The British government is failing to take necessary steps to meet “historic” climate promises, an advisory panel said.",The New York Times,Business,Business Day,"['Greenhouse Gas Emissions', 'Politics and Government', 'Global Warming', 'Fuel Emissions (Transportation)', 'Law and Legislation']"
This Is the Plan to Rescue Poor Countries From the Pandemic,2021-06-24,article,News,"A proposal advanced by the International Monetary Fund aims to supply the developing world with extra money to buy vaccines, pay down debt and expand relief programs.",The New York Times,Business,Business Day,"['Income Inequality', 'Credit and Debt', 'Coronavirus (2019-nCoV)', 'Third World and Developing Countries', 'Vaccination and Immunization', 'International Trade and World Market', 'Poverty']"
"What to Know About the Building Collapse in Surfside, Fla.",2021-06-24,article,News,"A catastrophic building failure left as many as 147 people unaccounted for, the authorities said.",The New York Times,Express,U.S.,"['Buildings (Structures)', 'Accidents and Safety', 'Rescues', 'Surfside, Fla, Building Collapse (2021)']"
‘Death Doulas’ Provide Aid at the End of Life,2021-06-24,article,News,"End-of-life doulas support people emotionally, physically, spiritually and practically: sitting vigil, giving hand massages, making snacks.",The New York Times,Well,Well,"['Death and Dying', 'Midwives and Doulas', 'Living Wills and Health Care Proxies', 'Grief (Emotion)']"
U.S. to Move Afghans Who Aided Troops Outside the Country,2021-06-24,article,News,The relocations are meant to place interpreters and others who worked with departing American forces somewhere safe until visas for them to enter the United States are processed.,The New York Times,Washington,U.S.,"['Afghanistan War (2001- )', 'United States Defense and Military Forces', 'Visas', 'Immigration and Emigration', 'United States Politics and Government', 'United States International Relations', 'Translation and Interpreters']"
Brooklyn Councilman Unites Progressives to Lead Comptroller’s Race,2021-06-24,article,News,"Brad Lander holds a lead over Corey Johnson, the speaker of the City Council, after the first ranked-choice voting ballot.",The New York Times,Metro,New York,"['Elections, Comptrollers', 'Budgets and Budgeting', 'Primaries and Caucuses']"
‘The Rabbi Said It Was OK’: Hasidic Mother of 10 Becomes Doctor,2021-06-24,article,News,An ultra-Orthodox mother navigated strict cultural norms to become one of the few Hasidic female doctors in the country.,The New York Times,Metropolitan,New York,"['Jews and Judaism', 'Orthodox Judaism', 'Hasidism', 'Women and Girls', 'Medical Schools', 'Colleges and Universities', 'Content Type: Personal Profile', 'Doctors']"
Top U.S. Officials Consulted With BlackRock as Markets Melted Down,2021-06-24,article,News,The world’s largest asset manager was central to the pandemic crisis response. Emails and calendar records underscore that critical role.,The New York Times,Business,Business Day,"['Banking and Financial Institutions', 'United States Economy', 'Credit and Debt', 'United States Politics and Government', 'Coronavirus (2019-nCoV)', 'Stocks and Bonds', 'Conflicts of Interest']"
