headline,date,doc_type,type_of_material,snippet,source,news_desk,section_name,keywords
How Tech Won the Pandemic and Now May Never Lose,2021-07-23,article,News,"As the world reeled, Silicon Valley supplied the tools that made life and work possible. Now tech companies are awash in money — and questions about what it means to win amid so much loss.",The New York Times,SundayBusiness,Technology,"['Quarantine (Life and Culture)', 'Computers and the Internet', 'Coronavirus (2019-nCoV)', 'Shutdowns (Institutional)', 'Mergers, Acquisitions and Divestitures', 'Antitrust Laws and Competition Issues', 'Real Estate and Housing (Residential)', 'E-Commerce', 'Telecommuting']"
Crypto Nomads: Surfing the World for Risk and Profit,2021-07-23,article,News,A new generation of industry leaders has set up offshore trading exchanges largely beyond the reach of American regulators.,The New York Times,SundayBusiness,U.S.,"['Virtual Currency', 'Derivatives (Financial Instruments)', 'Futures and Options Trading', 'Relocation of Business', 'Financial Brokers', 'Regulation and Deregulation of Industry', 'Computers and the Internet']"
‘I Feel Conflicted’: Crypto’s Offshore Trading Moguls Talk Shop,2021-07-23,article,News,The founders of the cryptocurrency exchanges FTX and Binance talked with The Times about risk and regulation.,The New York Times,Business,Business Day,"['Virtual Currency', 'Content Type: Personal Profile', 'Derivatives (Financial Instruments)']"
What’s the Best Way to Protect Sex Workers? Depends on Whom You Ask.,2021-07-23,article,News,"There are two competing bills in New York: One would punish pimps and customers, while the other would decriminalize the entire trade.",The New York Times,Metropolitan,New York,"['Prostitution', 'Human Trafficking', 'Workplace Hazards and Violations', 'Women and Girls', 'Transgender and Transsexuals', 'Law and Legislation', 'Regulation and Deregulation of Industry']"
What to Do This Summer: Lower Manhattan,2021-07-23,article,News,"Three neighborhoods offer art, great food (and drinks), river breezes and lush green space — not to mention amazing views. And, for now, there’s still plenty of elbow room.",The New York Times,Travel,Travel,"['Travel and Vacations', 'Bars and Nightclubs', 'Restaurants', 'Art']"
Men Who Beat Hong Kong Protesters in Mob Attack Are Sentenced to Prison,2021-07-23,article,News,"In his ruling, a judge in Hong Kong said that the seven defendants had “viciously” attacked innocent people in a train station in July 2019.",The New York Times,Foreign,World,"['Hong Kong Protests (2019)', 'Decisions and Verdicts', 'Assaults']"
‘A gift from God’: Greece enlists the church in its vaccine drive.,2021-07-23,article,News,The government has turned to the leaders of the powerful Orthodox Church to appeal to the faithful and rein in clerics who have been vocal about mistrusting vaccines.,The New York Times,Foreign,World,"['Vaccination and Immunization', 'Clergy', 'Politics and Government', 'Greek Orthodox Church', 'Coronavirus (2019-nCoV)']"
"Chicago will require masks in school this fall, regardless of vaccination status.",2021-07-23,article,News,,The New York Times,Foreign,World,[]
Meet the Crypto Nomads,2021-07-23,article,News,The big money in cryptocurrency is offshore.,The New York Times,Business,Business Day,"['Derivatives (Financial Instruments)', 'Virtual Currency']"
"Buy My House, But I’m Taking the Toilet",2021-07-23,article,News,"In this seller’s market, some sellers are exercising their power with unusual demands and stripping their homes of fixtures and appliances as they leave.",The New York Times,RealEstate,Real Estate,"['Real Estate and Housing (Residential)', 'Quarantine (Life and Culture)']"
A Painting or an NFT of It: Which Will Be More Valuable?,2021-07-23,article,News,The new technology is raising questions about the risks and rewards of investing in digital art forms.,The New York Times,Business,Your Money,"['Collectors and Collections', 'Nonfungible Tokens (NFTs)', 'Art', 'Virtual Currency']"
Scientists Finish the Human Genome at Last,2021-07-23,article,News,"The complete genome uncovered more than 100 new genes that are probably functional, and many new variants that may be linked to diseases.",The New York Times,Science,Science,"['Genetics and Heredity', 'DNA (Deoxyribonucleic Acid)', 'Human Genome Project', 'Chromosomes', 'Research', 'your-feed-science']"
Montana’s Famed Trout Under Threat as Drought Intensifies,2021-07-23,article,News,"The state is imposing more restrictions on fishing this year as the combination of extreme conditions, including low river levels, fish die-offs and the crush of anglers, poses long-term problems.",The New York Times,Science,Science,"['Drought', 'Trout', 'Rivers', 'Fish and Other Marine Life', 'Fishing, Sport', 'Wildlife Die-Offs', 'your-feed-science']"
Astronomers See Moons Forming in Disk Around Distant Exoplanet,2021-07-23,article,News,Scientists have never before gotten such a clear view of moons in the making.,The New York Times,Science,Science,"['Space and Astronomy', 'Stars and Galaxies', 'Telescopes and Observatories', 'Research']"
Tokyo Olympics Open to a Sea of Empty Seats,2021-07-23,article,News,"While an opening ceremony is usually a chance for the host nation to showcase the best of itself, these Games are being staged with the less lofty ambition of enduring the pandemic.",The New York Times,Foreign,World,"['Olympic Games (2020)', 'Stadiums and Arenas', 'Coronavirus (2019-nCoV)', 'Disease Rates']"
Some Florida Hospitals Have More Covid Patients Than Ever Before,2021-07-23,article,News,A rapid rise in Covid-19 hospitalizations in parts of the country with lagging vaccination rates is causing alarm.,The New York Times,National,U.S.,"['Coronavirus (2019-nCoV)', 'Disease Rates', 'Vaccination and Immunization', 'Hospitals', 'Politics and Government', 'Rumors and Misinformation']"
How to Calm Your Climate Anxiety,2021-07-23,article,News,"Between wildfires, heat waves and hurricanes, we’re all feeling nervous about the future. But stewing or ignoring the problem won’t ease your burden.",The New York Times,Parenting,Well,"['Mental Health and Disorders', 'Anxiety and Stress', 'Depression (Mental)', 'Global Warming', 'Emotions', 'Wildfires', 'Energy Efficiency', 'Hurricanes and Tropical Storms']"
It’s a Grizzly Bear Survival Program. For Grizzly Bears.,2021-07-23,article,News,"In British Columbia, researchers have undertaken a unique challenge: tracking orphan grizzly cubs, reared in a shelter, to see whether they can thrive back in the wild.",The New York Times,Science,Science,"['your-feed-science', 'Bears', 'Endangered and Extinct Species', 'Animals', 'Orphans and Orphanages', 'Wilderness Areas', 'Wildlife Sanctuaries and Nature Reserves', 'Conservation of Resources', 'your-feed-animals', 'Biology and Biochemistry']"
"Biden hits the campaign trail for the first time as president, backing Terry McAuliffe for Virginia governor.",2021-07-23,article,News,"The president, trading his more serene presidential demeanor for a fiery campaign one, whipped up the crowd and sought to portray Mr. McAuliffe as a critical partner in a shared vision.",The New York Times,Washington,U.S.,"['Endorsements', 'Elections, Governors']"
"Suspect Tries to Compare Capitol Riot to Last Year’s Violence in Portland, Ore.",2021-07-23,article,News,"Right-wing news media and Republican politicians have often made the comparison. Now, in a narrow legal context, a judge will consider the argument.",The New York Times,Washington,U.S.,"['Storming of the US Capitol (Jan, 2021)', 'Right-Wing Extremism and Alt-Right', 'United States Politics and Government', 'George Floyd Protests (2020)']"
We Need a New Term for Video Games,2021-07-23,article,News,"We’re seeing a ton of new games, and many of them blur the lines between video games and other types of activities.",The New York Times,Business,Technology,"['Computer and Video Games', 'Computers and the Internet']"
"N.Y.C.’s mayor calls for companies to require shots, as national debate over vaccine mandates picks up.",2021-07-23,article,News,Mayor Bill de Blasio of New York said the city might broaden the number of city workers required to get vaccinated or tested weekly.,The New York Times,National,U.S.,"['Coronavirus (2019-nCoV)', 'Vaccination and Immunization', 'Disease Rates']"
Amazon will investigate gender bias claims in its cloud division.,2021-07-23,article,News,The company has hired a law firm to look into allegations at Amazon Web Services.,The New York Times,Business,Technology,"['Workplace Hazards and Violations', 'Discrimination', 'Computers and the Internet', 'Cloud Computing', 'Women and Girls']"
"Delays, More Masks and Mandatory Shots: Virus Surge Disrupts Office-Return Plans",2021-07-23,article,News,"A wave of the contagious Delta variant is causing companies to reconsider when they will require employees to return, and what health requirements should be in place when they do.",The New York Times,Business,Business Day,"['Coronavirus Reopenings', 'Workplace Hazards and Violations', 'Vaccination and Immunization', 'Coronavirus (2019-nCoV)', 'Telecommuting', 'Disease Rates']"
The European Union’s drug regulator authorizes the Moderna vaccine for children 12 and older.,2021-07-23,article,News,It is the second Covid vaccine to be approved for use for younger age groups in the 27-nation bloc.,The New York Times,Foreign,World,"['Vaccination and Immunization', 'Coronavirus (2019-nCoV)']"
Persuasion vs. Coercion: Vaccine Debate in Europe Heats Up,2021-07-23,article,News,"France is taking the lead in making life unpleasant for the unvaccinated, even requiring some people to get shots. Protesters see a soft dictatorship dawning.",The New York Times,Foreign,World,"['Vaccination and Immunization', 'Coronavirus (2019-nCoV)', 'Disease Rates', 'Politics and Government']"
"In the Capitol, the Delta Variant Spreads Worry and Partisanship",2021-07-23,article,News,"Staff members are flocking to get tested and the Capitol’s doctor is begging laggards to get vaccinated, but as the variant takes hold in the Capitol’s “petri dish,” rancor is only growing.",The New York Times,Washington,U.S.,"['Vaccination and Immunization', 'Coronavirus (2019-nCoV)', 'Rumors and Misinformation', 'United States Politics and Government', 'Disease Rates']"
Janet Yellen warns Congress that failing to act on the debt limit risks ‘irreparable’ economic harm.,2021-07-23,article,News,She said her Treasury Department would begin taking “extraordinary measures” to avoid breaching the so-called debt limit.,The New York Times,Washington,U.S.,['National Debt (US)']
G.M. issues a new recall of Chevrolet Bolts over a battery fire hazard.,2021-07-23,article,News,"The automaker has told owners of the 51,000 vehicles, from the 2017 to 2019 model years, to take precautions until defects are remedied.",The New York Times,Business,Business Day,"['Automobiles', 'Automobile Safety Features and Defects', 'Electric and Hybrid Vehicles', 'Recalls and Bans of Products', 'Batteries']"
Russia Signs Deal With Dubai Logistics Company to Navigate Thawing Arctic,2021-07-23,article,News,"DP World, a leading logistics company, agreed on Friday to cooperate with a Russian state company on shipping ventures in the Arctic Ocean.",The New York Times,Foreign,World,"['Ships and Shipping', 'Global Warming']"
"For Republicans, Deep Wounds Fuel Resistance to Bolstering the I.R.S.",2021-07-23,article,News,A desire to crack down on tax cheats is overshadowed by years of G.O.P. resentment toward the agency.,The New York Times,Washington,U.S.,"['American Jobs Plan (2021)', 'Infrastructure (Public Works)', 'Tax Evasion', 'Federal Taxes (US)', 'Internal Revenue Service Political Profiling', 'United States Politics and Government']"
"France Adopts Laws to Combat Terrorism, but Critics Call Them Overreaching",2021-07-23,article,News,"After several attacks, the government said it needed more tools to hunt down terrorists and prevent extremist ideas from spreading. Critics call the laws heavy handed.",The New York Times,Foreign,World,"['Law and Legislation', 'Terrorism', 'Muslims and Islam', 'Home Schooling']"
Federal efforts to stave off an eviction crisis gain some momentum.,2021-07-23,article,News,"The amount of money sent to tenants in June was greater than the disbursements of the previous two months combined, according to the Treasury Department.",The New York Times,Washington,U.S.,"['Evictions', 'Real Estate and Housing (Residential)', 'American Rescue Plan (2021)']"
When Euphemisms (but Never Sharks) Attack,2021-07-23,article,News,"Plus, orphaned grizzlies, baby deer in the shower, hoot-owl restrictions and more in the Friday edition of the Science Times newsletter.",The New York Times,Science,Science,"['Sharks', 'Extraterrestrial Life', 'your-feed-science', 'your-feed-animals']"
Your Flight Has Been Canceled or Delayed. What Should You Do?,2021-07-23,article,News,"As airlines struggle to keep up with increased travel demand, thousands of flights have been disrupted over the last month. Here’s what you need to know if yours is one of them.",The New York Times,Travel,Travel,"['AIRLINES AND AIRPLANES', 'Delays (Transportation)', 'Content Type: Service', 'Travel and Vacations']"
U.S. Strikes Taliban Targets in a Show of Force in Afghanistan,2021-07-23,article,News,"The airstrikes showed American willingness to back up beleaguered Afghan government forces as the Taliban advance, but the extent of that willingness remains unclear.",The New York Times,Foreign,World,"['Afghanistan War (2001- )', 'United States Defense and Military Forces', 'United States International Relations']"
What to Do This Weekend,2021-07-23,article,News,Tomatoes and tiny travel.,The New York Times,AtHome,At Home,['Content Type: Service']
Tony Podesta is hired to lobby by Huawei and a Bulgarian energy company.,2021-07-23,article,News,"With his allies running Washington, the veteran Democratic lobbyist has re-emerged after his firm collapsed under scrutiny from investigators.",The New York Times,Washington,U.S.,"['Lobbying and Lobbyists', 'United States Politics and Government']"
Israeli Data Suggests Possible Waning in Effectiveness of Pfizer Vaccine,2021-07-23,article,News,The new numbers still show overwhelmingly strong protection against severe disease but diminished effectiveness against infection.,The New York Times,Science,Science,"['Vaccination and Immunization', 'Coronavirus (2019-nCoV)', 'Coronavirus Risks and Safety Concerns', 'Disease Rates', 'Research']"
"Thomas Barrack, Trump’s friend and fund-raiser, is freed on $250 million bond.",2021-07-23,article,News,The agreement requires Mr. Barrack to wear a GPS location monitoring bracelet at all times.,The New York Times,Washington,U.S.,['United States Politics and Government']
Coronavirus Briefing: What Happened Today,2021-07-23,article,News,Pandemic Olympics,The New York Times,NYTNow,U.S.,[]
Bust of Klan Leader Removed From Tennessee State Capitol,2021-07-23,article,News,"The busts of Nathan Bedford Forrest, a slave trader and Confederate general, and two U.S. Navy admirals were removed on Friday and installed at the Tennessee State Museum.",The New York Times,Express,U.S.,"['Monuments and Memorials (Structures)', 'Museums', 'United States Politics and Government', 'Civil War (US) (1861-65)']"
The U.S. military strikes a Qaeda affiliate in Somalia for the second time in a week.,2021-07-23,article,News,The Pentagon said it was defending allied Somali forces from afar in the latest drone attack against Shabab fighters.,The New York Times,Washington,U.S.,[]
"A Border Reopening, at Least One Way, and Some Travel Tips",2021-07-23,article,News,Canada said this week that most restrictions on fully vaccinated American travelers will be lifted in early August. But the U.S. extended its border closure.,The New York Times,Foreign,World,"['Travel and Vacations', 'Ceramics and Pottery']"
$1 Million in Fines Proposed Over Nitrogen Leak That Killed 6 at Poultry Plant,2021-07-23,article,News,"Federal officials proposed the fines against four companies after finding that they could have prevented the deaths at the Foundation Food Group plant in Gainesville, Ga., in January.",The New York Times,Express,U.S.,"['Workplace Hazards and Violations', 'Deaths (Fatalities)', 'Nitrogen', 'Labor and Jobs', 'Fines (Penalties)', 'Accidents and Safety', 'Poultry', 'Factory Farming']"
"Outbreaks of Untreatable, Drug-Resistant Fungus Spread in 2 Cities",2021-07-23,article,News,"For the first time, the C.D.C. identified several cases of Candida auris that were resistant to all drugs, in two health facilities in Texas and a long-term care center in Washington, D.C.",The New York Times,Science,Health,"['Candida Auris (Fungus)', 'Drug Resistance (Microbial)', 'Infections', 'your-feed-healthcare']"
The F.T.C. asks for an extension to refile its Facebook antitrust suit.,2021-07-23,article,News,The F.T.C. said in its request that it had reached an agreement with Facebook over the proposed extension.,The New York Times,Business,Technology,"['Suits and Litigation (Civil)', 'Antitrust Laws and Competition Issues', 'Social Media', 'Computers and the Internet']"
De Blasio Urges New York Businesses to Require Employee Vaccinations,2021-07-23,article,News,The debate over mandates is intensifying as the highly contagious Delta variant of the coronavirus surges in many parts of the United States.,The New York Times,Metro,New York,"['Coronavirus (2019-nCoV)', 'Vaccination and Immunization', 'Organized Labor', 'Motivation and Incentive Programs', 'Workplace Hazards and Violations', 'Vaccination Proof and Immunization Records', 'Disease Rates', 'Politics and Government', 'United States Politics and Government']"
How the New Capitol Police Chief Wants to Fix an Embattled Force,2021-07-23,article,News,J. Thomas Manger said the brutal attack on Jan. 6 persuaded him to come out of retirement to try to help get the agency “where it needs to be.”,The New York Times,Washington,U.S.,"['Appointments and Executive Changes', 'Capitol Building (Washington, DC)', 'Storming of the US Capitol (Jan, 2021)', 'United States Politics and Government']"
The Police Believe 98 People Died in the Condo Collapse. One Hasn’t Been Found.,2021-07-23,article,News,"The search at the collapse site in Surfside, Fla., was declared over on Friday, but the authorities are continuing to look through the relocated rubble for the remains of Estelle Hedaya, 54.",The New York Times,National,U.S.,"['Surfside, Fla, Building Collapse (2021)', 'Deaths (Fatalities)']"
Biden Officials Now Expect Vulnerable Americans to Need Booster Shots,2021-07-23,article,News,The growing consensus that at least some Americans will need a booster is partly tied to research suggesting that Pfizer’s vaccine is less effective after about six months.,The New York Times,Washington,U.S.,"['Vaccination and Immunization', 'Coronavirus (2019-nCoV)', 'Clinical Trials']"
"Skilled in Strategy (and Grudges), Top Biden Adviser to Depart White House",2021-07-23,article,News,"Anita Dunn, who is returning to her Democratic consulting company next month, has long faced questions about how her influence in the White House intersects with her company’s corporate work.",The New York Times,Washington,U.S.,"['United States Politics and Government', 'Appointments and Executive Changes', 'Lobbying and Lobbyists']"
What to Know About the Heat Waves,2021-07-24,article,News,"In most parts of the United States, temperatures must be above the historical average in an area for two or more days before the label “heat wave” is applied.",The New York Times,National,U.S.,"['Heat and Heat Waves', 'Weather']"
"After a Republican outcry, Tennessee redirects vaccine outreach to teenagers, shifting it to their parents.",2021-07-24,article,News,"Two weeks ago, a campaign to encourage public school students to get vaccinated was halted when Republican elected officials complained that parents should make the decisions.",The New York Times,Foreign,World,"['Coronavirus (2019-nCoV)', 'Vaccination and Immunization', 'Parenting']"
Scenes From America’s Largest Wildfire,2021-07-24,article,News,"Small fires burned inside hollowed-out trees. Smoke rose from the blackened dirt. On the edge of the Bootleg Fire in southern Oregon, firefighters worked to halt the advance of the flames.",The New York Times,National,U.S.,"['Fires and Firefighters', 'Wildfires']"
Japan’s Diverse Olympic Stars Reflect a Country That’s Changing (Slowly),2021-07-24,article,News,Multiracial athletes like Naomi Osaka and Rui Hachimura are helping to redefine what it means to be Japanese. But they are often still seen as outsiders.,The New York Times,Foreign,World,"['Race and Ethnicity', 'Discrimination', 'Olympic Games (2020)']"
A Rebellion Is Stirring in Boris Johnson’s Backyard,2021-07-24,article,News,"Brexit helped destroy Labour’s “red wall” in England’s North. Now, it’s coming for the Conservatives’ “blue wall” in the South.",The New York Times,Foreign,World,['Great Britain Withdrawal from EU (Brexit)']
Why America Isn’t Getting the Jan. 6 Investigation It Needs,2021-07-24,article,News,Reaching any kind of national consensus about what happened that day now feels like as much of a fantasy as any false-flag conspiracy theory.,The New York Times,Politics,U.S.,"['Storming of the US Capitol (Jan, 2021)', 'United States Politics and Government', 'Polls and Public Opinion', 'Right-Wing Extremism and Alt-Right']"
"After New York Tests a New Way of Voting, Other Cities May Do the Same",2021-07-24,article,News,"Elected leaders and voters in New York remain split over the ranked-choice system, but officials in Washington and elsewhere like the results.",The New York Times,Metro,New York,"['Voting Rights, Registration and Requirements', 'Ranked-Choice Voting', 'Elections, Mayors', 'United States Politics and Government', 'Voting and Voters']"
"For Older Adults, Home Care Has Become Harder to Find",2021-07-24,article,News,Staffing shortages have long plagued the home care industry. But the pandemic has intensified the problem.,The New York Times,Science,Health,"['Elderly', 'Home Health Care', 'Shortages', 'Labor and Jobs', 'your-feed-science', 'your-feed-healthcare']"
Spain Pledged Citizenship to Sephardic Jews. Now They Feel Betrayed.,2021-07-24,article,News,"In 2015, Spain said it would give citizenship to the descendants of Sephardic Jews expelled during the Spanish Inquisition. Then rejections started pouring in this summer.",The New York Times,Foreign,World,"['Jews and Judaism', 'Citizenship and Naturalization', 'Reparations', 'Politics and Government', 'Synagogues', 'Genealogy', 'Immigration and Emigration']"
They Were Once Luxury Venues. Now They Are Grim Covid Camps.,2021-07-24,article,News,"As an outbreak seizes Cambodia, patients who test positive for the virus say they are being forced into quarantine centers that are more like makeshift prisons than hospitals.",The New York Times,Foreign,World,"['Coronavirus (2019-nCoV)', 'Disease Rates', 'Quarantines', 'Vaccination and Immunization', 'Politics and Government']"
"They Waited, They Worried, They Stalled. This Week, They Got the Shot.",2021-07-24,article,News,The U.S. vaccine rollout has plateaued and the course of the coronavirus pandemic in this country may depend on how many people are ultimately swayed to get vaccinated.,The New York Times,National,U.S.,"['Coronavirus (2019-nCoV)', 'Vaccination and Immunization', 'Disease Rates', 'Motivation and Incentive Programs', 'Content Type: Personal Profile']"
‘He Had a Life Before Death’: Remembering Emmett Till for the Child He Was,2021-07-24,article,News,Emmett Till’s cousin Ollie Gordon recalled him as a jokester who “loved to make people laugh” as she reflected on their childhood together ahead of what would have been his 80th birthday.,The New York Times,National,U.S.,"['Civil Rights Movement (1954-68)', 'Black People', 'Blacks', 'Black Lives Matter Movement', 'Hate Crimes', 'Murders, Attempted Murders and Homicides', 'Content Type: Personal Profile']"
Hosting the Olympics Is a Bad Deal,2021-07-24,article,News,"Even in normal times, the Games don’t pay off, argues the economist Andrew Zimbalist.",The New York Times,Business,Business Day,"['Olympic Games', 'Olympic Games (2020)']"
"U.S. to Announce Troop Drawdown From Iraq, but Little Is Expected to Change",2021-07-24,article,News,The deal appears to be the latest effort by the Iraqi prime minister to balance the needs and demands of the country’s two closest allies: the United States and Iran.,The New York Times,Foreign,World,"['Iraq War (2003-11)', 'United States Defense and Military Forces', 'United States International Relations', 'Politics and Government']"
Amateur Fossil Hunters Make Rare Find in U.K. Using Google Earth,2021-07-24,article,News,"While some indulged in baking through lockdown, a husband-and-wife team discovered an exceptionally large and well-preserved group of Jurassic starfish.",The New York Times,Foreign,World,"['Paleontology', 'Fossils', 'Starfish', 'Museums', 'Quarries']"
"A Grandfather Died in ‘Swatting’ Over His Twitter Handle, Officials Say",2021-07-24,article,News,Mark Herring had a fatal heart attack after the police swarmed his house after a fake emergency call. A Tennessee man was sentenced to five years in prison in connection with the episode.,The New York Times,Express,U.S.,"['Swatting (Crime)', 'Computers and the Internet', 'Social Media', 'Deaths (Fatalities)']"
Cambodia forces people into bleak quarantine camps as an outbreak rages.,2021-07-24,article,News,,The New York Times,Foreign,World,[]
