headline,date,doc_type,type_of_material,snippet,source,news_desk,section_name,keywords
"The village of Müsch lost its power, running water and cellphone coverage. Then it lost its bridge.",2021-07-16,article,News,"The riverbanks were scenes of devastation, with crushed cars and thick tree stumps, while many of the cobbled streets were covered with mud and debris.",The New York Times,Foreign,World,['Floods']
"Haitian Ex-Intelligence Officer Gave Order to Kill President, Colombia Says",2021-07-16,article,News,"The officer initially told two Colombian soldiers that they would be “arresting” the president, Colombian police said. The order, they said, changed days before the operation.",The New York Times,Foreign,World,"['Assassinations and Attempted Assassinations', 'Politics and Government']"
Two Men Charged With Plotting to Blow Up California Democratic Headquarters,2021-07-16,article,News,The men consulted with an antigovernment paramilitary organization and hoped to start a “movement” that could keep former President Donald J. Trump in office.,The New York Times,National,U.S.,"['Terrorism', 'Bombs and Explosives', 'Right-Wing Extremism and Alt-Right', 'Presidential Election of 2020', 'United States Politics and Government']"
European Floods Are Latest Sign of a Global Warming Crisis,2021-07-16,article,News,"Floods like these, which have left more than 100 dead, had not been seen in perhaps 1,000 years. For many, the warnings came too late, raising questions about lapses in Germany’s flood alert system.",The New York Times,Foreign,World,"['Floods', 'Global Warming', 'Politics and Government', 'Rivers', 'Rain', 'Deaths (Fatalities)']"
Judge Rules DACA Is Unlawful and Suspends Applications,2021-07-16,article,News,"The judge said President Barack Obama exceeded his authority when he created the program, but for now people protected under it will retain the ability to stay and work in the United States.",The New York Times,National,U.S.,"['Deferred Action for Childhood Arrivals', 'Decisions and Verdicts', 'Immigration and Emigration', 'Illegal Immigration', 'United States Politics and Government']"
C.D.C. Director Warns of a ‘Pandemic of the Unvaccinated’,2021-07-16,article,News,"Cases, hospitalizations and deaths remain far below last winter’s peak, but the director urged people to get fully vaccinated.",The New York Times,Science,Health,"['Coronavirus (2019-nCoV)', 'Vaccination and Immunization', 'Disease Rates', 'Masks', 'your-feed-health', 'your-feed-science']"
Coronavirus Briefing: What Happened Today,2021-07-16,article,News,Africa’s crisis.,The New York Times,NYTNow,U.S.,[]
‘It Is All Connected’: Extreme Weather in the Age of Climate Change,2021-07-16,article,News,The storm that brought flooding and devastation to parts of Europe is the latest example of an extreme weather event. More are expected.,The New York Times,Climate,Climate,"['Global Warming', 'Greenhouse Gas Emissions', 'Floods', 'Weather', 'Rivers', 'Deaths (Fatalities)']"
"‘Rogue’ U.S. Agency Used Racial Profiling to Investigate Commerce Dept. Employees, Report Says",2021-07-16,article,News,"An obscure federal office operated for more than a decade as an “unaccountable police force” inside the Commerce Department, using extreme and unauthorized tactics.",The New York Times,Washington,U.S.,"['Chinese-Americans', 'Discrimination', 'Surveillance of Citizens by Government', 'Espionage and Intelligence Services', 'Classified Information and State Secrets', 'Whistle-Blowers', 'United States Politics and Government']"
‘They’re Killing People’: Biden Denounces Social Media for Virus Disinformation,2021-07-16,article,News,The president’s blunt statement capped weeks of frustration in the White House over the spread of vaccine disinformation on Facebook and other platforms.,The New York Times,Washington,U.S.,"['Coronavirus (2019-nCoV)', 'Rumors and Misinformation', 'Vaccination and Immunization', 'Social Media', 'Computers and the Internet', 'United States Politics and Government', 'Surgeon General (US)']"
Monkeypox Case Is Discovered in Texas,2021-07-16,article,News,The rare but potentially serious viral illness was identified in a Dallas resident who had recently returned from Nigeria. Health officials said there was very little risk to the public.,The New York Times,Express,U.S.,"['Viruses', 'AIRLINES AND AIRPLANES']"
"After Cuomo’s Closest Aides Testify, Now It’s His Turn",2021-07-16,article,News,"Investigators are focused on accusations of sexual harassment against the governor, as well as on the broader workplace culture in his office.",The New York Times,Metro,New York,"['Sexual Harassment', 'Workplace Hazards and Violations', 'Politics and Government']"
2 Sinkholes in a Week Signal Weak Spots in N.Y.C.’s Aging Infrastructure,2021-07-16,article,News,What caused the craters was unclear. But their appearance raised questions about the scope of pre-emptive repairs that are needed.,The New York Times,Metro,New York,"['Sinkholes', 'Infrastructure (Public Works)']"
"In Slain Haitian Leader’s Hometown, Fear and a Vow: ‘We’ll Kill Them, Too’",2021-07-16,article,News,"At memorial events for President Jovenel Moïse in northern Haiti, residents blamed the elite for his death, and their plight.",The New York Times,Foreign,World,"['Politics and Government', 'Assassinations and Attempted Assassinations', 'Funerals and Memorials', 'Agriculture and Farming', 'Bananas', 'Income Inequality', 'Corruption (Institutional)']"
The number of migrants arriving at the border was the largest in years.,2021-07-16,article,News,"The number of migrant children and teenagers arriving at the border increased slightly from May, but the influx has slowed since early spring, when a steep surge created President Biden’s first immigration crisis as president.",The New York Times,Washington,U.S.,"['Immigration and Emigration', 'Illegal Immigration']"
My Most Memorable Interview With a Residential School Survivor,2021-07-16,article,News,A poet and educator talks about life in the former residential school near Kamloops as his First Nation looks at next steps.,The New York Times,Foreign,World,"['Indigenous People', 'Private and Sectarian Schools', 'Child Abuse and Neglect', 'Discrimination']"
6-Year-Old Girl in Washington Is Fatally Shot While Riding Scooter,2021-07-17,article,News,"The shooting in the nation’s capital on Friday night also left five adults wounded, according to the police, who pleaded with the public for help.",The New York Times,Express,U.S.,"['Mass Shootings', 'Murders, Attempted Murders and Homicides']"
Miami Embraces Cuba Protests: ‘I Never Thought That This Day Would Come’,2021-07-17,article,News,"The giddy anticipation that real change might happen on the island is tempered by wariness, especially from older exiles, that this might be one more disappointment.",The New York Times,National,U.S.,"['Cuban-Americans', 'Demonstrations, Protests and Riots', 'United States International Relations']"
"Two Rods and a ‘Sixth Sense’: In Drought, Water Witches Are Swamped",2021-07-17,article,News,"Amid California’s drought, desperate landowners and managers are turning to those who practice an ancient, disputed method for locating water.",The New York Times,National,U.S.,"['Water', 'Wells', 'Drought', 'Agriculture and Farming', 'Wines', 'Occult Sciences', 'audio-negative-tragedy', 'audio-negative-sad', 'audio-neutral-informative']"
"In Texas, Top Two Republicans Steer Ship of State Hard to the Right",2021-07-17,article,News,"Different in style and background, Gov. Greg Abbott and Lt. Gov. Dan Patrick have come together, for different reasons, to push an uncompromising conservative agenda.",The New York Times,Politics,U.S.,"['State Legislatures', 'Voter Registration and Requirements', 'Law and Legislation', 'Conservatism (US Politics)', 'Politics and Government', 'Elections, Governors', 'Elections, Lieutenant Governors', 'Primaries and Caucuses', 'Right-Wing Extremism and Alt-Right', 'United States Politics and Government']"
How Republican Vaccine Opposition Got to This Point,2021-07-17,article,News,"In recent months, Republican skepticism of Covid vaccines and their rollout has grown louder: One recent poll found that 47 percent said they weren’t likely to get vaccinated.",The New York Times,Politics,U.S.,"['Coronavirus (2019-nCoV)', 'Vaccination and Immunization', 'Rumors and Misinformation', 'State Legislatures', 'States (US)', 'United States Politics and Government']"
"How to Have a Fun, Multigenerational Family Vacation",2021-07-17,article,News,Sometimes a trip with small children means the same chores in a different place. Here’s advice on how to make it a vacation.,The New York Times,Travel,Travel,"['Travel and Vacations', 'Grandparents', 'Children and Childhood', 'Families and Family Life', 'Parenting']"
Where Are the Fans for Israel’s National Baseball Team? In New York.,2021-07-17,article,News,The Tokyo-bound Israeli national baseball team has more supporters in New York than in its home country.,The New York Times,Metro,New York,"['Jews and Judaism', 'Baseball', 'Olympic Games (2020)', 'audio-neutral-informative', 'audio-neutral-immersive']"
The New Magazines and Journals Shaping Africa’s Literary Scene,2021-07-17,article,News,"Lolwe, Doek and other digital publications are helping to amplify new voices from the continent.",The New York Times,Culture,World,"['Books and Literature', 'Magazines', 'Writing and Writers', 'Book Trade and Publishing']"
Democrats See Edge in Early Senate Map as Trump Casts Big Shadow,2021-07-17,article,News,Early fund-raising has given Democrats cause for optimism in key states as Republicans split over how closely to align with Donald Trump’s preferences.,The New York Times,Politics,U.S.,"['Midterm Elections (2022)', 'Elections, Senate', 'Campaign Finance', 'United States Politics and Government']"
"As Lebanon Collapses, the Man With an Iron Grip on Its Finances Faces Questions",2021-07-17,article,News,"People can’t get their money from banks, the currency has crashed and Riad Salameh’s reign at the central bank is facing allegations of fraud.",The New York Times,Business,Business Day,"['Banking and Financial Institutions', 'Corruption (Institutional)', 'Money Laundering', 'Embezzlement', 'Politics and Government']"
"Back to Militias, the Chaotic Afghan Way of War",2021-07-17,article,News,"Concerned by the Taliban’s offensive, regional power brokers are again recruiting and arming volunteer militias. But some fear the quick fix will lead to a wider breakdown.",The New York Times,Foreign,World,"['Afghanistan War (2001- )', 'Defense and Military Forces', 'Draft and Recruitment (Military)', 'Uzbeks (Ethnic Group)', 'Hazaras (Ethnic Group)', 'Terrorism']"
How One of the World’s Biggest Ships Jammed the Suez Canal,2021-07-17,article,News,"Four months after the megaship Ever Given got stuck in the canal, neither the canal nor the shipping industry has addressed some of the most critical issues that led to the grounding.",The New York Times,Foreign,World,"['Ships and Shipping', 'Maritime Accidents and Safety', 'Canals', 'Pilots', 'Tugboats and Towboats', 'Weather', 'Dust and Sand Storms']"
"New evacuations are ordered in Germany, even as other residents return home after the floods.",2021-07-17,article,News,,The New York Times,Foreign,World,[]
Should You Worry About Inflation? Experts Weigh In.,2021-07-17,article,News,"Most agree the recent spike in prices is linked to the economic recovery. When it will fade, and by how much, are less clear.",The New York Times,Business,Business Day,"['United States Economy', 'Inflation (Economics)', 'Consumer Price Index']"
"Hospital Fires Outrage Iraqis, but They See Little Hope for Change",2021-07-17,article,News,"Two catastrophic fires in coronavirus wards are symptoms of the mismanagement and corruption that have left millions of Iraqis without proper health care, reliable electricity or clean water.",The New York Times,Foreign,World,"['Hospitals', 'Fires and Firefighters', 'Deaths (Fatalities)', 'Coronavirus (2019-nCoV)', 'Politics and Government', 'Corruption (Institutional)']"
"As Frozen Land Burns, Siberia Fears: ‘If We Don’t Have the Forest, We Don’t Have Life’",2021-07-17,article,News,Northeastern Siberia is a place where people take Arctic temperatures in stride. But 100-degree days are another matter entirely.,The New York Times,Foreign,World,"['Wildfires', 'Global Warming', 'Fires and Firefighters', 'Forests and Forestry']"
Will a Swimming Pool Help or Hurt Your Property Value?,2021-07-17,article,News,"You might love the idea of a backyard pool, but not everyone else does, particularly in a part of the country where summers are relatively short.",The New York Times,RealEstate,Real Estate,"['Real Estate and Housing (Residential)', 'Swimming Pools', 'Restoration and Renovation']"
Israeli Companies Aided Saudi Spying Despite Khashoggi Killing,2021-07-17,article,News,"Ignoring concerns that Saudi Arabia was abusing Israeli spyware to crush dissent at home and abroad, Israel encouraged its companies to work with the kingdom.",The New York Times,Foreign,World,"['Politics and Government', 'Defense and Military Forces', 'Surveillance of Citizens by Government', 'Assassinations and Attempted Assassinations', 'Government Contracts and Procurement', 'Human Rights and Human Rights Violations', 'Cyberattacks and Hackers', 'Espionage and Intelligence Services']"
‘A Special Sadness’: Floods Bring Death to a German Care Home,2021-07-17,article,News,"Given no warning and trapped by fast-rising waters, 12 disabled residents of a care home drowned before aid could arrive, shaking Germans everywhere.",The New York Times,Foreign,World,"['Floods', 'Drownings', 'Disabilities', 'Deaths (Fatalities)', 'Rain']"
Less vaccinated states are feeling the force of Delta’s surge in the U.S.,2021-07-17,article,News,"The highly contagious variant now makes up a majority of the country’s new cases, and hospitalization rates are up in states where vaccination rates are relatively low. Still, Covid-related deaths are expected to stay well below previous levels.",The New York Times,Foreign,World,[]
"Many travelers to England may skip quarantine as of Monday, but not those from France, where Beta is present.",2021-07-17,article,News,"Most virus-related restrictions in England will be lifted on “freedom day,” but travelers arriving from France must quarantine for five to 10 days, regardless of vaccination status.",The New York Times,Foreign,World,"['Coronavirus (2019-nCoV)', 'Vaccination and Immunization', 'Travel and Vacations']"
There’s a Sauce for That,2021-07-17,article,News,"Jazz up those simple, no-cook or no-frills summer dishes with an easy green sauce or chile crisp.",The New York Times,Dining,Admin,[]
‘No One Is Safe’: Extreme Weather Batters the Wealthy World,2021-07-17,article,News,"Floods swept Germany, fires ravaged the American West and another heat wave loomed, driving home the reality that the world’s richest nations remain unprepared for the intensifying consequences of climate change.",The New York Times,Climate,Climate,"['Global Warming', 'Greenhouse Gas Emissions', 'Floods', 'Wildfires', 'Heatstroke', 'Deaths (Fatalities)', 'Politics and Government', 'United Nations Framework Convention on Climate Change', 'Heat and Heat Waves']"
Floods Thrust Climate Change to Center of German Campaign as Toll Mounts,2021-07-17,article,News,"With more than 160 dead across the region, the receding waters revealed extensive damage as well as deep political divides around how far and fast Germans should go to stem carbon use.",The New York Times,Foreign,World,"['Floods', 'Politics and Government', 'Global Warming', 'Weather', 'Deaths (Fatalities)', 'Elections']"
Investors Bet on Foie Gras Grown From Cells in a Lab,2021-07-17,article,News,"Gourmey, a start-up based in Paris, received an additional $10 million in seed funding this week. The company hopes to find a market in the United States amid growing concerns about animal cruelty.",The New York Times,Express,Business Day,"['Foie Gras', 'Genetically Modified Food (GMOs)', 'Meat', 'Animal Abuse, Rights and Welfare', 'Venture Capital', 'Start-ups', 'Agriculture and Farming', 'Sustainable Living']"
Collapse Raises New Fears About Florida’s Shaky Insurance Market,2021-07-17,article,News,Insurers were already skittish after losses from repeated hurricanes. The recent condo collapse has brought new insecurity. How long will Florida’s coast be insurable?,The New York Times,National,U.S.,"['Surfside, Fla, Building Collapse (2021)', 'Homeowners Insurance', 'Buildings (Structures)', 'Suits and Litigation (Civil)', 'Hurricanes and Tropical Storms', 'Real Estate and Housing (Residential)', 'Coastal Areas', 'Global Warming']"
"In Undervaccinated Arkansas, Covid Upends Life All Over Again",2021-07-17,article,News,"While much of the nation tiptoes toward normalcy, the coronavirus is again swamping hospitals in places like Mountain Home, in a rural county where fewer than one-third of residents are vaccinated.",The New York Times,Washington,U.S.,"['Coronavirus (2019-nCoV)', 'Vaccination and Immunization', 'Disease Rates', 'Hospitals', 'Rural Areas', 'Deaths (Fatalities)']"
"Britain’s health secretary, Sajid Javid, tests positive for the coronavirus.",2021-07-17,article,News,"He announced the results of a rapid test in a video posted on Twitter, and said he was isolating while awaiting confirmation with a P.C.R. test.",The New York Times,Foreign,World,"['Coronavirus (2019-nCoV)', 'Vaccination and Immunization']"
Positive coronavirus tests halt the production of ‘Bridgerton’ in the U.K. twice in three days.,2021-07-17,article,News,"On Saturday, a spokeswoman for Netflix declined to say whether the test that caused the second halt was that of a cast member or a crew member.",The New York Times,Culture,World,"['Coronavirus (2019-nCoV)', 'Web-Original Programming']"
5 Texas Democrats who fled their state to stall a voting bill test positive in Washington.,2021-07-17,article,News,"The Texas House Democratic Caucus did not name the five lawmakers, but said they were all fully vaccinated.",The New York Times,Express,World,"['Coronavirus (2019-nCoV)', 'Vaccination and Immunization', 'State Legislatures']"
Los Angeles County’s sheriff declines to enforce the mask mandate about to resume.,2021-07-17,article,News,"Sheriff Alex Villanueva has repeatedly declined to enforce Covid restrictions, including a statewide stay-at-home order last winter.",The New York Times,National,World,"['Coronavirus (2019-nCoV)', 'Masks', 'Quarantines', 'Disease Rates']"
Overlooked No More: ‘Skipped History’ Explores Forgotten Events,2021-07-17,article,News,"A comedy web series hosted by a historical satirist explores overlooked ideas, people and events that continue to shape the United States.",The New York Times,National,U.S.,"['Politics and Government', 'Books and Literature', 'Web-Original Programming', 'Education (K-12)', 'History (Academic Subject)', 'Comedy and Humor', 'Race and Ethnicity']"
The Pandemic Has a New Epicenter: Indonesia,2021-07-17,article,News,"The suffering that ravaged places like India and Brazil — with deaths soaring, hospitals overwhelmed and oxygen running out — has reached Southeast Asia.",The New York Times,Foreign,World,"['Coronavirus (2019-nCoV)', 'Disease Rates', 'Oxygen', 'Hospitals', 'Vaccination and Immunization', 'Shortages']"
26 People Hospitalized After Chemical Exposure at Texas Water Park,2021-07-18,article,News,"One person was in critical condition after the victims were exposed to bleach and sulfuric acid, which are used to maintain pH balance, the authorities said.",The New York Times,Express,U.S.,"['AMUSEMENT AND THEME PARKS', 'Hazardous and Toxic Substances', 'Swimming Pools']"
Guantánamo Prosecutors Ask to Strike Information Gained From Torture,2021-07-18,article,News,"The prosecutors’ use of information from a brutal interrogation had troubled Biden administration lawyers and was a source of tension with the chief prosecutor at Guantánamo Bay, who will retire soon.",The New York Times,Washington,U.S.,"['Suits and Litigation (Civil)', 'Detainees', 'Torture', 'Interrogations', 'United States Defense and Military Forces', 'Terrorism', 'Military Tribunals']"
Facebook Tells Biden: ‘Facebook Is Not the Reason’ Vaccination Goal Was Missed,2021-07-18,article,News,The social network and the Biden administration have engaged in an increasingly rancorous war of words over the issue of vaccine misinformation.,The New York Times,Business,Technology,"['Social Media', 'Rumors and Misinformation', 'Vaccination and Immunization', 'Computers and the Internet', 'United States Politics and Government', 'Coronavirus (2019-nCoV)']"
3 Are Shot Outside Nationals Park in Washington,2021-07-18,article,News,"Fans poured out of the stadium in a scene of fear and confusion and the game, against the San Diego Padres, was halted. The police said they were searching for a gray Toyota Corolla.",The New York Times,Express,U.S.,"['Baseball', 'Murders, Attempted Murders and Homicides']"
‘I Was 10 Blocks Into My Walk When I Saw a Tall Man Striding South’,2021-07-18,article,News,"A mysterious, elegant man, a quick cut and more reader tales of New York City in this week’s Metropolitan Diary.",The New York Times,Metropolitan,New York,[]
"Fear, and Discord, Among Asian Americans Over Attacks in San Francisco",2021-07-18,article,News,"A string of attacks against older people of Asian descent has led to calls for more police officers, an idea rejected by the city’s Asian American leaders.",The New York Times,National,U.S.,"['Asian-Americans', 'Hate Crimes', 'Assaults', 'Discrimination', 'audio-negative-tragedy', 'audio-negative-sad']"
U.S. Habit of Backing Strongman Allies Fed Turmoil in Haiti,2021-07-18,article,News,"Washington dismissed warnings that democracy was unraveling under President Jovenel Moïse, leaving a gaping leadership void after his assassination.",The New York Times,Foreign,World,"['Politics and Government', 'Assassinations and Attempted Assassinations', 'Human Rights and Human Rights Violations', 'United States International Relations', 'Demonstrations, Protests and Riots', 'Elections', 'United States Politics and Government']"
Boris Johnson Finds Himself in a Quandary Over Racism and Sports,2021-07-18,article,News,The British prime minister is under fire for failing to condemn crowds who booed when England’s soccer players took a knee during the European Championship.,The New York Times,Foreign,World,"['Politics and Government', 'Black People', 'Blacks', 'Soccer', 'Discrimination', 'Demonstrations, Protests and Riots']"
Jury Awards $125 Million After Walmart Fires Woman With Down Syndrome,2021-07-18,article,News,"Walmart said the verdict would be reduced to $300,000, which is the maximum amount allowed under federal law for compensatory and punitive damages.",The New York Times,Express,Business Day,"['Compensation for Damages (Law)', 'Workplace Hazards and Violations', 'Down Syndrome', 'Discrimination', 'AMERICANS WITH DISABILITIES ACT', 'Shopping and Retail', 'Working Hours', 'Suits and Litigation (Civil)']"
The Pandemic Safety Net Is Coming Apart. Now What?,2021-07-18,article,News,"The eviction moratorium expires at the end of the month. Unemployment enhancements after that. And then the student loan pause, food stamp provisions and more. Here’s advice on how to cope.",The New York Times,Business,Your Money,"['Personal Finances', 'Content Type: Service', 'Coronavirus (2019-nCoV)', 'Mortgages', 'Unemployment Insurance', 'Real Estate and Housing (Residential)', 'Evictions', 'Layoffs and Job Reductions', 'Health Insurance and Managed Care', 'American Rescue Plan (2021)', 'Coronavirus Aid, Relief, and Economic Security Act (2020)', 'Foreclosures', 'Vaccination and Immunization']"
"Scorched, Parched and Now Uninsurable: Climate Change Hits Wine Country",2021-07-18,article,News,Sunscreen on grapes. Toilet water that is treated and used for irrigation. Napa Valley winemakers are taking extreme steps in the face of climate change.,The New York Times,Climate,Climate,"['Global Warming', 'Wines', 'Grapes', 'Wildfires', 'Water', 'Insurance', 'Agriculture and Farming', 'Drought']"
"The Week in Business: Inflation, Billionaires in Space and Other Things Going Up",2021-07-18,article,News,"Prices are rising. China's economy is still growing, but at a slower pace. And airline travel is back.",The New York Times,SundayBusiness,Business Day,"['United States Economy', 'Economic Conditions and Trends', 'Inflation (Economics)', 'Coronavirus (2019-nCoV)']"
"OPEC Plus Agrees on Oil Production Increase, Easing Pressure on Supplies and Prices",2021-07-18,article,News,The pact clears the way for the group to pump more oil as global economies revive from pandemic lockdowns.,The New York Times,Business,Business Day,"['Oil (Petroleum) and Gasoline', 'Production', 'Global Warming']"
"Boris Johnson to Self-Isolate, Reversing Plan to Enter N.H.S. Pilot Program",2021-07-18,article,News,"The British prime minister and his top finance official were “pinged” by the health service’s test-and-trace app as contacts of the health minister, who has tested positive for the coronavirus.",The New York Times,Foreign,World,"['Quarantines', 'Politics and Government', 'Coronavirus (2019-nCoV)']"
Merkel Visits Flood Region as Toll Continues to Mount,2021-07-18,article,News,"The chancellor met with those who lost their homes and with rescue teams and German Army troops searching for survivors, as the number of dead rose above 180 in Europe.",The New York Times,Foreign,World,"['Floods', 'Rain', 'Aviation Accidents, Safety and Disasters', 'Politics and Government', 'Rescues']"
